Original,Translate_IT
Sì tosto come l'ultima parola,Non appena la fiamma benedetta si era alzata
"la benedetta fiamma per dir tolse,","L'ultima parola per dargli la parola,"
a rotar cominciò la santa mola;,"Iniziarono la macina sacra a ruotare,"
e nel suo giro tutta non si volse,"E nel suo giro non si era girato del tutto,"
"prima ch'un'altra di cerchio la chiuse,","Prima che un altro in un anello lo racchiudesse,"
e moto a moto e canto a canto colse;,"Mozione unita al movimento, canzone al canto;"
"canto che tanto vince nostre muse,","Canto che trascende grandemente le nostre Muse,"
"nostre serene in quelle dolci tube,","Le nostre Sirene, in quei dulcit clarions,"
quanto primo splendor quel ch'e' refuse.,Come splendore primordiale ciò che si riflette.
Come si volgon per tenera nube,E come sono sparsi athwart una nuvola tenera
"due archi paralelli e concolori,","Due arcobaleni paralleli e a colori,"
"quando Iunone a sua ancella iube,","Quando Giunone alla sua serva dà il comando,"
"nascendo di quel d'entro quel di fori,","(Colui che non è nato da colui che è dentro,"
a guisa del parlar di quella vaga,Mi piace parlare di quel vagabondo.
"ch'amor consunse come sol vapori,","che l'amore consumato come il sole i vapori,)"
"e fanno qui la gente esser presaga,","E fai il popolo qui, attraverso il patto"
"per lo patto che Dio con Noè puose,","Dio si mise con Noè, presuntuoso del mondo"
del mondo che già mai più non s'allaga:,"che non sarà più coperto da un diluvio,"
così di quelle sempiterne rose,In tal saggio di quelle rose sempiternal
"volgiensi circa noi le due ghirlande,","Le ghirlande ci circondavano,"
e sì l'estrema a l'intima rispuose.,E così l'esterno all'interno rispose.
"Poi che 'l tripudio e l'altra festa grande,","Dopo il ballo, e altre grandi gioie,"
sì del cantare e sì del fiammeggiarsi,Entrambi i canti e le fiamme
"luce con luce gaudïose e blande,","Efvulgenza con efflusione blithe e tenera,"
"insieme a punto e a voler quetarsi,","Insieme, subito, con un accordo si era fermato,"
pur come li occhi ch'al piacer che i move,"(Anche come gli occhi, che, come la volontà li muove,"
conviene insieme chiudere e levarsi;,"Deve avere bisogno insieme di chiudere e sollevare se stessi,)"
del cor de l'una de le luci nove,Fuori dal cuore di una delle nuove luci
"si mosse voce, che l'ago a la stella","C'era una voce, quell'ago sulla stella."
parer mi fece in volgermi al suo dove;,Mi ha fatto apparire mentre mi voltavo verso il basso.
e cominciò: “L'amor che mi fa bella,"E cominciò: ""L'amore che mi rende giusto"
mi tragge a ragionar de l'altro duca,"Mi attira a parlare dell'altro leader,"
per cui del mio sì ben ci si favella.,Da chi così bene è parlato qui del mio.
"Degno è che, dov'è l'un, l'altro s'induca:","E' giusto, dov'e' l'uno, portare l'altro,"
"sì che, com'elli ad una militaro,","che, mentre erano uniti nella loro guerra,"
così la gloria loro insieme luca.,Insieme anche la loro gloria brilli.
"L'essercito di Cristo, che sì caro","Il soldato di Cristo, che aveva costato"
"costò a rïarmar, dietro a la 'nsegna","Così caro da armare di nuovo, dietro lo standard"
"si movea tardo, sospeccioso e raro,","Spostato lento e dubbioso e in pochi numeri,"
quando lo 'mperador che sempre regna,Quando l'imperatore che regna sempre
"provide a la milizia, ch'era in forse,","Fornito per l'ospite che era in pericolo,"
"per sola grazia, non per esser degna;",solo per grazia e non per merito;
"e, come è detto, a sua sposa soccorse","E, come è stato detto, egli alla sua sposa portò soccorso"
"con due campioni, al cui fare, al cui dire","Con i campioni due, a cui atto, a cui parola"
lo popol disvïato si raccorse.,Le persone straggling sono stati disegnati insieme.
In quella parte ove surge ad aprire,All'interno di quella regione dove il dolce vento dell'ovest
Zefiro dolce le novelle fronde,"Cresce per aprire le nuove foglie, con"
"di che si vede Europa rivestire,","Si vede che l'Europa si veste di nuovo,"
non molto lungi al percuoter de l'onde,"Non lontano dal battere le onde,"
"dietro a le quali, per la lunga foga,",Dietro il quale nella sua lunga carriera il sole
"lo sol talvolta ad ogne uom si nasconde,","A volte si nasconde da ogni uomo,"
siede la fortunata Calaroga,"Si trova la fortunata Calahorra,"
sotto la protezion del grande scudo,Sotto la protezione del possente scudo
in che soggiace il leone e soggioga:,In cui il Leone è soggetto e sovrano.
dentro vi nacque l'amoroso drudo,Lì nacque l'amoreso paramour
"de la fede cristiana, il santo atleta","Di fede cristiana, l'atleta consacra,"
benigno a' suoi e a' nemici crudo;,Gentile con i suoi nemici e crudele con i suoi nemici;
"e come fu creata, fu repleta",E quando è stato creato era la sua mente
"sì la sua mente di viva vertute,","Piena di tanta energia vivente,"
"che, ne la madre, lei fece profeta.",Che in sua madre ha reso profetica.
Poi che le sponsalizie fuor compiute,Non appena gli espousals sono stati completati
"al sacro fonte intra lui e la Fede,","Tra lui e la fede a santa fonte,"
"u' si dotar di mutüa salute,","Dove con mutua sicurezza si dormivano a vicenda,"
"la donna che per lui l'assenso diede,","La donna che per lui aveva dato il suo assenso,"
vide nel sonno il mirabile frutto,Sega in un sogno il frutto ammirevole
ch'uscir dovea di lui e de le rede;,Quell'episodio sarebbe stato da lui e dai suoi eredi;
"e perché fosse qual era in costrutto,","E che potesse essere interpretato com'era,"
quinci si mosse spirito a nomarlo,Uno spirito da questo luogo è andato avanti a chiamarlo
del possessivo di cui era tutto.,Con il Suo possessivo di cui era interamente.
Domenico fu detto; e io ne parlo,Dominic è stato chiamato; e lui io parlo di
sì come de l'agricola che Cristo,Anche come del marito che Cristo
elesse a l'orto suo per aiutarlo.,Eletto nel suo giardino per aiutarlo.
Ben parve messo e famigliar di Cristo:,"Inviato e servo lenitivo sembrava di Cristo,"
"ché 'l primo amor che 'n lui fu manifesto,",Per il primo amore manifestato in lui
fu al primo consiglio che diè Cristo.,Fu il primo consiglio che fu dato da Cristo.
Spesse fïate fu tacito e desto,Silenzioso e sveglio molte volte era
"trovato in terra da la sua nutrice,","Scoperto dalla sua infermiera a terra,"
come dicesse: 'Io son venuto a questo'.,"Come se avesse detto: ""Per questo sono venuto."""
Oh padre suo veramente Felice!,"Oh, suo padre, Felix, in verità!"
"oh madre sua veramente Giovanna,","O sua madre, in verità Giovanna,"
"se, interpretata, val come si dice!","Se questo, interpretato, significa come si dice!"
"Non per lo mondo, per cui mo s'affanna",Non per il mondo che la gente fatica per ora
"di retro ad Ostïense e a Taddeo,","Seguendo Ostiense e Taddeo,"
ma per amor de la verace manna,"Ma attraverso il suo desiderio dopo la vera manna,"
in picciol tempo gran dottor si feo;,"In breve tempo divenne così grande un insegnante,"
tal che si mise a circüir la vigna,"che cominciava a girare intorno alla vigna,"
"che tosto imbianca, se 'l vignaio è reo.","che presto svanisce, se infedele sia il vestitore,"
E a la sedia che fu già benigna,e del vedere (che un tempo era più benigno
"più a' poveri giusti, non per lei,","ai giusti poveri, non per mezzo di se stessi,"
"ma per colui che siede, che traligna,","Ma colui che siede lì e degenera,"
"non dispensare o due o tre per sei,","Non dispensare o due o tre per sei,"
"non la fortuna di prima vacante,","Nessuna fortuna di primo posto vacante,"
"non decimas, quae sunt pauperum Dei,","Non decimas quae sunt pauperum Dei,"
"addimandò, ma contro al mondo errante","Ha chiesto, ma contro il mondo errante"
licenza di combatter per lo seme,"Permesso di combattere per il seme,"
del qual ti fascian ventiquattro piante.,Di cui queste quattro e venti piante ti circondano.
"Poi, con dottrina e con volere insieme,","Poi con la dottrina e la volontà insieme,"
con l'officio appostolico si mosse,"Con l'ufficio apostolico si trasferì,"
quasi torrente ch'alta vena preme;,Come il torrente che alcune alte vene out-presse;
e ne li sterpi eretici percosse,E tra gli scatti eretici
"l'impeto suo, più vivamente quivi","Colpì il suo impeto con una maggiore furia,"
dove le resistenze eran più grosse.,Ovunque la resistenza fosse la piu' grande.
Di lui si fecer poi diversi rivi,"Di lui sono stati fatti in seguito subacquei runnel,"
"onde l'orto catolico si riga,","dove il garden cattolico è annaffiato,"
sì che i suoi arbuscelli stan più vivi.,Cosi' che le sue piantagioni siano piu' vive.
Se tal fu l'una rota de la biga,"Se così l'unica ruota della Biga era,"
in che la Santa Chiesa si difese,In cui la Santa Chiesa stessa ha difeso
"e vinse in campo la sua civil briga,","E sul campo vinse la sua battaglia civica,"
ben ti dovrebbe assai esser palese,Veramente la piena manifestazione dovrebbe essere per te
"l'eccellenza de l'altra, di cui Tomma","L'eccellenza dell'altro, a cui"
dinanzi al mio venir fu sì cortese.,Thomas era cosi' cortese prima che venissi.
Ma l'orbita che fé la parte somma,"Ma ancora l'orbita, che la parte più alta"
"di sua circunferenza, è derelitta,","Della sua circonferenza fatta, è abbandonato,"
sì ch'è la muffa dov'era la gromma.,Cosi' che lo stampo fosse dove una volta c'era la crosta.
"La sua famiglia, che si mosse dritta","La sua famiglia, che si era spostata dritta in avanti"
"coi piedi a le sue orme, è tanto volta,","Con i piedi sulle sue orme, sono girati"
che quel dinanzi a quel di retro gitta;,Così che mettessero il punto sul tallone.
e tosto si vedrà de la ricolta,E ben presto saranno consapevoli della mietitura
"de la mala coltura, quando il loglio","Di questa cattiva zootecnia, quando dovrà la zizzania"
si lagnerà che l'arca li sia tolta.,Lamentate che il granaio sia stato loro tolto.
"Ben dico, chi cercasse a foglio a foglio","Eppure dico io, colui che perquisisce foglia per foglia"
"nostro volume, ancor troveria carta","Il nostro volume attraverso, sarebbe ancora qualche pagina scoprire"
"u' leggerebbe ""I' mi son quel ch'i' soglio"";","Dove poteva leggere: ""Io sono come io non lo sono."""
"ma non fia da Casal né d'Acquasparta,","Non verrà da Casal né da Acquasparta,"
"là onde vegnon tali a la scrittura,",Da dove viene tale alla parola scritta
ch'uno la fugge e altro la coarta.,"Che uno lo evita, e l'altro si restringe."
Io son la vita di Bonaventura,Bonaventura della vita di Bagnoregio
"da Bagnoregio, che ne' grandi offici","Sono io, che sempre in grandi uffici"
sempre pospuosi la sinistra cura.,Considerazioni rimandate sinistra.
"Illuminato e Augustin son quici,","Qui ci sono Illuminati e Agostino,"
che fuor de' primi scalzi poverelli,Chi dei primi mendicanti scalzi erano
che nel capestro a Dio si fero amici.,Che con la corda gli amici di Dio divennero.
"Ugo da San Vittore è qui con elli,","Hugh di Saint Victor è tra loro qui,"
"e Pietro Mangiadore e Pietro Spano,",Pietro Mangiador e Pietro di Spagna
lo qual giù luce in dodici libelli;,che in basso in volumi dodici brilla;
Natàn profeta e 'l metropolitano,Nathan il veggente e metropolitano
Crisostomo e Anselmo e quel Donato,"Crisostomo, Anselmo e Donato"
ch'a la prim'arte degnò porre mano.,che si è degnato di porre la mano alla prima arte;
"Rabano è qui, e lucemi dallato","Qui c'è Rabanus, e accanto a me qui"
il calavrese abate Giovacchino,"Shines l'abate calabrese Joachim,"
di spirito profetico dotato.,Egli con lo spirito di profezia dotato.
Ad inveggiar cotanto paladino,Per festeggiare un paladino così grande
