Original,Translate_IT
Posto avea fine al suo ragionamento,"Pensa, Lettore, se la nebbia ti avvolge mai,"
"l'alto dottore, e attento guardava","Sulle alpi, attraverso il quale, come attraverso la pelle"
ne la mia vista s'io parea contento;,"Guarda l'occhio della talpa che il tuo sguardo,"
"e io, cui nova sete ancor frugava,",Come se il fumo umido che ti rigirasse...
"di fuor tacea, e dentro dicea: 'Forse","Ora diventa magro e comincia a illuminarsi,"
lo troppo dimandar ch'io fo li grava'.,Poi opaca dentro il giro del sole guarda;
"Ma quel padre verace, che s'accorse","Eppure sei a malapena in grado di immaginarti,"
"del timido voler che non s'apriva,","Come ho visto di nuovo il sole, che"
"parlando, di parlare ardir mi porse.",Vuole scendere nel letto delle onde.
"Ond'io: “Maestro, il mio veder s'avviva","Così, stesso passo con il mio hort, sfuggito"
"sì nel tuo lume, ch'io discerno chiaro","Sono uscito dalla nuvola, come se fossi stato un buio..."
quanto la tua ragion parta o descriva.,"Al raggio, che moriva già sulla spiaggia ereditaria."
"Però ti prego, dolce padre caro,",L'immaginazione che hai dalla sua casa
"che mi dimostri amore, a cui reduci","Di gran lunga rapisce l'anima che non si sente,"
ogne buono operare e 'l suo contraro”.,"Che ci sia un suono di tromba intorno,"
"“Drizza”, disse, “ver' me l'agute luci",Cosa ti eccita se non c'è nulla che tocchi la mente?
"de lo 'ntelletto, e fieti manifesto","La luce del cielo ti eccita, quella che scende"
l'error de' ciechi che si fanno duci.,"Correndo da sé, che conduce anche una volontà."
"L'animo, ch'è creato ad amar presto,",Ho visto l'affare che si muoveva nel piumaggio
"ad ogne cosa è mobile che piace,","L'uccello si è spezzato, l'eterno pentimento e l'inferno"
tosto che dal piacere in atto è desto.,Fate il suono dei dolci canti lamentosi.
Vostra apprensiva da esser verace,E tutto represso fu miracoloso
"tragge intenzione, e dentro a voi la spiega,","Qui la mia anima in se stessa, a nulla inclinando"
sì che l'animo ad essa volger face;,E niente che venga dall'esterno.
"e se, rivolto, inver' di lei si piega,","Su di esso apparve che l'immaginazione discendeva,"
"quel piegare è amor, quell'è natura","Un uomo sulla croce, così ribelle-orgoglio come lui"
che per piacer di novo in voi si lega.,"Era di serenità, mostrandosi anche nella morte."
"Poi, come 'l foco movesi in altura","Ho visto il grande Assuero,"
per la sua forma ch'è nata a salire,"Ester, sua moglie, e Mardocheo, il fedele,"
"là dove più in sua matera dura,",In parole e in realtà tutto intorno a lui.
"così l'animo preso entra in disire,","E questa immagine si è dispersa, a malapena percepita,"
"ch'è moto spiritale, e mai non posa",Come una bolla che ha una luce corta
fin che la cosa amata il fa gioire.,Luccica nell'acqua quando nuotano.
Or ti puote apparer quant'è nascosa,Poi la mia faccia mostrò una fanciulla.
la veritate a la gente ch'avvera,"- O principessa, madre! - esclamò la donna lacrima,"
ciascun amore in sé laudabil cosa;,"""Che cosa volevi essere distrutto dall'ira!"
però che forse appar la sua matera,Sei morto perché la tua Lavinia rimanesse.
"sempre esser buona, ma non ciascun segno","Io sono tuo? Non un'altra morte, costringerlo"
"è buono, ancor che buona sia la cera”.","Il tuo a lacrimonia."""
"“Le tue parole e 'l mio seguace ingegno”,","Proprio come il sonno sgorga in uno spavento tremendo,"
"rispuos'io lui, “m'hanno amor discoverto,","Quando i raggi si rimbalzano sul volto del dormiente,"
ma ciò m'ha fatto di dubbiar più pregno;,"Ma prima che muoia, si ribella e lotta,"
"ché, s'amore è di fuori a noi offerto","Così ora ho visto la mia immagine di sogno cadere,"
"e l'anima non va con altro piede,","Quando una luce mi colpì la faccia, così chiaro,"
"se dritta o torta va, non è suo merto”.",Come mai la Terra non scorre dalle Sale del Cielo.
"Ed elli a me: “Quanto ragion qui vede,","Mi volsi a vedere dov'ero,"
dir ti poss'io; da indi in là t'aspetta,"Quando una voce disse: ""Dovete salire qui! """
"pur a Beatrice, ch'è opra di fede.",Dimenticavo l'altro.
"Ogne forma sustanzïal, che setta",Ha forzato la volonta' di tenderci...
"è da matera ed è con lei unita,","Per vedere chi ha parlato, e ha lasciato che io ammaestrato,"
"specifica vertute ha in sé colletta,",L'imbarazzo non nel mio silenzio.
"la qual sanza operar non è sentita,","Come dal sole che lamentò lo sguardo,"
"né si dimostra mai che per effetto,","Coperto dalla luce eccessiva della loro immagine,"
come per verdi fronde in pianta vita.,Ward dalla lucentezza consuma la mia forza.
"Però, là onde vegna lo 'ntelletto","""Lo spirito celeste è quello di scoprirci la strada,"
"de le prime notizie, omo non sape,","Colui che sale, anche senza che noi supplichiamo,"
"e de' primi appetibili l'affetto,",E nascondersi nella sua luce.
che sono in voi sì come studio in ape,"Il modo in cui facciamo noi stessi è accaduto a noi stessi,"
di far lo mele; e questa prima voglia,"Poiché chi vede la miseria e attende la supplica,"
merto di lode o di biasmo non cape.,E' gia' malvagiamente incline a disdegnarla.
"Or perché a questa ogn'altra si raccoglia,","Su, invocate con un calcio veloce!"
"innata v'è la virtù che consiglia,","Dobbiamo alzarci, prima che le tenebre si avvicinino."
e de l'assenso de' tener la soglia.,"In caso contrario, il giorno risolverà i passi inibiti."""
Quest'è 'l principio là onde si piglia,Il mio capo parlò della roccia
"ragion di meritare in voi, secondo","Noi, voltati verso una trincea, ce ne siamo andati,"
che buoni e rei amori accoglie e viglia.,E come mi sono messo al primo livello...
"Color che ragionando andaro al fondo,","Sento un dolore, come le ali movimentate"
s'accorser d'esta innata libertate;,"In faccia, e suonava forte, vicino a me:"
però moralità lasciaro al mondo.,"""Salve ai Friedfertgen che sconfiggono l'ira."""
"Onde, poniam che di necessitate",Il sole ha visto l'ultimo raggi pallidi
"surga ogne amor che dentro a voi s'accende,","Io sopra di noi, seguito da ombre dormienti."
di ritenerlo è in voi la podestate.,E le stelle sono già apparse qua e là.
La nobile virtù Beatrice intende,"""O mia forza, che cosa devi stancare così!"""
"per lo libero arbitrio, e però guarda","Così pensai in silenzio, perché mi sentivo,"
"che l'abbi a mente, s'a parlar ten prende”.",Che i piedi avevano dei nervi.
"La luna, quasi a mezza notte tarda,",Eravamo sul bordo più alto livello
"facea le stelle a noi parer più rade,","E stavano fermi, come attaccati, là,"
fatta com'un secchion che tuttor arda;,Come una barca nella sabbia.
e correa contra 'l ciel per quelle strade,"Ascolto attentamente solo dopo tutti i luoghi,"
che 'l sole infiamma allor che quel da Roma,Se non c'è nulla da sentire e poi si voltò
tra ' Sardi e ' Corsi il vede quando cade.,Al mio Maestro con queste parole:
E quell'ombra gentil per cui si noma,"""Padre mio dolce, di' che cosa è male"
"Pietola più che villa mantoana,",Ci conduce alla purificazione in questo cerchio.
del mio carcar diposta avea la soma;,"Non lasciare parlare, come i piedi, riposare."""
"per ch'io, che la ragione aperta e piana","""Toccazione per il bene,"" le parole del saggio,"
"sovra le mie quistioni avea ricolta,","""Prima di pagare il debito che vi è stato fatto;"
stava com'om che sonnolento vana.,Qui il rudrè lento diventa rapidamente maturo.
Ma questa sonnolenza mi fu tolta,"Attento, per saperne di piu'..."
subitamente da gente che dopo,Perché altrimenti non saremmo più in grado di fermarci
le nostre spalle a noi era già volta.,Il frutto porta il tuo tempo quando ti istruisci.
E quale Ismeno già vide e Asopo,"Non è creatore, né creatura è senza amore,"
"lungo di sé di notte furia e calca,","Sai, nella natura..."
"pur che i Teban di Bacco avesser uopo,",E nell'anima i loro impulsi si decompongono.
"cotal per quel giron suo passo falca,",La prima non sbaglia mai sulla pista di destra.
"per quel ch'io vidi di color, venendo,",La seconda può mancare nell'oggetto
cui buon volere e giusto amor cavalca.,"E presto essere troppo forte, presto troppo casual solo."
"Tosto fur sovr'a noi, perché correndo","Sa come raggiungere l'obiettivo di scegliere il primo bene,"
si movea tutta quella turba magna;,"Il secondo non è troppo caldo, troppo freddo,"
e due dinanzi gridavan piangendo:,Allora non irrita troppo le anime
“Maria corse con fretta a la montagna;,"Ma si allontana dal male, è presto"
"e Cesare, per soggiogare Ilerda,","Per il bene, troppo zelante presto in corsa,"
punse Marsilia e poi corse in Ispagna”.,Così il Creatore fa violenza alla creatura.
"“Ratto, ratto, che 'l tempo non si perda","Così l'amore deve conoscere come si diventa,"
"per poco amor”, gridavan li altri appresso,","Spargere in voi i semi ad ogni virtù,"
“che studio di ben far grazia rinverda”.,Ma anche per tutto quello che chiamiamo vizi.
“O gente in cui fervore aguto adesso,"Beh, perche' se il suo oggetto e' libero..."
ricompie forse negligenza e indugio,"L'amore alla cui salvezza pascerà,"
"da voi per tepidezza in ben far messo,",Non c'e' niente di cui temere l'odio adatto.
"questi che vive, e certo i' non vi bugio,",E perché nessun essere può separarsi dall'essere originale
"vuole andar sù, pur che 'l sol ne riluca;","E senza questo incarnare per se stesso,"
però ne dite ond'è presso il pertugio”.,Deve sperare di evitare ogni spinta.
Parole furon queste del mio duca;,Percio' puoi... concludere... chiaramente...
e un di quelli spirti disse: “Vieni,L'amore per il prossimo è solo per il male
"di retro a noi, e troverai la buca.",E puo' provenire da una fonte sporca tripla.
"Noi siam di voglia a muoverci sì pieni,",Spera di salire alla gloria
"che restar non potem; però perdona,","In un altro caso, e questo deve essere per il piacere,"
se villania nostra giustizia tieni.,"Abbassare la taglia, e' vero."
Io fui abate in San Zeno a Verona,"La perdita del favore, della gloria e del potere"
"sotto lo 'mperio del buon Barbarossa,","Quando un altro si rialza,"
di cui dolente ancor Milan ragiona.,E ama l'opposto con il petto bang.
"E tale ha già l'un piè dentro la fossa,","E' disgustato da insulti,"
"che tosto piangerà quel monastero,","minaccia la sete di vendetta che si rivela in lui,"
e tristo fia d'avere avuta possa;,Finche' non e' riuscito a far del male all'altro.
"perché suo figlio, mal del corpo intero,",Se questo amore triplo
"e de la mente peggio, e che mal nacque,",Se piangete laggiù...
ha posto in loco di suo pastor vero”.,Che non è stato regolato con la giusta misura.
"Io non so se più disse o s'ei si tacque,",Un brav'uomo aspira con un impulso oscuro
tant'era già di là da noi trascorso;,"L'uomo e sente che i suoi desideri,"
"ma questo intesi, e ritener mi piacque.","Non lo raggiunge, non lo soddisfa."
E quei che m'era ad ogne uopo soccorso,"L'amore pigro è per il vero bene,"
disse: “Volgiti qua: vedine due,"Che non riesce a vederlo, a raggiungerlo,"
venir dando a l'accidïa di morso”.,"Che qui, dopo il vero pentimento, fa penitenza."
Di retro a tutti dicean: “Prima fue,"Bene sembrano altri beni, ma portano"
"morta la gente a cui il mar s'aperse,","Non vera felicità, non sono tessuto e radice,"
che vedesse Iordan le rede sue.,Da quali frutti nascono la vera salvezza.
E quella che l'affanno non sofferse,"L'amore, troppo ansioso per questo bene,"
