Original,Translate_IT
Quando colui che tutto 'l mondo alluma,Quando colui che inonda il mondo intero con la sua luce
"de l'emisperio nostro sì discende,",affonda costantemente dalla vista all'interno del nostro emisfero
"che 'l giorno d'ogne parte si consuma,","finché il giorno non sia trascorso da ogni parte,"
"lo ciel, che sol di lui prima s'accende,","il cielo, illuminato davanti a lui solo,"
subitamente si rifà parvente,improvvisamente scintilla con una moltitudine di luci
"per molte luci, in che una risplende;",che riflettono tutti uno solo.
"e questo atto del ciel mi venne a mente,",Mi è stato ricordato di questa alterazione nel cielo
come 'l segno del mondo e de' suoi duci,quando l'emblema del mondo e dei suoi signori
nel benedetto rostro fu tacente;,"ha cessato di parlare nel suo becco benedetto,"
"però che tutte quelle vive luci,","e tutte quelle luci viventi, splendenti"
"vie più lucendo, cominciaron canti","ancora più luminoso, ha iniziato le loro canzoni"
da mia memoria labili e caduci.,"che scivolano, e svaniscono, e cadono dalla memoria."
"O dolce amor che di riso t'ammanti,","O dolce amore, mantieniti in un sorriso,"
"quanto parevi ardente in que' flailli,","quanto ardente hai suonato in quei tubi,"
ch'avieno spirto sol di pensier santi!,pieno solo del soffio dei pensieri santi!
Poscia che i cari e lucidi lapilli,"Una volta le pietre brillanti e preziose della sesta luce,"
ond'io vidi ingemmato il sesto lume,"che scintillavano nel loro ambiente,"
"puoser silenzio a li angelici squilli,","avevano zittito i loro toni angelici,"
udir mi parve un mormorar di fiume,"mi sembrava di sentire il mormorio di un ruscello,"
"che scende chiaro giù di pietra in pietra,","le sue acque che cadono cristalline da roccia a roccia,"
mostrando l'ubertà del suo cacume.,rivelando l'abbondanza della sua fonte sopra.
E come suono al collo de la cetra,E come un suono è dato forma
"prende sua forma, e sì com'al pertugio",al collo del liuto o dal vento
"de la sampogna vento che penètra,","forzato attraverso i fori di sfiato di una cornamusa,"
"così, rimosso d'aspettare indugio,","Quindi, non mi trattengo piu' in suspense,"
quel mormorar de l'aguglia salissi,il mormorio dell'aquila emesso attraverso il suo collo
"su per lo collo, come fosse bugio.",come se fosse stato svuotato.
"Fecesi voce quivi, e quindi uscissi","Là divenne una voce e, venendo dal becco,"
"per lo suo becco in forma di parole,","ha formato le parole che il mio cuore stava aspettando,"
quali aspettava il core ov'io le scrissi.,e sul mio cuore li ho scritti.
“La parte in me che vede e pate il sole,"La parte di me che, nelle aquile mortali,"
"ne l'aguglie mortali”, incominciommi,","vede e sopporta il sole, ora devi guardare"
"“or fisamente riguardar si vole,","con l'attenzione fissa, 'sono state le sue parole a me,"
"perché d'i fuochi ond'io figura fommi,","'perché, dalle fiamme da cui prendo la mia forma,"
"quelli onde l'occhio in testa mi scintilla,","quelli che mi fanno brillare l'occhio così luminoso nella mia testa,"
e' di tutti lor gradi son li sommi.,questi sono gli spiriti più alti dei loro ranghi.
"Colui che luce in mezzo per pupilla,",Colui che brilla come la pupilla con una scintilla centrale
"fu il cantor de lo Spirito Santo,",è colui che ha cantato le lodi dello Spirito Santo
che l'arca traslatò di villa in villa:,e portò l'arca di città in città.
"ora conosce il merto del suo canto,","Ora conosce il merito della sua canzone,"
"in quanto effetto fu del suo consiglio,","nella misura in cui deriva dal suo pensiero,"
per lo remunerar ch'è altrettanto.,per la giusta ricompensa di cui ora gode.
"Dei cinque che mi fan cerchio per ciglio,","Dei cinque che mi formano il sopracciglio,"
"colui che più al becco mi s'accosta,",colui che è più vicino al mio becco
la vedovella consolò del figlio:,Consolava la vedova quando perse suo figlio.
ora conosce quanto caro costa,"'Ora sa quanto caro il costo, se uno fallisce"
"non seguir Cristo, per l'esperïenza","per seguire Cristo, poiché ha vissuto"
di questa dolce vita e de l'opposta.,"sia questa dolce vita che, molto tempo fa, quell'altra."
E quel che segue in la circunferenza,"""E colui che segue l'arco di cui parlo,"
"di che ragiono, per l'arco superno,","là sulla sua curva verso l'alto, ha ritardato la sua morte"
morte indugiò per vera penitenza:,offrendo il suo vero pentimento.
ora conosce che 'l giudicio etterno,Ora conosce il decreto irrevocabile di Allah
"non si trasmuta, quando degno preco",rimane inalterato anche quando una degna preghiera posticipa
fa crastino là giù de l'odïerno.,quello che potrebbe accadere sulla terra oggi fino a domani.
"L'altro che segue, con le leggi e meco,","Il prossimo là, con buona intenzione che portava frutti cattivi,"
"sotto buona intenzion che fé mal frutto,","divenne greco, insieme con le leggi e me,"
per cedere al pastor si fece greco:,dando così la sua posizione al pastore.
ora conosce come il mal dedutto,Ora sa che il male che ne derivava
"dal suo bene operar non li è nocivo,","dal suo buon atto non gli fa male,"
avvegna che sia 'l mondo indi distrutto.,anche se ha rovinato il mondo.
"E quel che vedi ne l'arco declivo,","E quello che vedete nell'arco verso il basso era William,"
"Guiglielmo fu, cui quella terra plora",per i quali quelle terre si lamentano che piangono nel dolore
che piagne Carlo e Federigo vivo:,Per aver vissuto Charles e Frederick.
ora conosce come s'innamora,'Ora sa come il cielo è commosso dall'amore
"lo ciel del giusto rege, e al sembiante","per un re giusto, come l'empietà"
del suo fulgore il fa vedere ancora.,del suo aspetto ancora rende chiaro.
Chi crederebbe giù nel mondo errante,Chi nel mondo sbagliato qui sotto penserebbe
che Rifëo Troiano in questo tondo,che Trojan Ripheus dovrebbe essere il quinto
fosse la quinta de le luci sante?,tra le luci sante lungo questo arco?
Ora conosce assai di quel che 'l mondo,'Ora sa molto che il mondo non può discernere
"veder non può de la divina grazia,","della grazia celeste, anche se la sua vista"
ben che sua vista non discerna il fondo”.,"non riesco a scorgere il fondo di questo mare."""
Quale allodetta che 'n aere si spazia,"Come l'allodola che vola nell'aria,"
"prima cantando, e poi tace contenta","prima cantare, poi silenzioso, contenuto e gioia"
"de l'ultima dolcezza che la sazia,","nell'ultima dolcezza gioiosa del suo canto,"
tal mi sembiò l'imago de la 'mprenta,"tale ha fatto che l'immagine mi sembra, la stessa impronta"
"de l'etterno piacere, al cui disio","della bellezza eterna, per la cui volontà"
ciascuna cosa qual ell'è diventa.,tutte le cose diventano ciò che sono veramente.
E avvegna ch'io fossi al dubbiar mio,E anche se ero così chiaro nella mia perplessità
"lì quasi vetro a lo color ch'el veste,","come il colore mostra attraverso il vetro che lo copre,"
"tempo aspettar tacendo non patio,","la mia domanda non poteva sopportare di aspettare il suo turno in silenzio,"
"ma de la bocca, “Che cose son queste?”,","ma, per la pressione del suo peso,"
mi pinse con la forza del suo peso:,forzato dalle mie labbra: 'Che cosa sono queste cose che vedo?'
per ch'io di coruscar vidi gran feste.,Lì vidi una scintillante rivelazione di luci.
"Poi appresso, con l'occhio più acceso,","E poi, il suo occhio si è illuminato con una maggiore brillantezza,"
lo benedetto segno mi rispuose,"l'emblema benedetto, per liberarmi"
per non tenermi in ammirar sospeso:,"da suspense e meraviglia, ha dato la sua risposta:"
“Io veggio che tu credi queste cose,Vedo che credi a queste cose perche' le dico io.
"perch'io le dico, ma non vedi come;","ma non vedi, come, anche se credi loro,"
"sì che, se son credute, sono ascose.","si sono avverati, perché la loro causa è nascosta."
Fai come quei che la cosa per nome,'Sei come l'uomo che sa una cosa per nome
"apprende ben, ma la sua quiditate",ma non capisce la sua quiddity
veder non può se altri non la prome.,A meno che un altro non lo renda chiaro a lui.
Regnum celorum vïolenza pate,'Regnum celorum soffre di violenza
"da caldo amore e da viva speranza,",da fervente amore e speranza vivente.
che vince la divina volontate:,"Questi conquistano la stessa volontà di Dio,"
"non a guisa che l'omo a l'om sobranza,","Non come l'uomo può padroneggiare l'uomo, ma conquistarlo"
"ma vince lei perché vuole esser vinta,","perché sarebbe stato conquistato, e,"
"e, vinta, vince con sua beninanza.","una volta conquistata, essa stessa conquista per la sua bontà."
La prima vita del ciglio e la quinta,'La prima anima vivente nel sopracciglio e la quinta
"ti fa maravigliar, perché ne vedi",farti meravigliare di trovarli adornando
la regïon de li angeli dipinta.,la dimora degli angeli.
"D'i corpi suoi non uscir, come credi,",Hanno lasciato i loro corpi non come gentili
"Gentili, ma Cristiani, in ferma fede","ma come cristiani, fermo nelle loro credenze, quello"
quel d'i passuri e quel d'i passi piedi.,"prima, l'altro dopo, il piercing dei suoi piedi."
"Ché l'una de lo 'nferno, u' non si riede","""Perché dall'Inferno, dove nessuno potrà tornare"
"già mai a buon voler, tornò a l'ossa;","a volontà giusta, colui che è tornato nelle sue ossa -"
e ciò di viva spene fu mercede:,"questa sua ricompensa per la speranza vivente,"
"di viva spene, che mise la possa",'la speranza vivente che ha fornito il potere alle preghiere
"ne' prieghi fatti a Dio per suscitarla,",rivolto a Dio per risuscitarlo dai morti
sì che potesse sua voglia esser mossa.,in modo che la sua volontà possa trovare la sua forza mobile.
"L'anima glorïosa onde si parla,","'L'anima benedetta di cui parlo,"
"tornata ne la carne, in che fu poco,","di nuovo nella sua carne per un po',"
credette in lui che potëa aiutarla;,"credeva in Colui che aveva il potere di aiutare,"
e credendo s'accese in tanto foco,"'e, credendo, fu acceso a tale fuoco"
"di vero amor, ch'a la morte seconda","dell'unico vero amore che, alla sua seconda morte,"
fu degna di venire a questo gioco.,Era ritenuto degno di godere della nostra felicità.
"L'altra, per grazia che da sì profonda","'L'altra anima, per grazia, che racchiude"
"fontana stilla, che mai creatura",da una fonte così profonda non c'è mai stata una creatura
"non pinse l'occhio infino a la prima onda,","che poteva spingere la sua visione verso la sua sorgente primordiale,"
tutto suo amor là giù pose a drittura:,Metti tutto il suo amore di sotto sulla giustizia.
"per che, di grazia in grazia, Dio li aperse","E per questo, dalla grazia alla grazia,"
l'occhio a la nostra redenzion futura;,"Dio ha aperto i suoi occhi alla nostra redenzione ancora da venire,"
"ond'ei credette in quella, e non sofferse","Cosi' credette e, da quel momento in poi,"
da indi il puzzo più del paganesmo;,non sopportava più la puzza del paganesimo
e riprendiene le genti perverse.,ma rimproverò i popoli ribelli per questo.
Quelle tre donne li fur per battesmo,Le tre signore che hai visto vicino alla ruota destra
"che tu vedesti da la destra rota,",servito a battezzarlo mille anni e più
dinanzi al battezzar più d'un millesmo.,prima che il sacramento esistesse.
"O predestinazion, quanto remota","'O predestinazione, quanto è lontana la tua radice"
è la radice tua da quelli aspetti,dallo sguardo di coloro che non riescono ad afferrare
che la prima cagion non veggion tota!,la Causa Primale nella sua interezza!
"E voi, mortali, tenetevi stretti","E voi mortali, trovate un po' di moderazione."
"a giudicar: ché noi, che Dio vedemo,","nel giudicare, perché noi, che guardiamo a Dio,"
non conosciamo ancor tutti li eletti;,devono ancora conoscere tutti coloro che sono eletti.
"ed ènne dolce così fatto scemo,","E per noi questa mancanza è dolce,"
"perché il ben nostro in questo ben s'affina,","perché in questo bene è il nostro bene perfezionato,"
"che quel che vole Iddio, e noi volemo”.","per quello che Allah vuole, lo vogliamo anche noi."""
"Così da quella imagine divina,","Così fece quella santa immagine,"
"per farmi chiara la mia corta vista,","per curare la brevità della mia visione,"
data mi fu soave medicina.,applicare farmaci dolci ai miei occhi.
E come a buon cantor buon citarista,"E, come un giocatore di liuto praticato seguirà"
