Original,Translate_IT
"Taciti, soli, sanza compagnia","Silenzioso, solo e senza scorta"
"n'andavam l'un dinanzi e l'altro dopo,","siamo andati avanti, uno davanti, l'altro dopo,"
come frati minor vanno per via.,mentre i Frati Minori camminano lungo le strade.
Vòlt'era in su la favola d'Isopo,La rissa si è giocata davanti ai nostri occhi
"lo mio pensier per la presente rissa,",mi ha messo in mente la favola di Esopo
dov'el parlò de la rana e del topo;,"in cui raccontò la storia della rana e del topo,"
ché più non si pareggia 'mo' e 'issa',per 'issa' e 'mo' non sono più come nel significato
"che l'un con l'altro fa, se ben s'accoppia","di un caso e l'altro, se confrontiamo"
principio e fine con la mente fissa.,con circospezione i loro inizi e i loro fini.
"E come l'un pensier de l'altro scoppia,","Proprio come un pensiero problemi da un altro,"
"così nacque di quello un altro poi,","così, dal primo, nacque un altro ora"
che la prima paura mi fé doppia.,che mi ha reso timoroso il doppio di prima.
Io pensava così: 'Questi per noi,"Ho pensato: ""E' colpa nostra se sono stati imbrogliati,"
sono scherniti con danno e con beffa,e con tanto dolore e vergogna
"sì fatta, ch'assai credo che lor nòi.",Sono sicuro che li arrabbierà.
"Se l'ira sovra 'l mal voler s'aggueffa,","""Se si aggiunge rabbia alla loro malizia,"
ei ne verranno dietro più crudeli,ci perseguiteranno ancora più crudelmente
che 'l cane a quella lievre ch'elli acceffa'.,"che il segugio che mette le sue zanne in una lepre."""
Già mi sentia tutti arricciar li peli,Riuscivo a sentire il mio cuoio capelluto diventare teso con la paura
"de la paura e stava in dietro intento,",e ha tenuto i miei pensieri fissati proprio dietro di me
"quand'io dissi: “Maestro, se non celi","mentre parlavo: ""Maestro, non puoi in fretta"
"te e me tostamente, i' ho pavento",'Nascondere te stesso e me? Sono nel terrore
d'i Malebranche. Noi li avem già dietro;,"dei Malebranchi; li sento là dietro di noi,"
"io li 'magino sì, che già li sento”.","Immaginateli così chiari che li sento quasi."""
"E quei: “S'i' fossi di piombato vetro,",E lui: 'Se fossi fatto di vetro con piombo
l'imagine di fuor tua non trarrei,Non riuscivo a riflettere la tua somiglianza esteriore.
"più tosto a me, che quella dentro 'mpetro.",In meno tempo di quanto io abbia afferrato quello dentro di te.
"Pur mo venieno i tuo' pensier tra ' miei,","Proprio ora che il tuo pensiero si mescolava con il mio,"
"con simile atto e con simile faccia,","sia nell'atteggiamento che nell'aspetto,"
sì che d'intrambi un sol consiglio fei.,Cosi' che di entrambi ho formato un unico piano.
"S'elli è che sì la destra costa giaccia,",'Se il pendio là a destra ci permette
"che noi possiam ne l'altra bolgia scendere,","per entrare nell'altro fosso,"
noi fuggirem l'imaginata caccia”.,"scamperemo all'inseguimento che entrambi immaginamo."""
"Già non compié di tal consiglio rendere,",Prima che finisse di dirmi il suo piano
ch'io li vidi venir con l'ali tese,"Li ho visti arrivare, ali sparse,"
"non molto lungi, per volerne prendere.",Ci avviciniamo per prenderci.
"Lo duca mio di sùbito mi prese,",Il mio capo in un attimo mi ha rapito.
come la madre ch'al romore è desta,"come una madre che, risvegliata dal trambusto"
"e vede presso a sé le fiamme accese,","prima di vedere le fiamme che bruciano vicino a lei,"
"che prende il figlio e fugge e non s'arresta,","rapisce suo figlio e fugge,"
"avendo più di lui che di sé cura,","e, più preoccupato per lui che per se stessa,"
tanto che solo una camiscia vesta;,non ritarda il passaggio.
e giù dal collo de la ripa dura,"Giu' dal bordo di quella banca di pietra,"
"supin si diede a la pendente roccia,","supina, scivolava lungo la roccia inclinata"
che l'un de' lati a l'altra bolgia tura.,che forma un confine del prossimo crepaccio.
Non corse mai sì tosto acqua per doccia,"Mai innaffiato, mentre si avvicinava alle pagaia,"
"a volger ruota di molin terragno,",correre giù lungo le chiuse
"quand'ella più verso le pale approccia,",tagliato attraverso la terra per girare una ruota mulino
"come 'l maestro mio per quel vivagno,","più rapidamente del mio padrone giù per quella banca,"
"portandosene me sovra 'l suo petto,",che mi portava con sé al petto.
"come suo figlio, non come compagno.","come se fossi suo figlio, non il suo compagno."
A pena fuoro i piè suoi giunti al letto,Non prima aveva toccato il fondo con i piedi
"del fondo giù, ch'e' furon in sul colle",che i diavoli erano sopra di noi sulla cresta.
sovresso noi; ma non lì era sospetto:,"Ma ora non avevamo motivo di provare paura,"
ché l'alta provedenza che lor volle,per l'alta Provvidenza che li ha fatti
"porre ministri de la fossa quinta,","guardiani del quinto crepaccio,"
poder di partirs'indi a tutti tolle.,li priva del potere di lasciarlo.
Là giù trovammo una gente dipinta,Laggiù ci siamo imbattuti in un popolo laccato
"che giva intorno assai con lenti passi,","che hanno fatto il loro giro, in lacrime, con passi svogliati."
piangendo e nel sembiante stanca e vinta.,Sembravano entrambi stanchi e sconfitti.
Elli avean cappe con cappucci bassi,I cappotti che indossavano avevano dei camini caduti.
"dinanzi a li occhi, fatte de la taglia","sopra i loro occhi, tagliati come i mantello"
che in Clugnì per li monaci fassi.,fatta per i monaci di Cluny.
"Di fuor dorate son, sì ch'elli abbaglia;","Dolci e scintillanti all'esterno,"
"ma dentro tutte piombo, e gravi tanto,","dentro di loro sono di piombo, così ponderous"
che Federigo le mettea di paglia.,che quelli imposti da Frederick non sembravano altro che paglia.
Oh in etterno faticoso manto!,"Oh, che mantello faticoso da indossare per sempre!"
Noi ci volgemmo ancor pur a man manca,"Ancora una volta abbiamo girato a sinistra, poi siamo andati avanti"
"con loro insieme, intenti al tristo pianto;","accanto a loro, intenti a piangere i loro miserabili lamenti."
ma per lo peso quella gente stanca,Il loro fardello fece sì che la gente stanca
"venìa sì pian, che noi eravam nuovi",muoversi così lentamente abbiamo avuto nuovi compagni
di compagnia ad ogne mover d'anca.,ogni volta che mettiamo un piede davanti all'altro.
Per ch'io al duca mio: “Fa che tu trovi,E io dissi al mio capo: 'Cast your eyes
"alcun ch'al fatto o al nome si conosca,",da questa parte e da quella mentre camminiamo.
"e li occhi, sì andando, intorno movi”.","Vedi se conosci i nomi o le azioni di qualcuno."""
"E un che 'ntese la parola tosca,","E uno di loro, ascoltando il mio discorso toscano,"
"di retro a noi gridò: “Tenete i piedi,","gridò dietro di noi: ""Rimani in piedi,"
voi che correte sì per l'aura fosca!,voi che correte attraverso quest'aria annebbiata.
Forse ch'avrai da me quel che tu chiedi”.,'Forse posso rispondere a quello che hai chiesto.'
"Onde 'l duca si volse e disse: “Aspetta,","A quel punto il mio capo si voltò per dire: ""Aspetta!"
e poi secondo il suo passo procedi”.,"Solo un attimo, poi continua al suo ritmo."""
"Ristetti, e vidi due mostrar gran fretta",Mi sono fermato e ho notato due i cui sguardi
"de l'animo, col viso, d'esser meco;","ha mostrato fretta della mente per raggiungermi,"
ma tardavali 'l carco e la via stretta.,ma il loro carico e la via stretta li trattenevano.
"Quando fuor giunti, assai con l'occhio bieco",Quando si sono avvicinati mi hanno guardato.
mi rimiraron sanza far parola;,"per un po', senza una parola,"
"poi si volsero in sé, e dicean seco:","finché non si volsero gli uni agli altri, dicendo:"
“Costui par vivo a l'atto de la gola;,"Il modo in cui si muove la gola, questo deve essere vivo."
"e s'e' son morti, per qual privilegio","E se sono morti, ciò che dà loro il diritto"
vanno scoperti de la grave stola?”.,"per andare scoperto dalla ruba pesante?"""
"Poi disser me: “O Tosco, ch'al collegio","e poi a me: 'O toscano, che sono venuti"
"de l'ipocriti tristi se' venuto,","a questa assemblea di tristi ipocriti,"
dir chi tu se' non avere in dispregio”.,"non disdegnate di dirci chi siete."""
E io a loro: “I' fui nato e cresciuto,"Nella grande città, vicino al fiume Arno,"
"sovra 'l bel fiume d'Arno a la gran villa,","Dissi loro: ""Sono nato e cresciuto,"
e son col corpo ch'i' ho sempre avuto.,E io sono qui nel corpo che e' sempre stato mio.
"Ma voi chi siete, a cui tanto distilla",'Ma chi sei tu in cui vedo distillato
quant'i' veggio dolor giù per le guance?,la miseria che ti scorre sulle guance in lacrime?
e che pena è in voi che sì sfavilla?”.,"E qual è il dolore che voi sopportate che brilla così?."""
E l'un rispuose a me: “Le cappe rance,"Uno di loro rispose: ""I nostri cappotti d'oro"
"son di piombo sì grosse, che li pesi","sono fatti di piombo, e sono così densi,"
fan così cigolar le lor bilance.,come le squame che scricchioliamo sotto il loro peso.
"Frati godenti fummo, e bolognesi;","Siamo stati frati gioviali, nati a Bologna."
io Catalano e questi Loderingo,"Il mio nome era Catalano, il suo, Loderingo."
"nomati, e da tua terra insieme presi","La tua citta' ci ha fatti un paio,"
"come suole esser tolto un uom solingo,","""dove di solito un uomo single è stato scelto,"
"per conservar sua pace; e fummo tali,","per mantenere la pace dentro di noi, ed eravamo tali"
ch'ancor si pare intorno dal Gardingo”.,"che intorno a Gardingo si vedono le rovine."""
"Io cominciai: “O frati, i vostri mali...”;","Ho cominciato: ""O frati, le vostre azioni malvagie..."""
"ma più non dissi, ch'a l'occhio mi corse","ma non ha detto più, perché uno là mi ha attirato l'occhio,"
"un, crucifisso in terra con tre pali.",fissato a terra in senso trasversale da tre brevi pali.
"Quando mi vide, tutto si distorse,","Vedendomi, si contorceva dappertutto,"
soffiando ne la barba con sospiri;,"soffiando sospiri nella sua barba,"
"e 'l frate Catalan, ch'a ciò s'accorse,","e Fra Catalano, osservando questo, disse:"
"mi disse: “Quel confitto che tu miri,",Quell'uomo che vedete inchiodato
consigliò i Farisei che convenia,consigliato ai farisei era il corso migliore
porre un uom per lo popolo a' martìri.,che un solo uomo dovrebbe essere martirizzato per il popolo.
"Attraversato è, nudo, ne la via,","'Egli è steso nudo, come vedete,"
"come tu vedi, ed è mestier ch'el senta",attraverso il sentiero e deve sentire
"qualunque passa, come pesa, pria.",il peso di chi passa.
E a tal modo il socero si stenta,Solo perche' suo suocero sia preso da noi.
"in questa fossa, e li altri dal concilio",quaggiù e con gli altri del consiglio
che fu per li Giudei mala sementa”.,"che era un seme di male per i Giudei."""
Allor vid'io maravigliar Virgilio,Ho visto che Virgil si meravigliava alla vista
sovra colui ch'era disteso in croce,"di questa forma tesa come su una croce,"
tanto vilmente ne l'etterno essilio.,così ignobile nel suo eterno esilio.
Poscia drizzò al frate cotal voce:,Poi si rivolse al frate con queste parole:
"“Non vi dispiaccia, se vi lece, dirci","Possa piacerti, se e' permesso,"
s'a la man destra giace alcuna foce,per dire se sulla nostra destra c'è un passaggio
"onde noi amendue possiamo uscirci,",'con la quale potremmo lasciare questo posto
sanza costrigner de li angeli neri,senza richiedere aiuto da alcuni angeli neri
che vegnan d'esto fondo a dipartirci”.,"per strapparci da queste profondità."""
Rispuose adunque: “Più che tu non speri,Ed egli rispose: 'Più vicino di quanto si spera ci sono bugie
s'appressa un sasso che da la gran cerchia,una cresta rocciosa che attraversa tutte le valli selvaggie
"si move e varca tutt'i vallon feri,",dal cerchio più lontano verso l'interno.
salvo che 'n questo è rotto e nol coperchia;,E' caduto solo qui e non riesce ad attraversarlo.
