Original,Translate_IT
"Taciti, soli, sanza compagnia","Silenzio, solitudine, nessuno ci accompagna,"
"n'andavam l'un dinanzi e l'altro dopo,","Abbiamo fatto il nostro modo-uno è andato prima, uno dopo--"
come frati minor vanno per via.,come frati minori quando camminano insieme.
Vòlt'era in su la favola d'Isopo,Le attuali fracas mi hanno fatto pensare ad Aesop...
"lo mio pensier per la presente rissa,",quella favola dove racconta del topo
dov'el parlò de la rana e del topo;,"e rana; per ""vicino"" e ""vicino"" non sono più vicini"
ché più non si pareggia 'mo' e 'issa',"che sono quella favola e questo incidente,"
"che l'un con l'altro fa, se ben s'accoppia",se si confronta con attenzione la fine
principio e fine con la mente fissa.,di uno con l'inizio del secondo.
"E come l'un pensier de l'altro scoppia,","E come un pensiero nasce dall'altro,"
"così nacque di quello un altro poi,","così da quello era ancora un altro nato,"
che la prima paura mi fé doppia.,che ha fatto la paura che ho provato prima di raddoppiare.
Io pensava così: 'Questi per noi,"Ho pensato: ""A causa nostra, sono stati presi in giro,"
sono scherniti con danno e con beffa,e questo inflisse tanto dolore e disprezzo
"sì fatta, ch'assai credo che lor nòi.",che sono sicuro provino profonda indignazione.
"Se l'ira sovra 'l mal voler s'aggueffa,","Se la rabbia deve essere aggiunta alla loro malizia,"
ei ne verranno dietro più crudeli,ci daranno la caccia con più ferocia
che 'l cane a quella lievre ch'elli acceffa'.,"di qualsiasi cane i cui denti hanno intrappolato una lepre."""
Già mi sentia tutti arricciar li peli,Riuscivo già a sentire i miei capelli rannicchiarsi
"de la paura e stava in dietro intento,","dalla paura, e ho guardato indietro con attenzione,"
"quand'io dissi: “Maestro, se non celi","dicendo: ""Maestro, se non nascondi"
"te e me tostamente, i' ho pavento","tu ed io in una volta mi terrorizzano,"
d'i Malebranche. Noi li avem già dietro;,"i Malebranchi, ci stanno inseguendo;"
"io li 'magino sì, che già li sento”.","Li immagino, li sento ora."""
"E quei: “S'i' fossi di piombato vetro,","E lui a me: ""Sono stato uno specchio guidato,"
l'imagine di fuor tua non trarrei,Non potevo raccogliermi nella tua immagine esterna
"più tosto a me, che quella dentro 'mpetro.",più in fretta di quanto io abbia ricevuto il tuo intimo.
"Pur mo venieno i tuo' pensier tra ' miei,",Perche' anche ora i tuoi pensieri si sono uniti ai miei.
"con simile atto e con simile faccia,",In entrambi i nostri atti e aspetti siamo parenti-
sì che d'intrambi un sol consiglio fei.,con entrambe le nostre menti ho preso una decisione.
"S'elli è che sì la destra costa giaccia,","Se quella riva destra non è estremamente ripida,"
"che noi possiam ne l'altra bolgia scendere,",possiamo scendere nell'altro fossato
noi fuggirem l'imaginata caccia”.,"e quindi fuggite dall'inseguimento immaginato."""
"Già non compié di tal consiglio rendere,",Aveva appena finito di dirmi il suo piano
ch'io li vidi venir con l'ali tese,"quando li vidi avvicinarsi con ali distese,"
"non molto lungi, per volerne prendere.","Non troppo lontano, e desideroso di portarci."
"Lo duca mio di sùbito mi prese,","La mia guida mi ha rapito all'istante, proprio come"
come la madre ch'al romore è desta,la madre che è risvegliata da un ruggito
"e vede presso a sé le fiamme accese,","e intravede accanto a lei fiamme ardenti,"
"che prende il figlio e fugge e non s'arresta,",Solleverà suo figlio e correrà senza fermarsi.
"avendo più di lui che di sé cura,",Si prende più cura del bambino che di se stessa.
tanto che solo una camiscia vesta;,non fermarsi nemmeno a fare un turno;
e giù dal collo de la ripa dura,e giù per il bordo duro del terrapieno-la sua schiena
"supin si diede a la pendente roccia,",giacere pianeggiante lungo la roccia inclinata che chiude
che l'un de' lati a l'altra bolgia tura.,da un lato del fossato adiacente.
Non corse mai sì tosto acqua per doccia,Non c'era acqua che corresse così veloce.
"a volger ruota di molin terragno,","uno sluice per girare le ruote di un mulino,"
"quand'ella più verso le pale approccia,","nemmeno quando il suo flusso si avvicinava alle pagaia,"
"come 'l maestro mio per quel vivagno,",Cosi' come il mio padrone corse giu' per quell'argine.
"portandosene me sovra 'l suo petto,","mentre mi portava con sé sul petto,"
"come suo figlio, non come compagno.","proprio come un figlio, e non come un compagno."
A pena fuoro i piè suoi giunti al letto,I suoi piedi avevano appena raggiunto il letto che giace
"del fondo giù, ch'e' furon in sul colle","lungo il profondo, che quei dieci demoni"
sovresso noi; ma non lì era sospetto:,erano sull'orlo sopra di noi; ma c'era
ché l'alta provedenza che lor volle,"nulla da temere, per quell'Altissima Provvidenza"
"porre ministri de la fossa quinta,","che li vollero ministri del quinto fosso,"
poder di partirs'indi a tutti tolle.,nega a tutti loro il potere di lasciarlo.
Là giù trovammo una gente dipinta,"Sotto quel punto abbiamo trovato una gente dipinta,"
"che giva intorno assai con lenti passi,","che si muoveva con i passi in ritardo, in cerchio,"
piangendo e nel sembiante stanca e vinta.,"piangendo, con caratteristiche stanche e sconfitte."
Elli avean cappe con cappucci bassi,Ed erano vestiti con dei camini cosi' bassi.
"dinanzi a li occhi, fatte de la taglia","sono caduti sotto i loro occhi, di quello stesso taglio"
che in Clugnì per li monaci fassi.,E' usato per fare i vestiti per i monaci di Cluny.
"Di fuor dorate son, sì ch'elli abbaglia;","Fuori, questi manti erano dorati e abbagliavano;"
"ma dentro tutte piombo, e gravi tanto,","ma dentro erano tutti di piombo, così pesanti"
che Federigo le mettea di paglia.,che i cappotti di Frederick erano di paglia in confronto a loro.
Oh in etterno faticoso manto!,Un manto faticoso per l'eternità!
Noi ci volgemmo ancor pur a man manca,"Ci voltammo di nuovo, come sempre, a sinistra,"
"con loro insieme, intenti al tristo pianto;","insieme con loro, intenti al loro triste pianto;"
ma per lo peso quella gente stanca,ma con i loro pesi che la gente stanca passo
"venìa sì pian, che noi eravam nuovi",così lentamente che ci siamo trovati tra
di compagnia ad ogne mover d'anca.,una nuova compagnia ogni volta che abbiamo fatto un passo.
Per ch'io al duca mio: “Fa che tu trovi,"Alla quale ho detto alla mia guida: ""Per favore cercate di trovare"
"alcun ch'al fatto o al nome si conosca,",qualcuno di cui riconosco il nome o l'atto;
"e li occhi, sì andando, intorno movi”.","e mentre camminiamo, vegliate con i vostri occhi."""
"E un che 'ntese la parola tosca,",E uno che ha preso nel mio discorso toscano
"di retro a noi gridò: “Tenete i piedi,","gridò dietro di noi: ""Rimani sui tuoi passi, o tu"
voi che correte sì per l'aura fosca!,che affrettarsi così lungo quest'aria oscurata!
Forse ch'avrai da me quel che tu chiedi”.,"Forse avrai da me ciò che cerchi."""
"Onde 'l duca si volse e disse: “Aspetta,","E la mia guida si voltò verso di me, dicendo: ""Aspetta,"
e poi secondo il suo passo procedi”.,"e poi continuare, seguendo il suo ritmo."""
"Ristetti, e vidi due mostrar gran fretta",Mi sono fermato e ne ho visti due i cui volti mostravano
"de l'animo, col viso, d'esser meco;",le loro menti erano desiderose di stare con me; ma entrambi
ma tardavali 'l carco e la via stretta.,il loro carico e il sentiero stretto li costrinsero a rallentare.
"Quando fuor giunti, assai con l'occhio bieco","Quando sono saliti, mi hanno guardato in faccia."
mi rimiraron sanza far parola;,"per molto tempo, e non proferirono una parola"
"poi si volsero in sé, e dicean seco:","finché non si volsero gli uni agli altri, dicendo:"
“Costui par vivo a l'atto de la gola;,"""Il battito della sua gola fa sembrare questo."""
"e s'e' son morti, per qual privilegio","vivo; e se sono morti, quale privilegio"
vanno scoperti de la grave stola?”.,"li lascia apparire senza il mantello pesante?"""
"Poi disser me: “O Tosco, ch'al collegio","Poi mi hanno risposto: ""Tu toscana, tu che vieni"
"de l'ipocriti tristi se' venuto,","a questa assemblea di tristi ipocriti,"
dir chi tu se' non avere in dispregio”.,"non disdegnate di dirci chi siete."""
E io a loro: “I' fui nato e cresciuto,"Ho risposto: ""Dove scorre l'adorabile Arno,"
"sovra 'l bel fiume d'Arno a la gran villa,","là sono nato e risuscitato, nella grande città;"
e son col corpo ch'i' ho sempre avuto.,Sono con il corpo che ho sempre avuto.
"Ma voi chi siete, a cui tanto distilla","Ma chi sei tu, sulle cui guance vedo"
quant'i' veggio dolor giù per le guance?,tali lacrime distillate dal dolore? E fatemi sapere
e che pena è in voi che sì sfavilla?”.,"che castigo è quello che brilla così."""
E l'un rispuose a me: “Le cappe rance,"E uno di loro rispose: ""I manti gialli"
"son di piombo sì grosse, che li pesi","sono di un piombo così denso, la loro pesantezza"
fan così cigolar le lor bilance.,"ci rende, gli equilibri sotto di loro, scricchiolano."
"Frati godenti fummo, e bolognesi;","Eravamo entrambi frati gioviali, e bolognese;"
io Catalano e questi Loderingo,"il mio nome era Catalano, Loderingo"
"nomati, e da tua terra insieme presi","era la sua, e siamo stati scelti dalla vostra città"
"come suole esser tolto un uom solingo,","insieme, per il post che di solito è"
"per conservar sua pace; e fummo tali,","di un uomo, per mantenere la pace; e quello che eravamo"
ch'ancor si pare intorno dal Gardingo”.,"è ancora da osservare intorno a Gardingo."""
"Io cominciai: “O frati, i vostri mali...”;","Allora cominciai: ""O frati, i vostri misfatti..."""
"ma più non dissi, ch'a l'occhio mi corse","ma non disse più, perché i miei occhi avevano colto"
"un, crucifisso in terra con tre pali.",Uno crocifisso da tre pale a terra.
"Quando mi vide, tutto si distorse,","Quando mi vide, quel peccatore si contorceva dappertutto,"
soffiando ne la barba con sospiri;,e sospirava forte nella sua barba con sospiri;
"e 'l frate Catalan, ch'a ciò s'accorse,","osservando che, Fra Catalano ha detto"
"mi disse: “Quel confitto che tu miri,","a me: ""Colui che ha impalato là, che tu vedi,"
consigliò i Farisei che convenia,ha consigliato i farisei che era prudente
porre un uom per lo popolo a' martìri.,di lasciare che un uomo e non una nazione soffrano.
"Attraversato è, nudo, ne la via,","Nudo, è stato teso attraverso il sentiero,"
"come tu vedi, ed è mestier ch'el senta","come potete vedere, ed egli deve sentire il peso"
"qualunque passa, come pesa, pria.",di chiunque passi sopra di lui.
E a tal modo il socero si stenta,"Come il tormento, in questo fosso, affligge entrambi i suoi"
"in questa fossa, e li altri dal concilio","suocero e altri in tale consiglio,"
che fu per li Giudei mala sementa”.,"che per i Giudei ha seminato così tanto male."""
Allor vid'io maravigliar Virgilio,Poi ho visto Virgil in piedi stupito sopra
sovra colui ch'era disteso in croce,colui che giaceva steso su una croce
tanto vilmente ne l'etterno essilio.,così squallidamente nel suo eterno esilio.
Poscia drizzò al frate cotal voce:,E si rivolse così al frate:
"“Non vi dispiaccia, se vi lece, dirci","""Se non ti dispiace, se puoi..."
s'a la man destra giace alcuna foce,ci dica se c'è qualche passaggio sulla destra
"onde noi amendue possiamo uscirci,",che ci permetterebbe di andarcene.
sanza costrigner de li angeli neri,senza il nostro dovere di forzare gli angeli neri
che vegnan d'esto fondo a dipartirci”.,"a viaggiare fino a questo punto, per farci uscire."""
Rispuose adunque: “Più che tu non speri,"Egli rispose: ""Più di quanto tu speri, troverai"
s'appressa un sasso che da la gran cerchia,una cresta rocciosa che si estende dal grande
"si move e varca tutt'i vallon feri,","mura rotonde e attraversa tutte le valli selvagge,"
salvo che 'n questo è rotto e nol coperchia;,Solo che qui non e' un ponte rotto.
