Original,Translate_IT
Ruppemi l'alto sonno ne la testa,Il sonno pesante nella mia testa è stato fracassato
"un greve truono, sì ch'io mi riscossi","da un enorme tuono clap, in modo che"
come persona ch'è per forza desta;,Ho iniziato come uno che forza si risveglia;
"e l'occhio riposato intorno mossi,",Stavo in piedi eretto e ho girato i miei occhi riposati
"dritto levato, e fiso riguardai","da un lato all'altro, e fissai costantemente"
per conoscer lo loco dov'io fossi.,per imparare che posto mi circondava.
Vero è che 'n su la proda mi trovai,In verità mi sono trovato sull'orlo dell'orlo
de la valle d'abisso dolorosa,"di un abisso, la valle malinconica"
che 'ntrono accoglie d'infiniti guai.,"contenenti tuoni, lamenti infiniti."
Oscura e profonda era e nebulosa,"Quella valle, buia e profonda e piena di nebbia,"
"tanto che, per ficcar lo viso a fondo,","è tale che, anche se ho guardato nella sua fossa,"
io non vi discernea alcuna cosa.,Non sono riuscito a discernere una cosa.
"“Or discendiam qua giù nel cieco mondo”,","""Scendiamo ora nel mondo cieco,"""
cominciò il poeta tutto smorto.,"cominciò il poeta, che era impallidito dalla morte;"
"“Io sarò primo, e tu sarai secondo”.","""Io andrò per primo e tu mi seguirai."""
"E io, che del color mi fui accorto,","Ma io, che avevo visto il cambiamento nella sua carnagione,"
"dissi: “Come verrò, se tu paventi","Disse: ""Come potrei andare avanti se avete paura?"
che suoli al mio dubbiare esser conforto?”.,"Tu che hai sempre aiutato a dissipare i miei dubbi?"""
Ed elli a me: “L'angoscia de le genti,"Ed egli a me: ""L'angoscia del popolo"
"che son qua giù, nel viso mi dipigne","il cui posto è qui sotto, ha toccato il mio volto"
quella pietà che tu per tema senti.,con la compassione che sbagli per la paura.
"Andiam, ché la via lunga ne sospigne”.","Andiamo avanti, il cammino che aspetta è lungo."""
Così si mise e così mi fé intrare,"Cosi' partì, e cosi' mi fece entrare."
nel primo cerchio che l'abisso cigne.,su quel primo cerchio che cinge l'abisso.
"Quivi, secondo che per ascoltare,","Qui, per quanto l'udito possa scoprire,"
non avea pianto mai che di sospiri,Non c'era grido più forte dei sospiri
che l'aura etterna facevan tremare;,che ha fatto tremare l'aria eterna.
"ciò avvenia di duol sanza martìri,","I sospiri sorsero dal dolore senza tormenti,"
"ch'avean le turbe, ch'eran molte e grandi,","dalle folle, dalle molte folle,"
d'infanti e di femmine e di viri.,"dei neonati, delle donne e degli uomini."
Lo buon maestro a me: “Tu non dimandi,"Il padrone gentile disse: ""Non chiedete"
che spiriti son questi che tu vedi?,Chi sono questi spiriti che vedete prima di voi?
"Or vo' che sappi, innanzi che più andi,","Sai, prima di andare avanti..."
"ch'ei non peccaro; e s'elli hanno mercedi,","non hanno peccato; eppure, anche se hanno meriti,"
"non basta, perché non ebber battesmo,","non è abbastanza, perché mancavano il battesimo,"
ch'è porta de la fede che tu credi;,il portale della fede che abbracciate.
"e s'e' furon dinanzi al cristianesmo,","E se vivessero prima del cristianesimo,"
non adorar debitamente a Dio:,non hanno adorato Allah in modo appropriato;
e di questi cotai son io medesmo.,e di tali spiriti io stesso sono una cosa sola.
"Per tai difetti, non per altro rio,","per questi difetti e per nessun altro male,"
"semo perduti, e sol di tanto offesi",ora siamo persi e puniti solo con questo:
che sanza speme vivemo in disio”.,"non abbiamo speranza e tuttavia viviamo nel desiderio."""
"Gran duol mi prese al cor quando lo 'ntesi,","Il grande dolore ha colto il mio cuore nell'udirlo,"
però che gente di molto valore,perché avevo visto alcuni uomini stimabili
conobbi che 'n quel limbo eran sospesi.,tra le anime sospese in quel limbo.
"“Dimmi, maestro mio, dimmi, segnore”,","""Dimmi, padrone, dimmelo, Signore,"" io allora"
comincia' io per volere esser certo,cominciai perché volevo esserne certo.
di quella fede che vince ogne errore:,"di quella fede che sconfigge tutti gli errori,"
"“uscicci mai alcuno, o per suo merto","""ha mai fatto un go-by il suo proprio merito"
"o per altrui, che poi fosse beato?”.","o gli altri da questo luogo verso la beatitudine?"""
"E quei che 'ntese il mio parlar coverto,","E colui che ha compreso il mio discorso segreto,"
"rispuose: “Io era nuovo in questo stato,","ha risposto: ""Sono stato di nuovo entrato in questo stato"
"quando ci vidi venire un possente,","quando vidi entrare qui un grande Signore,"
con segno di vittoria coronato.,"la corona che indossava, segno di vittoria."
"Trasseci l'ombra del primo parente,","Ha portato via l'ombra del nostro primo padre,"
"d'Abèl suo figlio e quella di Noè,",di Abele suo figlio e dell'ombra di Noè
di Moïsè legista e ubidente;,"di Mosè, il legislatore obbediente,"
"Abraàm patrïarca e Davìd re,","di padre Abramo, il re Davide,"
Israèl con lo padre e co' suoi nati,di Israele suo padre e i suoi figli
"e con Rachele, per cui tanto fé,","e Rachele, per la quale ha lavorato così a lungo,"
"e altri molti, e feceli beati.","e molti altri, e li ha benedetti;"
"E vo' che sappi che, dinanzi ad essi,","e dovrei farvi sapere che, prima di loro,"
spiriti umani non eran salvati”.,"non c'erano anime umane che fossero state salvate."""
"Non lasciavam l'andar perch'ei dicessi,",Non siamo rimasti i nostri passi anche se ha parlato;
"ma passavam la selva tuttavia,",Abbiamo continuato ancora attraverso il bosco...
"la selva, dico, di spiriti spessi.","il legno, dico, dove molti spiriti si affollavano."
Non era lunga ancor la nostra via,Il nostro cammino non era andato molto oltre il punto
"di qua dal sonno, quand'io vidi un foco","dove ho dormito, quando ho visto un fuoco"
ch'emisperio di tenebre vincia.,vincere contro un emisfero di ombre.
"Di lungi n'eravamo ancora un poco,","Eravamo ancora a una piccola distanza da esso,"
ma non sì ch'io non discernessi in parte,ma non finora non ho potuto vedere in parte
ch'orrevol gente possedea quel loco.,che uomini d'onore possedevano quel posto.
"“O tu ch'onori scïenzïa e arte,","""O voi che onorate l'arte e la scienza,"
"questi chi son c'hanno cotanta onranza,",che sono queste anime la cui dignità ha conservato
che dal modo de li altri li diparte?”.,"il loro modo di essere, separati dal resto?"""
E quelli a me: “L'onrata nominanza,"Ed egli a me: ""L'onore del loro nome,"
"che di lor suona sù ne la tua vita,","che riecheggia in alto nella tua vita,"
grazïa acquista in ciel che sì li avanza”.,"ottiene la grazia del Cielo, e che li avanza."""
Intanto voce fu per me udita:,Intanto c'era una voce che potevo sentire:
“Onorate l'altissimo poeta;,"""Paga l'onore al poeta stimabile;"
"l'ombra sua torna, ch'era dipartita”.","la sua ombra, che ci aveva lasciati, ora ritorna."""
"Poi che la voce fu restata e queta,","Dopo che quella voce fu fatta, quando c'era silenzio,"
vidi quattro grand'ombre a noi venire:,Ho visto quattro ombre giganti che si avvicinavano a noi.
sembianz' avevan né trista né lieta.,non erano né tristi né gioiosi.
Lo buon maestro cominciò a dire:,Il mio gentile maestro allora ha cominciato dicendo:
"“Mira colui con quella spada in mano,","""Guarda bene colui che tiene in mano quella spada,"
che vien dinanzi ai tre sì come sire:,che si muove davanti agli altri tre come signore.
quelli è Omero poeta sovrano;,"Quell'ombra è Omero, il poeta consumato;"
l'altro è Orazio satiro che vene;,"l'altro è Orazio, satirista;"
"Ovidio è 'l terzo, e l'ultimo Lucano.","Il terzo è Ovid, e l'ultimo è Lucan."
Però che ciascun meco si convene,Perché ognuno di questi spiriti condivide con me
"nel nome che sonò la voce sola,","il nome chiamato prima dalla voce solitaria,"
"fannomi onore, e di ciò fanno bene”.","mi accolgono e, facendo questo, fanno bene."""
Così vid'i' adunar la bella scola,"E così vidi quella splendida scuola riunita,"
di quel segnor de l'altissimo canto,"guidato dal signore del canto incomparabile,"
che sovra li altri com'aquila vola.,che come un'aquila vola sopra il resto.
"Da ch'ebber ragionato insieme alquanto,","Poco dopo aver parlato un po' insieme,"
"volsersi a me con salutevol cenno,",si volsero a me salutando cordialmente;
e 'l mio maestro sorrise di tanto;,"ed avendo assistito a questo, il mio padrone sorrise;"
"e più d'onore ancora assai mi fenno,","e ancora più grande onore fu il mio,"
"ch'e' sì mi fecer de la loro schiera,",perché mi hanno invitato ad unirmi ai loro ranghi.
sì ch'io fui sesto tra cotanto senno.,Ero il sesto tra tali intelligenze.
"Così andammo infino a la lumera,","Così ci siamo mossi lungo e verso la luce,"
"parlando cose che 'l tacere è bello,",Parlare di cose di cui il silenzio qui
sì com'era 'l parlar colà dov'era.,E' come se il nostro discorso fosse li'.
"Venimmo al piè d'un nobile castello,","Abbiamo raggiunto la base di un castello eccelso,"
"sette volte cerchiato d'alte mura,","circondato sette volte da mura torreggianti,"
difeso intorno d'un bel fiumicello.,difeso tutto intorno da un flusso equo.
Questo passammo come terra dura;,Abbiamo guadato questo come se su terreno duro;
per sette porte intrai con questi savi:,Sono entrato in sette portali con questi saggi;
giugnemmo in prato di fresca verdura.,Abbiamo raggiunto un prato di piante fiorite verdi.
"Genti v'eran con occhi tardi e gravi,",La gente qui aveva occhi sia gravi che lenti;
di grande autorità ne' lor sembianti:,le loro caratteristiche portavano grande autorità;
"parlavan rado, con voci soavi.","parlavano di rado, con voci gentili,"
"Traemmoci così da l'un de' canti,","Ci siamo allontanati da una parte del prato,"
"in loco aperto, luminoso e alto,","un luogo aperto sia alto che pieno di luce,"
sì che veder si potien tutti quanti.,e abbiamo potuto vedere tutti coloro che erano riuniti.
"Colà diritto, sovra 'l verde smalto,","Di fronte a me, sul verde smaltato,"
"mi fuor mostrati li spiriti magni,",anime di grande cuore sono stati mostrati a me e io
che del vedere in me stesso m'essalto.,ancora la gloria nel mio aver assistito a loro.
"I' vidi Eletra con molti compagni,","Ho visto Electra con i suoi numerosi compagni,"
"tra ' quai conobbi Ettòr ed Enea,","tra i quali ho conosciuto Hector e Enea,"
Cesare armato con li occhi grifagni.,"e Cesare, nella sua armatura, con gli occhi di falco."
Vidi Cammilla e la Pantasilea;,Ho visto Camilla e Penthesilea
da l'altra parte vidi 'l re Latino,"e, dall'altra parte, vide re Latino,"
che con Lavina sua figlia sedea.,"che sedeva accanto a Lavinia, sua figlia."
"Vidi quel Bruto che cacciò Tarquino,","Ho visto quel Bruto che ha fatto uscire Tarquin,"
"Lucrezia, Iulia, Marzïa e Corniglia;","Lucrezia, Julia, Marcia e Cornelia,"
"e solo, in parte, vidi 'l Saladino.","e, solitario, a pezzi, Saladino."
"Poi ch'innalzai un poco più le ciglia,","Quando alzai gli occhi un po' più in alto,"
vidi 'l maestro di color che sanno,"Ho visto il padrone degli uomini che sanno,"
seder tra filosofica famiglia.,seduto in famiglia filosofica.
"Tutti lo miran, tutti onor li fanno:","Là tutti lo ammirano, tutti lo onorano:"
"quivi vid'ïo Socrate e Platone,","là ho visto sia Socrate che Platone,"
che 'nnanzi a li altri più presso li stanno;,"più vicino a lui, davanti a tutto il resto;"
"Democrito che 'l mondo a caso pone,","Democrito, che attribuisce il mondo al caso,"
