Original,Translate_IT
In forma dunque di candida rosa,"Così, sotto questo aspetto di rosa tutta bianca,"
mi si mostrava la milizia santa,Mi è sembrato di vedere questa santa milizia.
che nel suo sangue Cristo fece sposa;,al prezzo del suo stesso sangue sposò Gesù Cristo.
"ma l'altra, che volando vede e canta","L’altro, che nel suo volo vede e canta la gloria"
la gloria di colui che la 'nnamora,"di Colui che fa da solo lo scopo del suo amore,"
"e la bontà che la fece cotanta,","e la sua bontà che la rese felice,"
sì come schiera d'ape che s'infiora,imitando uno sciame di api che a volte
una fïata e una si ritorna,"si posa sui fiori, e che a volte ritorna"
"là dove suo laboro s'insapora,","al punto in cui il sapore del suo bottino aumenta,"
nel gran fior discendeva che s'addorna,scendeva nel seno di questo grande fiore
"di tante foglie, e quindi risaliva","che adorna un gran numero di foglie, e poi risaliva"
là dove 'l süo amor sempre soggiorna.,dove l’Amore ha fissato la sua sede per sempre.
Le facce tutte avean di fiamma viva,I loro volti a tutti erano di pura fiamma;
"e l'ali d'oro, e l'altro tanto bianco,","le loro ali erano d'oro, e il resto era così bianco"
che nulla neve a quel termine arriva.,La neve non è mai stata così.
"Quando scendean nel fior, di banco in banco",Discendendo così da gradino a gradino
porgevan de la pace e de l'ardore,"in questo fiore, un po’ del loro sereno ardore"
ch'elli acquistavan ventilando il fianco.,che si diffondeva ovunque.
Né l'interporsi tra 'l disopra e 'l fiore,E tuttavia il furto di queste folle senza numero
di tanta moltitudine volante,"che s’interpone al di sopra del fiore,"
impediva la vista e lo splendore:,"non impediva affatto la vista o lo splendore,"
ché la luce divina è penetrante,perché la chiarezza divina entra nell'universo
"per l'universo secondo ch'è degno,","nella proporzione di cui si mostra degno,"
sì che nulla le puote essere ostante.,e nient’altro può formargli un ostacolo.
"Questo sicuro e gaudïoso regno,","E questo regno felice, che nulla può turbare"
"frequente in gente antica e in novella,","e dove l'antico popolo abbonda e la nuova,"
viso e amore avea tutto ad un segno.,offriva nello stesso luogo il loro amore e la loro gioia.
Oh trina luce che 'n unica stella,Brillante Trinità che nella stella unica
"scintillando a lor vista, sì li appaga!","che brilla per loro, fa’ così la loro felicità,"
guarda qua giuso a la nostra procella!,Guarda verso il basso e vedi le nostre disgrazie!
"Se i barbari, venendo da tal plaga","Se un tempo, scendendo dalle rive, Elizio"
"che ciascun giorno d'Elice si cuopra,","guarda tutti i giorni da lassù, girando,"
"rotante col suo figlio ond'ella è vaga,","con il figlio che ama ancora, i barbari"
"veggendo Roma e l'ardüa sua opra,","Rimasero stupefatti, scorgendo Roma."
"stupefaciensi, quando Laterano","gli splendidi palazzi, del tempo in cui il Laterano"
a le cose mortali andò di sopra;,"si trovava in cima alle cose di questo mondo,"
"ïo, che al divino da l'umano,","Io stesso, che venivo dall’umano al divino"
"a l'etterno dal tempo era venuto,",e che passava il tempo a questa eternità
"e di Fiorenza in popol giusto e sano,","e dalla nostra Firenze al popolo giusto e puro,"
di che stupor dovea esser compiuto!,Devo indovinare qual era il mio stupore.
Certo tra esso e 'l gaudio mi facea,"E tuttavia per mezzo di essa, così come per la gioia"
libito non udire e starmi muto.,Dimenticavo il mio silenzio con quello degli altri.
E quasi peregrin che si ricrea,Come il pellegrino che si fa una felicità
"nel tempio del suo voto riguardando,","di visitare il tempio dove lo chiamava il suo desiderio,"
"e spera già ridir com'ello stea,","pensando ai racconti che deve ai suoi amici,"
"su per la viva luce passeggiando,","mentre passeggiavo nella luce viva,"
"menava ïo li occhi per li gradi,",Ho seguito con lo sguardo ciascuno di questi gradini.
"mo sù, mo giù e mo recirculando.","verso l'alto, verso il basso o girando in tondo."
"Vedëa visi a carità süadi,",Ci vedevo da sguardi che invitavano all’amore.
"d'altrui lume fregiati e di suo riso,","del prossimo, dove brillava la luce dall’alto"
e atti ornati di tutte onestadi.,"sul proprio sorriso, e di degne vicinanze."
La forma general di paradiso,Già dal mio sguardo potevo baciare
"già tutta mïo sguardo avea compresa,","l’aspetto del Paradiso preso in tutto il suo insieme,"
in nulla parte ancor fermato fiso;,senza fermarmi su nessuno dei suoi punti;
e volgeami con voglia rïaccesa,"e mi voltai, preso da un altro desiderio,"
per domandar la mia donna di cose,per sapere di mia moglie un po 'più dettagli
di che la mente mia era sospesa.,su cui il mio spirito rimaneva come in sospeso.
"Uno intendëa, e altro mi rispuose:","Aspettavo una voce, un’altra rispose:"
credea veder Beatrice e vidi un sene,"perché pensavo di trovare Beatrice, e vivo"
vestito con le genti glorïose.,Un vecchio vestito come si è nella gloria.
Diffuso era per li occhi e per le gene,Si vedeva il suo sguardo e il suo volto impregnati
"di benigna letizia, in atto pio",di una soave felicità in cui brillava la bontà
quale a tenero padre si convene.,che lo rendeva simile al più tenero dei padri.
"E “Ov'è ella?”, sùbito diss'io.",“Dov’è?” furono le mie prime parole.
Ond'elli: “A terminar lo tuo disiro,"“Per condurre, mi disse, il tuo desiderio alla fine,"
mosse Beatrice me del loco mio;,Beatrice mi ha fatto abbandonare il mio posto.
e se riguardi sù nel terzo giro,"Guarda verso l'alto, sul terzo cerchio"
"dal sommo grado, tu la rivedrai","dalla cima, e la rivedrai,"
nel trono che suoi merti le sortiro”.,seduta sul trono dove la pone il suo merito”.
"Sanza risponder, li occhi sù levai,",Senza ulteriori indugi alzai lo sguardo
e vidi lei che si facea corona,"e la vidi lassù, portando una corona"
reflettendo da sé li etterni rai.,che formavano i riflessi dei raggi eterni.
Da quella regïon che più sù tona,L’occhio mortale non è mai così lontano
"occhio mortale alcun tanto non dista,","dalla zona più alta in cui ringhia il tuono,"
"qualunque in mare più giù s'abbandona,","anche se si è tuffato fino al fondo del mare,"
quanto lì da Beatrice la mia vista;,che Beatrice era dalla mia vista lontana;
"ma nulla mi facea, ché süa effige","ma non era nulla, perché la sua immagine"
non discendëa a me per mezzo mista.,"arrivava fino a me, pura di ogni mezzo."
"“O donna in cui la mia speranza vige,","O signora, che sostieni tutta la mia speranza"
e che soffristi per la mia salute,"e che, per la mia salvezza, si erano degnati di lasciare"
"in inferno lasciar le tue vestige,","fino al fondo dell’Inferno la traccia dei tuoi passi,"
"di tante cose quant'i' ho vedute,",Riconosco mantenere la grazia e la virtù
dal tuo podere e da la tua bontate,"di tanti e tanti oggetti che ho potuto contemplare,"
riconosco la grazia e la virtute.,della tua potenza e magnanimità.
Tu m'hai di servo tratto a libertate,"Da schiavo, il tuo favore mi ha reso libero,"
"per tutte quelle vie, per tutt'i modi",con ogni mezzo e con ogni mezzo
che di ciò fare avei la potestate.,"che, per raggiungere lo scopo, erano in tuo potere."
"La tua magnificenza in me custodi,","Conservi sempre questa magnificenza,"
"sì che l'anima mia, che fatt'hai sana,","in modo che la mia anima, finalmente da te guarisca,"
piacente a te dal corpo si disnodi”.,"senza i legami del corpo, goda della tua grazia»."
"Così orai; e quella, sì lontana","Questa fu la mia preghiera; ed essa, da così lontano"
"come parea, sorrise e riguardommi;","che sembrava, sorridendo guardandomi,"
poi si tornò a l'etterna fontana.,Poi si voltò verso la Sorgente Eterna.
E 'l santo sene: “Acciò che tu assommi,Allora il santo vecchio: «Affinché si compia
"perfettamente”, disse, “il tuo cammino,","di punto in punto, dice, fino alla fine del tuo viaggio"
"a che priego e amor santo mandommi,","a cui mi hanno invitato l’amore e la preghiera,"
vola con li occhi per questo giardino;,Sorvola con lo sguardo tutto questo vasto giardino!
ché veder lui t'acconcerà lo sguardo,La sua contemplazione preparerà la tua vista
più al montar per lo raggio divino.,per salire meglio ai raggi celesti.
"E la regina del cielo, ond'ïo ardo","E la Regina del cielo, che fa bruciare il mio cuore"
"tutto d'amor, ne farà ogne grazia,","dell'amore più perfetto, ci darà la sua grazia,"
però ch'i' sono il suo fedel Bernardo”.,Perché io stesso sono il suo fedele Bernardo”.
Qual è colui che forse di Croazia,"Come quello che viene, mettiamoci dalla Croazia."
"viene a veder la Veronica nostra,",solo per vedere da noi la Veronica
"che per l'antica fame non sen sazia,","e non può solleticare la sua fame che viene da lontano,"
"ma dice nel pensier, fin che si mostra:","ma si dice nel suo cuore, mentre gli viene mostrata:"
"'Segnor mio Iesù Cristo, Dio verace,","O Signore Gesù Cristo, o Dio di verità,"
or fu sì fatta la sembianza vostra?';,Il tuo viso era fatto così?”
tal era io mirando la vivace,"così rimasi, vedendo l’attiva carità"
"carità di colui che 'n questo mondo,","di colui che da noi, nel mondo di sotto,"
"contemplando, gustò di quella pace.",Assaggiava contemplando un po’ di questa pace.
"“Figliuol di grazia, quest'esser giocondo”,","Figlio della grazia, fu la sua entrata in materia,"
"cominciò elli, “non ti sarà noto,","come conoscerai questo stato beato,"
tenendo li occhi pur qua giù al fondo;,Se tieni sempre gli occhi fissi al piano di sotto?
"ma guarda i cerchi infino al più remoto,","Guarda questi cerchi fino in alto,"
tanto che veggi seder la regina,e nel più lontano potrai vedere la Regina
cui questo regno è suddito e devoto”.,a cui obbedisce santamente questo regno!”
Io levai li occhi; e come da mattina,"Quando alzai gli occhi, e come al mattino"
la parte orïental de l'orizzonte,Il bordo dell'orizzonte che tocca l'Oriente
"soverchia quella dove 'l sol declina,","passa lo splendore di Valtro dove il sole tramonta,"
"così, quasi di valle andando a monte","Allo stesso modo, passeggiando il mio sguardo dal più basso"
"con li occhi, vidi parte ne lo stremo","in alto, vidi un posto in cima,"
vincer di lume tutta l'altra fronte.,il cui splendore superava l’intera fronte opposta.
E come quivi ove s'aspetta il temo,E così come il bordo in cui si aspetta il carro armato.
"che mal guidò Fetonte, più s'infiamma,","che Phaeton conservò così male, sembra ardere,"
"e quinci e quindi il lume si fa scemo,","mentre da ogni parte la chiarezza diminuisce,"
così quella pacifica oriafiamma,verso l'ambiente si avviva l'orifiamma
"nel mezzo s'avvivava, e d'ogne parte","che conduce alla pace, mentre tutt’intorno"
per igual modo allentava la fiamma;,La chiarezza svaniva in modo uniforme.
"e a quel mezzo, con le penne sparte,","In questo stesso ambiente, le ali dispiegate,"
"vid'io più di mille angeli festanti,","l’aria in festa, ho visto volare più di mille angeli,"
ciascun distinto di fulgore e d'arte.,e ciascuno differiva per l’aspetto e la luminosità.
Vidi a lor giochi quivi e a lor canti,"E lì, tra i loro giochi e tra la loro musica,"
"ridere una bellezza, che letizia","ho visto una bella risata, che negli occhi"
era ne li occhi a tutti li altri santi;,Tutti gli altri santi diventavano gioia.
e s'io avessi in dir tanta divizia,Se avessi l’eloquenza così ricca come lo è
"quanta ad imaginar, non ardirei",L’immaginazione non temerebbe di meno.
lo minimo tentar di sua delizia.,affrontare il ritratto della sua grazia.
"Bernardo, come vide li occhi miei","Bernard, vedendo i miei occhi che si erano fermati"
"nel caldo suo caler fissi e attenti,","attenti e fissi sull’ardore della sua fiamma,"
"li suoi con tanto affetto volse a lei,","Volse i suoi verso di lei, con tanta tenerezza."
che ' miei di rimirar fé più ardenti.,E il mio sguardo si infuocò ancora di più.
