Original,Translate_IT
"Dal centro al cerchio, e sì dal cerchio al centro",Dal bordo al centro si vede scorrere l'acqua
"movesi l'acqua in un ritondo vaso,","Nella nappa rotonda, dal centro al bordo,"
secondo ch'è percosso fuori o dentro:,Come si fa a spingersi verso l'esterno o verso l'interno.
ne la mia mente fé sùbito caso,"Questo era ciò che ora stava davanti alla mia anima,"
"questo ch'io dico, sì come si tacque",La vita sana di Tommaso taceva silenziosa
"la glorïosa vita di Tommaso,","E dolcemente intasata la sua voce svanì,"
per la similitudine che nacque,Se quella somiglianza che si verifica...
"del suo parlare e di quel di Beatrice,","Quando parlò, poi la bocca di Beatricen,"
"a cui sì cominciar, dopo lui, piacque:",Che ora è piaciuto alzare la voce:
"“A costui fa mestieri, e nol vi dice","""Gli è necessario, anche se non vi conosce"
"né con la voce né pensando ancora,","Nelle parole c'è ancora da leggere dentro,"
d'un altro vero andare a la radice.,Cercare un'altra ragione di verità.
Diteli se la luce onde s'infiora,Ditegli se questa luce che il vostro essere
"vostra sustanza, rimarrà con voi","Così splendidamente fiorita, vi rimarrà per sempre"
etternalmente sì com'ell'è ora;,"Nello stesso splendore, ha dimostrato fino ad ora."
"e se rimane, dite come, poi","E, restate. Dite così, per non sbagliare mai,"
"che sarete visibili rifatti,","Come quando sarete di nuovo visibili,"
esser porà ch'al veder non vi nòi”.,"Non acceca e non confonde il vostro sguardo."""
"Come, da più letizia pinti e tratti,",Come con il desiderio più intenso spesso qui sulla terra
a la fïata quei che vanno a rota,Le ballerine che ballano con allegria
"levan la voce e rallegrano li atti,",Alzate la voce e rallegratevi.
"così, a l'orazion pronta e divota,","Così ha mostrato la nuova voglia di doppia corona,"
li santi cerchi mostrar nova gioia,"Quando gli chiese, così presto, ma devotamente,"
nel torneare e ne la mira nota.,In gioioso girare e cantare miracoli e splendore.
Qual si lamenta perché qui si moia,"Chi si lamenta della nostra morte sulla terra,"
"per viver colà sù, non vide quive","Per vivere lì, oh che sente e pensa"
lo refrigerio de l'etterna ploia.,Non come ci pasceremo sulla rugiada eterna.
Quell'uno e due e tre che sempre vive,"Che tre, due e uno, che dirige tutto"
"e regna sempre in tre e 'n due e 'n uno,","E vivete per sempre in una, due e tre,"
"non circunscritto, e tutto circunscrive,",E... eternamente senza limiti... l'universo confinato...
tre volte era cantato da ciascuno,Le canzoni sono state cantate in melodee
"di quelli spirti con tal melodia,",Tre volte nel coro per ottenere il pieno salario del dovere
ch'ad ogne merto saria giusto muno.,E dare ogni merito.
E io udi' ne la luce più dia,E una voce risuonava alla luce della luce
"del minor cerchio una voce modesta,",Il cerchio più piccolo poi si avvicinò alla mitezza
"forse qual fu da l'angelo a Maria,",Non è quello dell'angelo della profezia.
risponder: “Quanto fia lunga la festa,"""Fino a quando il piacere nella terra celeste,"
"di paradiso, tanto il nostro amore",Per tutto il tempo che il nostro amore dura e fa
si raggerà dintorno cotal vesta.,Dimostrati intorno a noi in questo splendore.
La sua chiarezza séguita l'ardore;,"E la sua chiarezza, corrisponde al fuoco,"
"l'ardor la visïone, e quella è tanta,","La brama di oscurità, e questo sarà più per noi,"
quant'ha di grazia sovra suo valore.,Piu' la Grazia e' su di noi.
Come la carne glorïosa e santa,"Quando prenderemo il corpo guarito,"
"fia rivestita, la nostra persona","Sarà il nostro essere in grazia superiore,"
più grata fia per esser tutta quanta;,"Piu' e' completo, piu' e' perfetto."
per che s'accrescerà ciò che ne dona,"Ma la luce libera si alzerà,"
"di gratüito lume il sommo bene,","che riceviamo per grazia dal Supremo Bene,"
lume ch'a lui veder ne condiziona;,"luce che ci permette di vederlo,"
"onde la visïon crescer convene,","E più in alto si affacciano gli occhi,"
"crescer l'ardor che di quella s'accende,","Più alto è il calore che accende l'oscurita,"
crescer lo raggio che da esso vene.,Più alto è il raggio che proviene da esso.
"Ma sì come carbon che fiamma rende,","Ma, come il carbone che spruzza la fiamma,"
"e per vivo candor quella soverchia,",Sopravvivono in un vibrato splendore
sì che la sua parvenza si difende;,E si vede come splendono anche questi.
così questo folgór che già ne cerchia,"Così lo splendore che già ora ci gira,"
fia vinto in apparenza da la carne,"Una volta sconfisse le nostre apparenze carnali,"
che tutto dì la terra ricoperchia;,Quando Dio lo libererà dalla sua tomba.
né potrà tanta luce affaticarne:,Non saremo così splendenti per il castigo.
ché li organi del corpo saran forti,"Perché forte per godere tutte le vigorose,"
a tutto ciò che potrà dilettarne”.,"Sarà ogni strumento del nostro corpo."""
Tanto mi parver sùbiti e accorti,Amen chiamarono entrambi cori e lasciarono
"e l'uno e l'altro coro a dicer “Amme!”,","Per coerenza, il desiderio di desiderare,"
che ben mostrar disio d'i corpi morti:,Riunirsi ai loro corpi.
"forse non pur per lor, ma per le mamme,","E probabilmente non solo per sé, no, per l'accoglienza"
per li padri e per li altri che fuor cari,"dei padri, delle madri e degli altri cari,"
anzi che fosser sempiterne fiamme.,Quella che la amava... prima che avvolgesse la fiamma.
"Ed ecco intorno, di chiarezza pari,","E guarda, alla lucentezza di questi fuochi eterni"
"nascere un lustro sopra quel che v'era,",È venuto la stessa chiarezza intorno come quando la luce
per guisa d'orizzonte che rischiari.,Rinnovare la freccia d'oro del giorno del sole.
E sì come al salir di prima sera,"Come quando si rompe gradualmente la sera,"
"comincian per lo ciel nove parvenze,","Nel cielo punti, piccolo e pallido, brillare,"
"sì che la vista pare e non par vera,",Così che la scienza appare verace e non verace;
parvemi lì novelle sussistenze,Così ora credo in nuovi anelli
"cominciare a vedere, e fare un giro","Dubita ancora di esplorare nuove creature,"
di fuor da l'altre due circunferenze.,Lontano da quelle due corone.
Oh vero sfavillar del Santo Spiro!,"O vero sbirro, illuminato dal dolore"
come si fece sùbito e candente,Lo Spirito della salvezza è così improvvisamente luminoso!
"a li occhi miei che, vinti, nol soffriro!",Non potete resistergli ora il mio occhio.
Ma Bëatrice sì bella e ridente,"Ma quando mi volsi a Beatrice,"
"mi si mostrò, che tra quelle vedute","Era cosi' bella, cosi' bella, cosi' felice..."
si vuol lasciar che non seguir la mente.,Che questa immagine non porti a termine una parola terrena.
Quindi ripreser li occhi miei virtute,Il mio occhio fu entusiasta di una nuova potenza.
a rilevarsi; e vidimi translato,L'ho aperto e mi sono guardato in alto
sol con mia donna in più alta salute.,"Con lei sola, rapita alla salvezza superiore."
"Ben m'accors'io ch'io era più levato,","Si', ho capito di essere alzata."
"per l'affocato riso de la stella,",Perché la nuova stella sorrise ardentemente
che mi parea più roggio che l'usato.,E sembrava invertersi di rosso inusuale.
Con tutto 'l core e con quella favella,"Dal cuore, nella lingua, che lontano"
"ch'è una in tutti, a Dio feci olocausto,","Vicino ai popoli ci sono moltitudini,"
qual conveniesi a la grazia novella.,Ho offerto sacrifici di grazie al Signore supremo.
E non er'anco del mio petto essausto,"E divertito posso già essere vero,"
"l'ardor del sacrificio, ch'io conobbi","Ah, io gli offro tutta la brace,"
esso litare stato accetto e fausto;,Che le vittime sono state piacevoli al Signore.
ché con tanto lucore e tanto robbi,"perché le luci, con lo splendore della suprema potenza,"
"m'apparvero splendor dentro a due raggi,","Ho visto da due strisce sferiche che brillano,"
ch'io dissi: “O Elïòs che sì li addobbi!”.,"E gridò: O Dio, creatore di tale splendore!"
Come distinta da minori e maggi,"Così fate, seminate con stelle, grandi e piccole,"
lumi biancheggia tra ' poli del mondo,"Galassia tra il Polo e il Polo si manifesta,"
"Galassia sì, che fa dubbiar ben saggi;","Da chi questo e ciò che i sapienti pensano,"
sì costellati facean nel profondo,"Come queste strisce, formando sul fondo"
Marte quei raggi il venerabil segno,"Marte Rosso il segno di alta classe,"
che fan giunture di quadranti in tondo.,"Quattro quadranti, ben posizionati nel giro."
Qui vince la memoria mia lo 'ngegno;,"L'arte qui deve cedere alla memoria,"
"ché quella croce lampeggiava Cristo,","Poiché Cristo era calato dalla croce,"
sì ch'io non so trovare essempro degno;,Dov'è un'immagine da paragonare?
"ma chi prende sua croce e segue Cristo,","Ma chi prende la sua croce, seguendo il suo Cristo,"
"ancor mi scuserà di quel ch'io lasso,","Da lui perdera' cio' che ho nascosto,"
vedendo in quell'albor balenar Cristo.,Perche' anche lui vede lo splendore di Cristo.
Di corno in corno e tra la cima e 'l basso,"Da un braccio all'altro, da un piede all'altro, apparve"
"si movien lumi, scintillando forte","Luce movimentata, luminosamente splendente,"
nel congiugnersi insieme e nel trapasso:,Perche' si e' unito... mentre passavamo.
"così si veggion qui diritte e torte,","E' cosi' che si vede, si muove qui, correndo li'..."
"veloci e tarde, rinovando vista,","Atomi, proprio qui, in giro,"
"le minuzie d'i corpi, lunghe e corte,","E lungo e breve, unendo e separandosi,"
moversi per lo raggio onde si lista,"vorticoso nel raggio che fluttua attraverso l'ombra,"
"talvolta l'ombra che, per sua difesa,","Dopo di che, quando i caldi fluttuano,"
la gente con ingegno e arte acquista.,L'uomo con scherzo e l'arte afferra avidamente.
"E come giga e arpa, in tempra tesa","E come suoni armonici e arpa fluttuano,"
"di molte corde, fa dolce tintinno",Sono solo le tante corde tese...
"a tal da cui la nota non è intesa,",Anche nell'orecchio i suoni si confondono;
così da' lumi che lì m'apparinno,"Così ora sento il canto della croce e mi sono fermato,"
s'accogliea per la croce una melode,"Come se i sensi si perdessero nel piacere,"
"che mi rapiva, sanza intender l'inno.",Anche se non capivo niente dell'inno.
"Ben m'accors'io ch'elli era d'alte lode,","Ma ho sentito un prezzo alto nei cori,"
però ch'a me venìa “Resurgi” e “Vinci”,Perche' tu prendi e vinci!
come a colui che non intende e ode.,"Fedeli a quelli che non capiscono, ma ascoltano."
"Ïo m'innamorava tanto quinci,","E così qui dolce amore ha penetrato me,"
che 'nfino a lì non fu alcuna cosa,"Che, quale band gentile mi avvolgeva,"
che mi legasse con sì dolci vinci.,Ma nessuno fino ad allora era simile a questo legame.
"Forse la mia parola par troppo osa,",Forse la mia parola sembra audace...
"posponendo il piacer de li occhi belli,","Ripristinando anche i bellissimi occhi coppia,"
ne' quai mirando mio disio ha posa;,Che farebbero riposare tutti i miei desideri.
ma chi s'avvede che i vivi suggelli,"Ma si notano i timbri vivi,"
"d'ogne bellezza più fanno più suso,","Che, più in alto, sempre più bello,"
"e ch'io non m'era lì rivolto a quelli,","E pensate che io sia stato rivolto da quelli,"
escusar puommi di quel ch'io m'accuso,Così mi penseranno scusata
"per escusarmi, e vedermi dir vero:",Vedete che non mi sbaglio del vero.
"ché 'l piacer santo non è qui dischiuso,","Anche in questo caso, però, il piacere salutare,"
"perché si fa, montando, più sincero.",Il modo in cui si sale diventa sempre piu' puro.
,
,
,
