Original,Translate_IT
"Qual venne a Climenè, per accertarsi",La gloria di Colui che muove ogni cosa
"di ciò ch'avëa incontro a sé udito,",pervade l'universo e splende
quei ch'ancor fa li padri ai figli scarsi;,in una parte di più e in un'altra di meno.
"tal era io, e tal era sentito",Ero in quel paradiso che riceve
e da Beatrice e da la santa lampa,più della Sua luce. Colui che scende di là
che pria per me avea mutato sito.,"non può né sapere né dire ciò che ha visto,"
Per che mia donna “Manda fuor la vampa,"perché, avvicinandosi al suo desiderio,"
"del tuo disio”, mi disse, “sì ch'ella esca",così profondamente è il nostro intelletto immerso
segnata bene de la interna stampa:,che la memoria non può seguirla.
non perché nostra conoscenza cresca,"Tuttavia, come gran parte del regno santo"
"per tuo parlare, ma perché t'ausi",come ho potuto conservare come tesoro nella mia mente
"a dir la sete, sì che l'uom ti mesca”.",ora diventera' l'oggetto della mia canzone.
"“O cara piota mia che sì t'insusi,","O buon Apollo, per quest'ultimo travaglio"
"che, come veggion le terrene menti",rendimi un vascello degno
"non capere in trïangol due ottusi,",del dono del tuo alloro belovèd.
così vedi le cose contingenti,"Fino a questo punto, una vetta del monte Parnassus"
"anzi che sieno in sé, mirando il punto","è stato abbastanza, ma ora ho bisogno di entrambi"
a cui tutti li tempi son presenti;,per affrontare la lotta che attende.
mentre ch'io era a Virgilio congiunto,Entra nel mio seno e respira in me
su per lo monte che l'anime cura,"come quando hai tirato fuori Marsia,"
"e discendendo nel mondo defunto,",fuori dal rivestimento delle sue membra.
dette mi fuor di mia vita futura,"O santo Potere, se tu mi prestassi di te stesso"
"parole gravi, avvegna ch'io mi senta",abbastanza che io possa mostrare la più mera ombra
ben tetragono ai colpi di ventura;,"del regno benedetto timbrato nella mia mente,"
per che la voglia mia saria contenta,"mi troverai ai piedi del tuo albero,"
d'intender qual fortuna mi s'appressa:,incoronare me stesso con le stesse foglie
ché saetta previsa vien più lenta”.,di cui il mio tema e voi mi renderete degno.
Così diss'io a quella luce stessa,"Così raramente, padre, sono riuniti"
che pria m'avea parlato; e come volle,per segnare il trionfo di un Cesare o di un poeta...
"Beatrice, fu la mia voglia confessa.",colpa e vergogna dei desideri umani...
"Né per ambage, in che la gente folle","che qualcuno li sta persino bramando,"
già s'inviscava pria che fosse anciso,"quelle foglie sul ramo di Peneian, dovrebbe fare"
"l'Agnel di Dio che le peccata tolle,",il dio gioioso Delphic dà vita alla gioia.
ma per chiare parole e con preciso,Il grande fuoco salta dalla scintilla più piccola.
"latin rispuose quello amor paterno,","Forse, sulla mia scia, la preghiera sarà plasmata"
chiuso e parvente del suo proprio riso:,con parole migliori che Cyrrha possa rispondere.
"“La contingenza, che fuor del quaderno",La lampada del mondo sorge su di noi mortali
"de la vostra matera non si stende,","in punti diversi. Ma, da quello che si unisce"
tutta è dipinta nel cospetto etterno;,"quattro cerchi con tre incroci, viene fuori"
necessità però quindi non prende,su un percorso migliore e in concomitanza
se non come dal viso in che si specchia,con un segno migliore. Poi tempera e impronta
nave che per torrente giù discende.,la cera del mondo più alla sua propria moda.
"Da indi, sì come viene ad orecchia",La sua ascesa vicino a quel punto aveva tirato fuori la mattina là
"dolce armonia da organo, mi viene","e sera qui, e quell'emisfero"
a vista il tempo che ti s'apparecchia.,"era schierato in luce, questo in oscurità,"
Qual si partio Ipolito d'Atene,quando vidi che Beatrice si era rivoltata verso la sua sinistra
"per la spietata e perfida noverca,",e ora stava fissando il sole...
tal di Fiorenza partir ti convene.,Mai l'aquila aveva fissato il suo sguardo su di esso.
"Questo si vuole e questo già si cerca,","E, come un secondo raggio uscirà dal primo"
e tosto verrà fatto a chi ciò pensa,"e rialzarsi fino alla sua sorgente,"
là dove Cristo tutto dì si merca.,"anche come un pellegrino desidera tornare a casa,"
La colpa seguirà la parte offensa,"così il suo sguardo, versando attraverso i miei occhi"
"in grido, come suol; ma la vendetta","sulla mia immaginazione, si è fatta mia, e io,"
fia testimonio al ver che la dispensa.,"contro la nostra pratica, metti i miei occhi sul sole."
Tu lascerai ogne cosa diletta,Molto che i nostri poteri qui non possono sostenere è lì
più caramente; e questo è quello strale,consentito in virtù della natura del luogo
che l'arco de lo essilio pria saetta.,creato come dimora adatta all'uomo.
Tu proverai sì come sa di sale,"Non potevo sopportarlo a lungo, ma non così breve un tempo"
"lo pane altrui, e come è duro calle","per non vederlo scintillare ovunque,"
lo scendere e 'l salir per l'altrui scale.,come il ferro liquido che scorre dal fuoco.
"E quel che più ti graverà le spalle,","Improvvisamente sembrava che un giorno fosse stato aggiunto a quel giorno,"
sarà la compagnia malvagia e scempia,come se Colui che ha il potere
con la qual tu cadrai in questa valle;,aveva adornato il cielo con un secondo sole.
"che tutta ingrata, tutta matta ed empia",Beatrice aveva fissato gli occhi.
"si farà contr'a te; ma, poco appresso,",sulle ruote eterne e ora fisso
"ella, non tu, n'avrà rossa la tempia.","la mia vista su di lei, ritirandola dall'alto."
Di sua bestialitate il suo processo,"Mentre la guardavo, ero cambiato dentro,"
farà la prova; sì ch'a te fia bello,come Glauco era sulla degustazione dell'erba
averti fatta parte per te stesso.,che lo ha reso consorte degli dei nel mare.
Lo primo tuo refugio e 'l primo ostello,Per volare oltre l'umano non può essere descritto
sarà la cortesia del gran Lombardo,a parole. Che l'esempio sia sufficiente a uno
che 'n su la scala porta il santo uccello;,per chi la grazia tiene in serbo questa esperienza.
"ch'in te avrà sì benigno riguardo,",Che io fossi lì solo in quella parte che tu...
"che del fare e del chieder, tra voi due,","l'ultimo creato è conosciuto solo a te, o amore che governa"
fia primo quel che tra li altri è più tardo.,il cielo e mi ha attirato là con la tua luce.
"Con lui vedrai colui che 'mpresso fue,","Quando i cieli tu hai fatto eterno,"
"nascendo, sì da questa stella forte,","ruotando nel desiderio, catturato la mia attenzione"
che notabili fier l'opere sue.,"con l'armonia che affliggi,"
Non se ne son le genti ancora accorte,allora gran parte del cielo sembrava bruciato
"per la novella età, ché pur nove anni",per il sole fiammeggiante che né pioggia né fiume
son queste rote intorno di lui torte;,mai nutrito un lago così vasto.
"ma pria che 'l Guasco l'alto Arrigo inganni,",La novità del suono e la luce luminosa
parran faville de la sua virtute,illuminato in me tale desiderio ardente di conoscere la loro causa
in non curar d'argento né d'affanni.,come non avevo mai provato con tanta nitidezza.
Le sue magnificenze conosciute,"E lei, che mi conosceva come conoscevo me stessa,"
"saranno ancora, sì che ' suoi nemici",per calmare la mia mente agitata
non ne potran tener le lingue mute.,"prima ancora che cominciassi a parlare, le separavo le labbra"
A lui t'aspetta e a' suoi benefici;,e disse: 'Ti fai noioso-imbecille
"per lui fia trasmutata molta gente,","con false nozioni, in modo che non si può vedere"
cambiando condizion ricchi e mendici;,"quello che avresti capito, se non li avessi buttati via."
e portera' ne scritto ne la mente,"Non sei ancora sulla terra, come credi."
"di lui, e nol dirai”; e disse cose","In effetti, fulmini che osano dalla sua fonte"
incredibili a quei che fier presente.,"Non hai mai accelerato tanto quanto torni dalla tua."""
"Poi giunse: “Figlio, queste son le chiose",Se mi avessero privato della mia precedente confusione...
di quel che ti fu detto; ecco le 'nsidie,"con le sue brevi e sorridenti parole,"
che dietro a pochi giri son nascose.,Ero il più impigliato nel nuovo dubbio
"Non vo' però ch'a' tuoi vicini invidie,",e disse: 'Io ero contento di essere rilasciato
poscia che s'infutura la tua vita,"dal mio stupore, ma ora sono stupito"
via più là che 'l punir di lor perfidie”.,"che posso scorrere attraverso questi corpi luminosi."""
"Poi che, tacendo, si mostrò spedita","Poi, sospirando con pietà,"
l'anima santa di metter la trama,piegato i suoi occhi su di me con solo quello sguardo
"in quella tela ch'io le porsi ordita,","una madre getta sul suo bambino delirante,"
"io cominciai, come colui che brama,","e disse: ""Tutte le cose create hanno un ordine"
"dubitando, consiglio da persona","in se stessi, e questo genera la forma"
che vede e vuol dirittamente e ama:,che permette all'universo di assomigliare a Dio.
"“Ben veggio, padre mio, sì come sprona",Qui le creature superiori vedono l'impronta
"lo tempo verso me, per colpo darmi","della pena eterna, la fine"
"tal, ch'è più grave a chi più s'abbandona;",per la quale quel modello era esso stesso esposto.
"per che di provedenza è buon ch'io m'armi,","'In questo ordine, tutte le nature hanno la loro piega"
"sì che, se loco m'è tolto più caro,","secondo i loro diversi destini,"
io non perdessi li altri per miei carmi.,sia più vicino alla loro fonte o più lontano da essa.
"Giù per lo mondo sanza fine amaro,","'Si muovono, quindi, verso diversi porti"
e per lo monte del cui bel cacume,"sulla vastità del mare dell'essere,"
"li occhi de la mia donna mi levaro,",ciascuno intriso di istinto che lo spinge sul suo corso.
"e poscia per lo ciel, di lume in lume,","'Questo istinto porta fuoco verso la luna,"
"ho io appreso quel che s'io ridico,","questa è la forza in movimento nei cuori mortali,"
a molti fia sapor di forte agrume;,questo lega la terra alla terra e la rende unica.
"e s'io al vero son timido amico,",'Questo arco spinge non solo creato le cose
temo di perder viver tra coloro,"che mancano di intelligenza, ma anche quelli"
che questo tempo chiameranno antico”.,che hanno sia l'intelletto che l'amore.
La luce in che rideva il mio tesoro,"'La prova, che regola tutto questo,"
"ch'io trovai lì, si fé prima corusca,",fa con la sua luce per sempre calmare il cielo
quale a raggio di sole specchio d'oro;,"che contiene quello che gira con la massima velocità,"
indi rispuose: “Coscïenza fusca,"""e là, ora, per un luogo stabilito,"
o de la propria o de l'altrui vergogna,"il potere di quella corda ci porta,"
pur sentirà la tua parola brusca.,"puntato, come è tutto spara, ad un bersaglio gioioso."
"Ma nondimen, rimossa ogne menzogna,","""È vero che come un'opera spesso fallirà"
tutta tua visïon fa manifesta;,"per corrispondere alla sua forma prevista, alla sua materia"
e lascia pur grattar dov'è la rogna.,"sordo e insensibile al piano dell'artigiano,"
Ché se la voce tua sarà molesta,"Cosi' a volte una creatura, che ha la capacita'..."
"nel primo gusto, vital nodrimento","per sterzare, così spinto, dirigersi verso un'altra via,"
"lascerà poi, quando sarà digesta.",in deviazione dal corso migliore
"Questo tuo grido farà come vento,","'e, proprio come a volte vediamo il fuoco"
che le più alte cime più percuote;,"cadere da una nuvola, proprio così l'impulso primordiale,"
e ciò non fa d'onor poco argomento.,"deviato dal falso piacere, la volge verso la terra."
"Però ti son mostrate in queste rote,","'Se ho ragione, non dovresti più chiederti"
nel monte e ne la valle dolorosa,al tuo sorgere che alla discesa di un ruscello
"pur l'anime che son di fama note,",dalla cima di una montagna fino ai piedi.
"che l'animo di quel ch'ode, non posa","Sarebbe stupefacente se tu, liberati"
né ferma fede per essempro ch'aia,"da ogni ostacolo, era rimasto sotto,"
"la sua radice incognita e ascosa,","come se sulla terra una fiamma viva si fosse fermata."""
né per altro argomento che non paia”.,Poi volse la faccia verso il cielo.
