Original,Translate_IT
Tant'eran li occhi miei fissi e attenti,"I miei occhi erano cosi' insistenti, cosi' intenzionali."
"a disbramarsi la decenne sete,",per trovare soddisfazione per i loro dieci...
che li altri sensi m'eran tutti spenti.,anno sete che ogni altro senso è stato speso.
Ed essi quinci e quindi avien parete,"E ad ogni lato, i miei occhi sono stati murati dentro da"
di non caler - così lo santo riso,"l'indifferenza verso tutto il resto (con la sua vecchia rete,"
a sé traéli con l'antica rete! -;,"il santo sorriso così li ha attirati a sé),"
quando per forza mi fu vòlto il viso,quando sono stato costretto a girare gli occhi verso sinistra
"ver' la sinistra mia da quelle dee,",da quelle tre dee perché ho sentito
perch'io udi' da loro un “Troppo fiso!”;,"mi avvertono: ""Tu guardi troppo fisso."""
e la disposizion ch'a veder èe,E la condizione che affligge la vista
"ne li occhi pur testé dal sol percossi,",quando gli occhi sono stati appena colpiti dalla forza del sole
sanza la vista alquanto esser mi fée.,mi ha lasciato senza la mia visione per un certo tempo.
Ma poi ch'al poco il viso riformossi,Ma quando la mia vista si abituò
(e dico 'al poco' per rispetto al molto,meno sensazioni (cioè meno di
"sensibile onde a forza mi rimossi),","la forza potente che ha fatto ripiegare i miei occhi,"
vidi 'n sul braccio destro esser rivolto,Vidi il glorioso esercito: si era spostato
"lo glorïoso essercito, e tornarsi",intorno e a destra; aveva girato a est;
col sole e con le sette fiamme al volto.,ha affrontato le sette fiamme e affrontato il sole.
Come sotto li scudi per salvarsi,"Così come, protetto dai suoi scudi, uno squadrone"
"volgesi schiera, e sé gira col segno,","ruota, per salvarsi, intorno al suo standard"
prima che possa tutta in sé mutarsi;,finché tutti i suoi uomini non abbiano cambiato direzione;
quella milizia del celeste regno,così qui tutte le truppe del regno celeste
"che procedeva, tutta trapassonne",all'interno dell'avanguardia passata davanti a noi
pria che piegasse il carro il primo legno.,prima che il carro oscillasse intorno all'albero del palo.
"Indi a le rote si tornar le donne,",Tornando alle ruote le signore poi tornarono;
e 'l grifon mosse il benedetto carco,"e anche se il griffin muoveva il carico benedetto,"
"sì, che però nulla penna crollonne.","quando lo fece, nessuna delle sue piume si mescolava."
La bella donna che mi trasse al varco,"La bella signora che mi aveva aiutato a guadare Lethe,"
e Stazio e io seguitavam la rota,"e io e Statius, seguendo la ruota"
che fé l'orbita sua con minore arco.,"che girava a destra, intorno all'arco interno, più piccolo,"
"Sì passeggiando l'alta selva vòta,",erano lentamente passando attraverso il bosco alto-vuoto
"colpa di quella ch'al serpente crese,",a causa di colui che aveva creduto al serpente;
temprava i passi un'angelica nota.,il nostro ritmo è stato misurato da una canzone angelica.
Forse in tre voli tanto spazio prese,Lo spazio che abbiamo coperto potrebbe essere abbinato forse
"disfrenata saetta, quanto eramo","per tre rampe di alberi di una freccia scatenata,"
"rimossi, quando Bëatrice scese.",quando Beatrice scese dal carro.
Io senti' mormorare a tutti “Adamo”;,"""Adam,"" li ho sentiti tutti mormorare,"
poi cerchiaro una pianta dispogliata,e poi disegnarono intorno ad un albero il cui
di foglie e d'altra fronda in ciascun ramo.,ramo era stato spogliato di fiori e di foglie.
"La coma sua, che tanto si dilata","Come cresce più alto, così i suoi rami si diffusero"
"più quanto più è sù, fora da l'Indi",più larga; ha raggiunto un'altezza che anche in
ne' boschi lor per altezza ammirata.,le loro foreste stupirebbero gli indiani.
"“Beato se', grifon, che non discindi","""Beato te, il cui becco non lo fa, o griffin,"
"col becco d'esto legno dolce al gusto,",cogliere il frutto dolce-degustazione che è vietato
poscia che mal si torce il ventre quindi”.,"e poi affligge la pancia che ha mangiato!"""
Così dintorno a l'albero robusto,"Così, intorno all'albero robusto, gli altri gridarono:"
gridaron li altri; e l'animal binato:,"e l'animale binato: ""CosÃ¬ Ã ̈"
“Sì si conserva il seme d'ogne giusto”.,"la discendenza di ogni giusto preservato."""
"E vòlto al temo ch'elli avea tirato,","E si voltò verso l'albero che aveva tirato,"
"trasselo al piè de la vedova frasca,",L'ha disegnato ai piedi dell'albero spogliato
e quel di lei a lei lasciò legato.,"e, con un ramo di quell'albero, legarono i due."
"Come le nostre piante, quando casca","Proprio come le nostre piante che, quando la grande luce cade"
giù la gran luce mischiata con quella,"sulla terra, mescolato con la luce che risplende dietro"
"che raggia dietro a la celeste lasca,","le stelle dei pesci celesti, si gonfiano"
"turgide fansi, e poi si rinovella",con germogli-ogni pianta rinnova la sua colorazione
"di suo color ciascuna, pria che 'l sole",prima che il sole abbia inginocchiato i suoi destrieri sotto
giunga li suoi corsier sotto altra stella;,"un'altra costellazione - così l'albero,"
men che di rose e più che di vïole,"i cui rami, prima di essere stati così solitari,"
"colore aprendo, s'innovò la pianta,","è stato ora rinnovato, mostrando una tinta che era"
che prima avea le ramora sì sole.,"meno della rosa, più della viola."
"Io non lo 'ntesi, né qui non si canta",Non ho capito l'inno che loro
"l'inno che quella gente allor cantaro,",allora cantato-non è cantato qui su questa terra-
né la nota soffersi tutta quanta.,"né, sonnifero, ho ascoltato la fine."
S'io potessi ritrar come assonnaro,Posso descrivervi come gli occhi spietati
"li occhi spietati udendo di Siringa,","(occhi il cui lungo risveglio è costato loro così caro),"
li occhi a cui pur vegghiar costò sì caro;,"sentendo la storia di Syrinx, si addormentò,"
"come pintor che con essempro pinga,","poi come un dipinto pittore da una modella,"
disegnerei com'io m'addormentai;,Disegnavo il modo in cui mi addormentavo.
ma qual vuol sia che l'assonnar ben finga.,Ma mi astengo... da un'altra vernice abile.
"Però trascorro a quando mi svegliai,","Mi muovo, quindi, dritto al mio tempo di veglia;"
e dico ch'un splendor mi squarciò 'l velo,"Io dico che la radiosità strappa il velo del sonno,"
"del sonno, e un chiamar: “Surgi: che fai?”.","come una voce: ""Alzati: che stai facendo?"""
Quali a veder de' fioretti del melo,"Anche come Pietro, Giovanni e Giacomo, quando portato"
che del suo pome li angeli fa ghiotti,per vedere i fiori del melo...
"e perpetüe nozze fa nel cielo,","il cui frutto affligge la fame degli angeli,"
Pietro e Giovanni e Iacopo condotti,fornendo infinite feste nuziali in Paradiso...
"e vinti, ritornaro a la parola","sono stati sopraffatti da ciò che hanno visto, ma poi,"
"da la qual furon maggior sonni rotti,","ascoltando la parola che ha infranto il sonno più profondo,"
e videro scemata loro scuola,si alzò e vide che la loro borsa di studio era più piccola.
"così di Moïsè come d'Elia,",da quando Mosè ed Elia se ne erano andati
e al maestro suo cangiata stola;,e vide una differenza nel vestito del loro Maestro;
"tal torna' io, e vidi quella pia","così mi svegliai e vidi, in piedi sopra di me,"
sovra me starsi che conducitrice,colei che prima-compassionevole-aveva guidato
fu de' miei passi lungo 'l fiume pria.,i miei passi lungo la riva del fiume. Completamente
E tutto in dubbio dissi: “Ov'è Beatrice?”.,"disorientato, ho chiesto: ""Dov'è Beatrice?"""
Ond'ella: “Vedi lei sotto la fronda,"E lei: ""Beneath the boughs che sono stati rinnovati,"
nova sedere in su la sua radice.,è seduta sulla radice di quell'albero; vedi
Vedi la compagnia che la circonda:,la compagnia che la circonda; il resto
li altri dopo 'l grifon sen vanno suso,sono partiti; dietro il griffin hanno scalato
con più dolce canzone e più profonda”.,"in alto con canzone più dolce, più profonda."""
"E se più fu lo suo parlar diffuso,","Non so se ha detto più di questo,"
"non so, però che già ne li occhi m'era","Perche', ormai, avevo in vista uno che..."
quella ch'ad altro intender m'avea chiuso.,Escludeva tutte le altre cose dal mio punto di vista.
"Sola sedeasi in su la terra vera,","Si sedette sola sul semplice terreno,"
come guardia lasciata lì del plaustro,là a sinistra come guardiano del carro
che legar vidi a la biforme fera.,Avevo visto la cravatta animale a due forme in fretta.
In cerchio le facevan di sé claustro,"Le sette ninfe la circondavano come ghirlanda,"
"le sette ninfe, con quei lumi in mano",e nelle loro mani hanno tenuto le lampade che possono
che son sicuri d'Aquilone e d'Austro.,non essere estinto dai venti del nord o del sud.
“Qui sarai tu poco tempo silvano;,"""Qui sarai, per un po', un visitatore;"
e sarai meco sanza fine cive,ma tu sarai con me e senza fine.
di quella Roma onde Cristo è romano.,"Il cittadino di Roma, la Roma in cui Cristo è"
"Però, in pro del mondo che mal vive,","Romano; e così, per trarre profitto da quel mondo che"
"al carro tieni or li occhi, e quel che vedi,","vive male, guarda il carro con fermezza"
"ritornato di là, fa che tu scrive”.","e, quando sei tornato oltre, trascrivere"
"Così Beatrice; e io, che tutto ai piedi","ciò che hai visto."" Così, Beatrice, e io,"
"d'i suoi comandamenti era divoto,","devotamente, ai piedi dei suoi comandamenti,"
la mente e li occhi ov'ella volle diedi.,ha messo la mente e gli occhi dove mi aveva desiderato.
Non scese mai con sì veloce moto,Non è mai caduto un fulmine con una tale rapidità
"foco di spessa nube, quando piove","movimento da una nube spessa, quando scende"
"da quel confine che più va remoto,","dal limite più lontano del cielo,"
com'io vidi calar l'uccel di Giove,come ha fatto l'uccello di Giove che ho visto swoop
"per l'alber giù, rompendo de la scorza,","giù attraverso l'albero, strappando la corteccia pure"
non che d'i fiori e de le foglie nove;,come le nuove foglie e la nuova fioritura.
e ferì 'l carro di tutta sua forza;,Colpì il carro con tutta la sua forza;
"ond'el piegò come nave in fortuna,","la carrozza si è contorta, come una nave che è stata attraversata"
"vinta da l'onda, or da poggia, or da orza.",dai mari che ora tempestano a dritta e ora porto.
Poscia vidi avventarsi ne la cuna,"Poi vidi, mentre saltava nel corpo"
del trïunfal veiculo una volpe,"di quel carro trionfale, una volpe"
che d'ogne pasto buon parea digiuna;,che sembrava mancare di tutto il nutrimento onesto:
"ma, riprendendo lei di laide colpe,","ma, com'ella si ribellava ai suoi peccati squallidi,"
la donna mia la volse in tanta futa,La mia signora ha costretto quella volpe a volare come veloce
quanto sofferser l'ossa sanza polpe.,"come, spogliato di carne, le sue ossa lo permisero."
"Poscia per indi ond'era pria venuta,",Poi ho potuto vedere l'aquila immergersi di nuovo
l'aguglia vidi scender giù ne l'arca,giù attraverso l'albero-in il carro
del carro e lasciar lei di sé pennuta;,e lasciarlo piumato con il suo piumaggio;
"e qual esce di cuor che si rammarca,","proprio come una voce da un cuore amareggiato,"
tal voce uscì del cielo e cotal disse:,"una voce emessa dal Cielo, dicendo questo:"
"“O navicella mia, com' mal se' carca!”.","""O mia piccola corteccia, la tua merce è malvagità!"""
Poi parve a me che la terra s'aprisse,Poi il terreno tra le due ruote sembrava
"tr'ambo le ruote, e vidi uscirne un drago",per aprirmi; dalla terra un drago
che per lo carro sù la coda fisse;,è emerso; ha guidato la coda su attraverso il carro;
"e come vespa che ritragge l'ago,","e come una vespa quando ritrae il suo pungiglione,"
"a sé traendo la coda maligna,","ritrae la sua coda velenosa a se stessa,"
"trasse del fondo, e gissen vago vago.","ha trascinato una parte del fondo fuori, ed è andato"
"Quel che rimase, come da gramigna","la sua strada, ondulando. E ciò che è rimasto"
