Original,Translate_IT
"'Per me si va ne la città dolente,","Attraverso di me la strada per la città di Woe,"
"per me si va ne l'etterno dolore,","Attraverso di me la strada verso la schiena eterna,"
per me si va tra la perduta gente.,Per il modo in cui ho perso.
Giustizia mosse il mio alto fattore;,La giustizia ha spostato il mio maker al liceo.
"fecemi la divina podestate,",Il potere divino mi ha fatto...
la somma sapïenza e 'l primo amore.,"WISDOM SUPREME, E PRIMAL LOVE."
Dinanzi a me non fuor cose create,"Prima di me non c'era niente, ma cose eterne..."
"se non etterne, e io etterno duro.",E ho concluso eternamente.
"Lasciate ogne speranza, voi ch'intrate'.","Abbandonate tutti la speranza, voi che entrate qui."
Queste parole di colore oscuro,"Queste parole, scure di tonalità, ho visto inscritto"
vid'ïo scritte al sommo d'una porta;,E poi ho detto:
"per ch'io: “Maestro, il senso lor m'è duro”.","Maestro, per me il loro significato è difficile."
"Ed elli a me, come persona accorta:","E lui, come colui che ha capito:"
“Qui si convien lasciare ogne sospetto;,"'Qui dovete bandire ogni diffidenza,"
ogne viltà convien che qui sia morta.,qui ogni codardia deve essere uccisa.
Noi siam venuti al loco ov'i' t'ho detto,"""Siamo arrivati dove ho detto"
che tu vedrai le genti dolorose,tu vedresti i miserabili peccatori
c'hanno perduto il ben de l'intelletto”.,"che hanno perso il bene dell'intelletto."""
E poi che la sua mano a la mia puose,E dopo aver messo la mano sulla mia
"con lieto volto, ond'io mi confortai,","con uno sguardo rassicurante che mi ha dato conforto,"
mi mise dentro a le segrete cose.,mi condusse verso cose sconosciute all'uomo.
"Quivi sospiri, pianti e alti guai","Ora sospira, forte gemito, lamento"
"risonavan per l'aere sanza stelle,","risuonava attraverso l'aria senza stelle,"
per ch'io al cominciar ne lagrimai.,perché anch'io cominciassi a piangere.
"Diverse lingue, orribili favelle,","Lingue sconosciute, orribili accenti,"
"parole di dolore, accenti d'ira,","parole di sofferenza, grida di rabbia, voci"
"voci alte e fioche, e suon di man con elle","forte e debole, il suono delle mani che schiaffeggiano..."
"facevano un tumulto, il qual s'aggira","tutti questi hanno fatto un tumulto, sempre vorticoso"
"sempre in quell'aura sanza tempo tinta,","in quell'aria nera e senza tempo,"
come la rena quando turbo spira.,come la sabbia è roteata in un vortice.
"E io ch'avea d'error la testa cinta,","E io, la mia testa circondata dall'errore, dissi:"
"dissi: “Maestro, che è quel ch'i' odo?","'Maestro, che cosa è questo che sento, e ciò che la gente"
e che gent' è che par nel duol sì vinta?”.,Sono così sormontati dal dolore?
Ed elli a me: “Questo misero modo,Ed egli a me: 'Questo stato miserabile è sopportato
tegnon l'anime triste di coloro,per le anime miserabili di coloro che vissero
che visser sanza 'nfamia e sanza lodo.,senza vergogna e senza lode.
Mischiate sono a quel cattivo coro,'Si mescolano con quella banda malvagia
de li angeli che non furon ribelli,"degli angeli, non ribelli e non fedeli"
"né fur fedeli a Dio, ma per sé fuoro.","a Dio, che si è tenuto lontano."
"Caccianli i ciel per non esser men belli,","""Dispiacendo di compromettere la sua bellezza, il Cielo li scaccia,"
"né lo profondo inferno li riceve,",e la profondità dell'Inferno non li riceve
ch'alcuna gloria i rei avrebber d'elli”.,"perché non gongolino per loro gli angeli malvagi."""
"E io: “Maestro, che è tanto greve","E io: 'Maestro, ciò che è così doloroso per loro,"
a lor che lamentar li fa sì forte?”.,"che si lamentano così amaramente?."""
Rispuose: “Dicerolti molto breve.,Egli rispose: 'Posso dirtelo in poche parole.
"Questi non hanno speranza di morte,","Non hanno speranza di morte,"
"e la lor cieca vita è tanto bassa,",e la loro vita cieca è così abietta
che 'nvidïosi son d'ogne altra sorte.,che sono invidiosi di ogni altro popolo.
Fama di loro il mondo esser non lassa;,"""Il mondo non permette la loro segnalazione."
misericordia e giustizia li sdegna:,Misericordia e giustizia li disprezzano.
"non ragioniam di lor, ma guarda e passa”.","Non parliamo di loro: guardate e passate!."""
"E io, che riguardai, vidi una 'nsegna","E io, tutti gli occhi, ho fatto uno striscione vorticoso"
"che girando correva tanto ratta,",che correva così veloce sembrava come se
che d'ogne posa mi parea indegna;,Non ha mai trovato riposo.
e dietro le venìa sì lunga tratta,Dietro è venuto così a lungo un file di persone
"di gente, ch'i' non averei creduto",che non potevo credere
che morte tanta n'avesse disfatta.,la morte ne aveva sciolti così tanti.
"Poscia ch'io v'ebbi alcun riconosciuto,","Dopo aver riconosciuto alcuni di questi,"
vidi e conobbi l'ombra di colui,Ho visto e conosciuto l'ombra di lui
che fece per viltade il gran rifiuto.,"che, per vigliaccheria, ha fatto il grande rifiuto."
Incontanente intesi e certo fui,Subito con certezza ho capito
"che questa era la setta d'i cattivi,",Questo era quell'equipaggio senza valore.
a Dio spiacenti e a' nemici sui.,odioso sia a Dio che ai Suoi nemici.
"Questi sciaurati, che mai non fur vivi,","Questi miseri, che non sono mai stati vivi,"
erano ignudi e stimolati molto,erano nudi e beset
da mosconi e da vespe ch'eran ivi.,pungente mosche e vespe
"Elle rigavan lor di sangue il volto,","che hanno fatto scorrere i loro volti di sangue,"
"che, mischiato di lagrime, a' lor piedi","che, mescolato con le loro lacrime,"
da fastidiosi vermi era ricolto.,fu raccolto ai loro piedi da vermi odiosi.
"E poi ch'a riguardar oltre mi diedi,","E poi, fissando il mio sguardo piu' in la',"
vidi genti a la riva d'un gran fiume;,"Vidi anime in piedi sulla riva di un fiume largo,"
"per ch'io dissi: “Maestro, or mi concedi","e così dissi: ""Maestro, permettimi prima"
"ch'i' sappia quali sono, e qual costume",'per sapere chi sono e poi quale legge interiore
"le fa di trapassar parer sì pronte,","li rende così ansiosi di attraversare,"
com'i' discerno per lo fioco lume”.,"o così sembra in questa tenue luce."""
Ed elli a me: “Le cose ti fier conte,"Ed egli a me: 'Tu saprai queste cose,"
quando noi fermerem li nostri passi,ma non prima di rimanere i nostri passi
su la trista riviera d'Acheronte”.,"sulla triste riva di Acheron."""
"Allor con li occhi vergognosi e bassi,","Poi, i miei occhi abbassati dalla vergogna,"
"temendo no 'l mio dir li fosse grave,","temendo che le mie parole lo detestassero,"
infino al fiume del parlar mi trassi.,Non ho parlato finche' non abbiamo raggiunto quel flusso.
Ed ecco verso noi venir per nave,"E ora, venendo verso di noi su una barca,"
"un vecchio, bianco per antico pelo,","un vecchio, i suoi capelli bianchi con l'età, gridò:"
"gridando: “Guai a voi, anime prave!","Guai a voi, anime malvagie,"
Non isperate mai veder lo cielo:,Risparmia ogni speranza di vedere il paradiso.
i' vegno per menarvi a l'altra riva,"Sono venuto per portarti sull'altra riva,"
"ne le tenebre etterne, in caldo e 'n gelo.","nelle tenebre eterne, nel calore e nel freddo."
"E tu che se' costì, anima viva,","'E tu là, anima viva,"
pàrtiti da cotesti che son morti”.,"Allontanatevi da questi ora morti."""
"Ma poi che vide ch'io non mi partiva,","Ma quando ha visto che non mi muovevo,"
"disse: “Per altra via, per altri porti","disse: ""Per un'altra via, un'altra porta,"
"verrai a piaggia, non qui, per passare:","Non qui, verrai a riva e attraverserai."
più lieve legno convien che ti porti”.,"Una nave più leggera deve trasportarti."""
"E 'l duca lui: “Caron, non ti crucciare:","E il mio capo: ""Charon, non tormentarti."
vuolsi così colà dove si puote,"È così voluta dove la volontà e il potere sono uno,"
"ciò che si vuole, e più non dimandare”.",e non chiedere altro.'
Quinci fuor quete le lanose gote,# Che ha fermato i guantoni #
"al nocchier de la livida palude,","del pilota della palude livida,"
che 'ntorno a li occhi avea di fiamme rote.,i cui occhi bruciarono ruote di fuoco.
"Ma quell'anime, ch'eran lasse e nude,","Ma quelle anime, nude e desolate,"
"cangiar colore e dibattero i denti,",hanno perso il loro colore. Con i denti che chiacchierano
ratto che 'nteser le parole crude.,Hanno sentito le sue parole brutali.
"Bestemmiavano Dio e lor parenti,","Hanno bestemmiato Dio, i loro genitori,"
l'umana spezie e 'l loco e 'l tempo e 'l seme,"la razza umana, il luogo, il tempo, il seme"
di lor semenza e di lor nascimenti.,della loro educazione e della loro nascita.
"Poi si ritrasser tutte quante insieme,","Poi, piangendo amaramente, si unirono"
"forte piangendo, a la riva malvagia",alla spiaggia maledetta che aspetta
ch'attende ciascun uom che Dio non teme.,per ogni uomo che non teme Dio.
"Caron dimonio, con occhi di bragia","Carone il demone, con gli occhi di carboni ardenti,"
"loro accennando, tutte le raccoglie;","li chiama, li raduna tutti a bordo,"
batte col remo qualunque s'adagia.,Colpisce chiunque si rallenti con il suo remo.
Come d'autunno si levan le foglie,"Proprio come in autunno le foglie cadono via,"
"l'una appresso de l'altra, fin che 'l ramo","uno, e poi un altro, fino al ramo"
"vede a la terra tutte le sue spoglie,","vede tutto il suo bottino per terra,"
similemente il mal seme d'Adamo,così il seme malvagio di Adamo che si lancia
"gittansi di quel lito ad una ad una,","uno ad uno da riva, al suo segnale,"
per cenni come augel per suo richiamo.,come fa un falco alla sua convocazione.
"Così sen vanno su per l'onda bruna,","Così si dipartono sull'acqua oscura,"
"e avanti che sien di là discese,",e prima che siano atterrati dall'altra parte
anche di qua nuova schiera s'auna.,Un'altra folla si è radunata su questa riva.
"“Figliuol mio”, disse 'l maestro cortese,","'Figlio mio,' disse il padrone cortese,"
“quelli che muoion ne l'ira di Dio,'tutti coloro che muoiono nell'ira di Dio
tutti convegnon qui d'ogne paese;,Radunatevi qui da ogni terra.
"e pronti sono a trapassar lo rio,","E non vedono l'ora di attraversare il fiume,"
"ché la divina giustizia li sprona,",per la giustizia di Dio li sprona
sì che la tema si volve in disio.,la loro stessa paura si trasforma in desiderio.
Quinci non passa mai anima buona;,Nessuna anima buona attraversa mai in questo posto.
"e però, se Caron di te si lagna,","Quindi, se Charon si lamenta per il tuo conto,"
ben puoi sapere omai che 'l suo dir suona”.,"Ora puoi comprendere il significato delle sue parole."""
"Finito questo, la buia campagna","Quando ebbe finito, la pianura cupa tremò"
"tremò sì forte, che de lo spavento","con tanta forza, il ricordo del mio terrore"
la mente di sudore ancor mi bagna.,mi fa risplendere nel sudore.
"La terra lagrimosa diede vento,","Dal terreno che piangeva c'era un vento,"
che balenò una luce vermiglia,"fiammeggiante con luce vermigliona,"
la qual mi vinse ciascun sentimento;,"che dominava tutti i miei sensi,"
e caddi come l'uom cui sonno piglia.,E sono caduto come un uomo tirato giù dal sonno.
