Original,Translate_IT
"Una medesma lingua pria mi morse,",La stessa lingua che mi aveva punto
"sì che mi tinse l'una e l'altra guancia,","in modo che entrambe le mie guance diventassero rosse,"
e poi la medicina mi riporse;,"aveva portato anche la mia cura,"
così od'io che solea far la lancia,proprio come la lancia di Achille e suo padre...
d'Achille e del suo padre esser cagione,così ho sentito dire -- sarebbe la causa
prima di trista e poi di buona mancia.,"prima un dono doloroso, poi un benvenuto."
Noi demmo il dosso al misero vallone,"Abbiamo voltato le spalle a quella triste valle,"
"su per la ripa che 'l cinge dintorno,","prima arrampicandosi sulla riva che la circonda,"
attraversando sanza alcun sermone.,"poi attraversare, mentre non una parola."
"Quiv'era men che notte e men che giorno,",Qui c'era meno della notte e meno del giorno...
sì che 'l viso m'andava innanzi poco;,Non riuscivo a vedere troppo avanti.
"ma io senti' sonare un alto corno,",Ma ho sentito un corno-blast che avrebbe fatto
"tanto ch'avrebbe ogne tuon fatto fioco,",Il tuono piu' forte sembra svenire.
"che, contra sé la sua via seguitando,",Per trovare la sua fonte ho girato gli occhi
dirizzò li occhi miei tutti ad un loco.,di nuovo al posto da cui il pranzo era venuto.
"Dopo la dolorosa rotta, quando",Dopo la terribile corsa quando Carlo Magno
"Carlo Magno perdé la santa gesta,","aveva perso la sua sacra banda di cavalieri,"
non sonò sì terribilmente Orlando.,Roland non sembrava cosi' terribile.
"Poco portäi in là volta la testa,",Non avevo guardato così per molto tempo
che me parve veder molte alte torri;,"quando vidi quello che sembrava una serie di torri alte,"
"ond'io: “Maestro, dì, che terra è questa?”.","E io dissi: ""Maestro, dimmi, che città è questa?."""
Ed elli a me: “Però che tu trascorri,E lui a me: 'Perché si cerca di trafiggere
"per le tenebre troppo da la lungi,","l'oscurità da troppo lontano,"
avvien che poi nel maginare abborri.,Ne consegue che errate nella vostra percezione.
"Tu vedrai ben, se tu là ti congiungi,","'Quando sarai più vicino, capirai"
quanto 'l senso s'inganna di lontano;,quanto la tua vista è ingannata dalla distanza.
però alquanto più te stesso pungi”.,"Spingi un po' più forte."""
Poi caramente mi prese per mano,Poi con affetto mi prese per mano
"e disse: “Pria che noi siam più avanti,","e disse: ""Prima di andare oltre,"
"acciò che 'l fatto men ti paia strano,","e così il fatto può sembrarti meno strano,"
"sappi che non son torri, ma giganti,","'si dovrebbe dire: queste non sono torri,"
e son nel pozzo intorno da la ripa,"ma giganti e, dall'ombelico verso il basso,"
da l'umbilico in giuso tutti quanti”.,"ognuno sta dietro la banca che suona la fossa."""
"Come quando la nebbia si dissipa,","Come, quando la nebbia sta sollevando,"
lo sguardo a poco a poco raffigura,A poco a poco discerniamo le cose
"ciò che cela 'l vapor che l'aere stipa,","nascosti nell'aria densa di nebbia,"
"così forando l'aura grossa e scura,","così, quando i miei occhi videro attraverso il pesante buio"
"più e più appressando ver' la sponda,","e mi avvicinai all'orlo,"
fuggiemi errore e cresciemi paura;,errore mi ha lasciato e la paura è venuto al suo posto.
"però che, come su la cerchia tonda","Per, come tutto intorno al suo anello di pareti"
"Montereggion di torri si corona,","Monteriggioni è coronato da torri,"
così la proda che 'l pozzo circonda,così alla scogliera-bordo che circonda la fossa
torreggiavan di mezza la persona,incombeva come torri la metà del corpo in massa
"li orribili giganti, cui minaccia","di giganti terrificanti, quelli che Giove"
Giove del cielo ancora quando tuona.,minaccia ancora dal cielo quando tuona.
"E io scorgeva già d'alcun la faccia,","Ora potrei discernere il volto di uno,"
"le spalle e 'l petto e del ventre gran parte,","il petto e le spalle, una parte della pancia,"
e per le coste giù ambo le braccia.,"e, appesi ai suoi lati, le sue braccia."
"Natura certo, quando lasciò l'arte",Sicuramente la natura ha fatto bene quando ha rinunciato
"di sì fatti animali, assai fé bene","l'arte di creare creature come queste,"
per tòrre tali essecutori a Marte.,privare Marte di tali praticanti.
E s'ella d'elefanti e di balene,Se non si pentisce dei suoi elefanti
"non si pente, chi guarda sottilmente,","e balene, se si esamina la questione da vicino,"
più giusta e più discreta la ne tene;,Sarà trovata più cauta e più giusta.
ché dove l'argomento de la mente,Perché quando il potere del pensiero
"s'aggiugne al mal volere e a la possa,",è accoppiato con cattiva volontà e forza nuda
nessun riparo vi può far la gente.,non c'è rifugio per gli uomini.
La faccia sua mi parea lunga e grossa,Il suo volto mi apparve lungo e largo
"come la pina di San Pietro a Roma,","com'è, a Roma, il cono di pino a San Pietro,"
e a sua proporzione eran l'altre ossa;,"le sue altre parti grandi di pari grado,"
"sì che la ripa, ch'era perizoma","in modo che la banca, che lo ha nascosto come un grembiule"
"dal mezzo in giù, ne mostrava ben tanto","dal suo centro verso il basso, ancora mostrato"
"di sovra, che di giugnere a la chioma",così tanto di lui sopra che abbastanza invano
tre Frison s'averien dato mal vanto;,tre Frieslanders potrebbero vantarsi di aver raggiunto
però ch'i' ne vedea trenta gran palmi,i suoi capelli. Per ho visto trenta span di lui
dal loco in giù dov'omo affibbia 'l manto.,sotto il luogo dove gli uomini fanno digiunare i loro manti.
“,"""Raphèl maì amècche zabì almi,"""
"”,","la bocca selvaggia, per la quale non più dolce"
"cominciò a gridar la fiera bocca,","salmi erano in forma, ha cominciato a gridare."
cui non si convenia più dolci salmi.,"E, in risposta, il mio capo: 'Tu hai confuso l'anima,"
"E 'l duca mio ver' lui: “Anima sciocca,",Tieniti forte sul tuo corno!
"tienti col corno, e con quel ti disfoga",quando la rabbia o altra passione ti prende.
quand'ira o altra passïon ti tocca!,"Cercate al vostro collo, creatura di confusione,"
"Cércati al collo, e troverai la soga",e troverete la corda che tiene il corno
"che 'l tien legato, o anima confusa,",Aslantare il tuo petto mammut.'
e vedi lui che 'l gran petto ti doga”.,Poi egli a me: 'Egli è il suo proprio accusatore.
Poi disse a me: “Elli stessi s'accusa;,"Questo è Nimrod, a causa del cui vile piano"
questi è Nembrotto per lo cui mal coto,il mondo non parla più una sola lingua.
pur un linguaggio nel mondo non s'usa.,"""Lasciamolo e non sprechiamo il nostro discorso,"
Lasciànlo stare e non parliamo a vòto;,perché ogni lingua è per lui come sua
ché così è a lui ciascun linguaggio,"agli altri, e la sua non è compresa da nessuno."""
"come 'l suo ad altrui, ch'a nullo è noto”.","Poi, girando a sinistra, abbiamo continuato"
"Facemmo adunque più lungo vïaggio,",con il nostro viaggio. Un arco più lontano su
vòlti a sinistra; e al trar d'un balestro,"Abbiamo trovato il prossimo, piu' grande e piu' selvaggio."
trovammo l'altro assai più fero e maggio.,Ora chi aveva tirato il suo mestiere per legarlo così
"A cigner lui qual che fosse 'l maestro,","Non posso dirlo, ma il suo braccio destro"
"non so io dir, ma el tenea soccinto","era legato dietro di lui, l'altro davanti,"
dinanzi l'altro e dietro il braccio destro,con catene che dal collo in giù lo tennero fisso.
d'una catena che 'l tenea avvinto,Si sono feriti cinque volte intorno alla sua massa.
"dal collo in giù, sì che 'n su lo scoperto",da parte di lui che abbiamo potuto vedere.
si ravvolgëa infino al giro quinto.,Questo spirito orgoglioso scelse di mettere alla prova la sua forza.
“Questo superbo volle esser esperto,"contro l'onnipotente Giove,"" disse il mio capo,"
"di sua potenza contra 'l sommo Giove”,",E questa e' la sua ricompensa.
"disse 'l mio duca, “ond'elli ha cotal merto.",Egli è Ephialtes. Si è unito al grande assalto
"Fïalte ha nome, e fece le gran prove",quando i giganti hanno messo gli dei nella paura.
quando i giganti fer paura a' dèi;,"Quelle braccia che ha brandito non possono più muoversi."""
"le braccia ch'el menò, già mai non move”.","E io a lui: 'Se è permesso,"
"E io a lui: “S'esser puote, io vorrei",Vorrei vedere con i miei occhi
che de lo smisurato Brïareo,"Briareus e la sua massa incommensurabile."""
esperïenza avesser li occhi mei”.,"Rispose: ""È Antèo che vedrete."
Ond'ei rispuose: “Tu vedrai Anteo,"Lui è vicino, parla, non è incatenato."
"presso di qui che parla ed è disciolto,",E ci farà scendere nella profondità stessa del peccato.
che ne porrà nel fondo d'ogne reo.,"Quello che vuoi vedere e' piu' lontano,"
"Quel che tu vuo' veder, più là è molto","anche nei ceppi, proprio come questo qui,"
"ed è legato e fatto come questo,","se non fosse che dal suo aspetto sembrerebbe più feroce."""
salvo che più feroce par nel volto”.,Mai potente terremoto scuotere una torre
"Non fu tremoto già tanto rubesto,",con tanta velocità e forza
"che scotesse una torre così forte,",come Ephialtes scosse se stesso.
come Fïalte a scuotersi fu presto.,Poi più che mai avevo paura di morire:
"Allor temett'io più che mai la morte,","la mia sola paura sarebbe bastata per farlo,"
"e non v'era mestier più che la dotta,",se non avessi notato quanto fosse legato.
s'io non avessi viste le ritorte.,"Andando oltre, ci siamo imbattuti in Antaeus."
"Noi procedemmo più avante allotta,","Senza l'aggiunta della misura della sua testa,"
"e venimmo ad Anteo, che ben cinque alle,",Si è alzato un pieno di cinque ell sopra la fossa.
"sanza la testa, uscia fuor de la grotta.","O tu, che... nella fatidica valle"
“O tu che ne la fortunata valle,"che fece di Scipio un erede di gloria,"
"che fece Scipïon di gloria reda,",quando Annibale con tutti i suoi uomini mostrò le loro spalle...
"quand'Anibàl co' suoi diede le spalle,","'tu, che hai preso come preda mille leoni,"
"recasti già mille leon per preda,","e con la cui forza, sembra che alcuni credano,"
"e che, se fossi stato a l'alta guerra","se fossi stato alla guerra al cielo con i tuoi fratelli,"
"de' tuoi fratelli, ancor par che si creda",I figli della terra avrebbero prevalso...
ch'avrebber vinto i figli de la terra:,"pregate, fateci scendere, non disdegnate di farlo,"
"mettine giù, e non ten vegna schifo,","su Cocytus, incatenato dal freddo."
dove Cocito la freddura serra.,Non farci andare da Tityus o Typhon.
Non ci fare ire a Tizio né a Tifo:,Quest'uomo puo' dare cio' che tutti qui desiderano.
questi può dar di quel che qui si brama;,Quindi piegarsi e non arricciare il labbro.
però ti china e non torcer lo grifo.,"Puo' ancora renderti famoso nel mondo,"
"Ancor ti può nel mondo render fama,","perché vive, e spera in anni di vita,"
"ch'el vive, e lunga vita ancor aspetta","se Grace non lo ricorda prima del suo tempo."""
se 'nnanzi tempo grazia a sé nol chiama”.,Così parlò il padrone. L'altro fu veloce
Così disse 'l maestro; e quelli in fretta,per raggiungere con le sue mani -- la presa possente
"le man distese, e prese 'l duca mio,",una volta sentito da Ercole -- e ha afferrato la mia guida.
ond'Ercule sentì già grande stretta.,"Virgil, quando si sentiva al sicuro, disse:"
"Virgilio, quando prender si sentio,","'Qui, lascia che ti prenda!'"
"disse a me: “Fatti qua, sì ch'io ti prenda”;",Poi ha fatto un unico fascio di se stesso e me.
poi fece sì ch'un fascio era elli e io.,Come quando si vede la torre chiamata Garisenda
