Original,Translate_IT
"Ricorditi, lettor, se mai ne l'alpe",Il nero dell'inferno e una notte scintillante
ti colse nebbia per la qual vedessi,"Non dal cielo piu' povero della luce piu' pallida,"
"non altrimenti che per pelle talpe,","Dal più denso degli anelli nebulosi oscurati,"
"come, quando i vapori umidi e spessi","Non mi ha mai rinchiuso in un velo grossolano,"
"a diradar cominciansi, la spera","Come il fumo che ci circondava,"
del sol debilemente entra per essi;,Non mi è mai sembrato così doloroso.
e fia la tua imagine leggera,"Non posso stare in piedi, gli occhi chiusi,"
in giugnere a veder com'io rividi,Si avvicinava e la spalla si avvicinava.
"lo sole in pria, che già nel corcar era.","La mia guida mi è fedele, bianca e indistruttibile."
"Sì, pareggiando i miei co' passi fidi",Come il cieco ama il suo bisogno
"del mio maestro, usci' fuor di tal nube",Seguite il Fuhrer per non correre
ai raggi morti già ne' bassi lidi.,A ciò che porta il pericolo e forse la morte...
O imaginativa che ne rube,"Così lo seguo, figlio di riconoscere qualcosa,"
"talvolta sì di fuor, ch'om non s'accorge","Con amaro tormento e obbedisci a lui,"
"perché dintorno suonin mille tube,","Egli disse: ""Presta attenzione al fatto che non ci separiamo ."""
"chi move te, se 'l senso non ti porge?","Ho sentito delle voci là, e ogni sembrava"
"Moveti lume che nel ciel s'informa,","Per gemere gnad e pace con l'Agnello,"
per sé o per voler che giù lo scorge.,Se il Signore ci perdona i peccati.
De l'empiezza di lei che mutò forma,"Agnus Dei sento suonare l'inizio,"
"ne l'uccel ch'a cantar più si diletta,","In ogni parola e in ogni modo,"
ne l'imagine mia apparve l'orma;,E i suoi toni sono perfettamente coerenti.
e qui fu la mia mente sì ristretta,"""Questi sono spiriti, Signore!"" così mi sono voltato"
"dentro da sé, che di fuor non venìa","A lui, e lui: ""È come decidi tu;"
cosa che fosse allor da lei ricetta.,"Si sciolgono dalla rabbia laccio."""
Poi piovve dentro a l'alta fantasia,"""Chi sei tu per tagliare il nostro fumo,"
"un crucifisso, dispettoso e fero","Da cui, come parli di noi, si sente..."
"ne la sua vista, e cotal si moria;","Che il tempo ti separi ancora dopo le lune?"""
"intorno ad esso era il grande Assüero,","Il discorso è stato in armonia con uno,"
"Estèr sua sposa e 'l giusto Mardoceo,","Ma il mio maestro disse: ""Stilla il suo desiderio"
che fu al dire e al far così intero.,"E chiedigli di salire di sopra."""
E come questa imagine rompeo,"""La creatura per tornare al Creatore,"
"sé per sé stessa, a guisa d'una bulla","Purificarsi e diventare bello come prima,"
"cui manca l'acqua sotto qual si feo,","Vieni con me e senti i miracoli!"""
surse in mia visïone una fanciulla,"Così io, e lui: ""Io grido con te,"
"piangendo forte, e dicea: “O regina,","Per quanto posso, e per non divorziare..."
perché per ira hai voluto esser nulla?,"Conducici nel fumo al posto dell'orecchio."""
Ancisa t'hai per non perder Lavina;,"Io dico: ""Sebbene le guaine mi spogliano,"
"or m'hai perduta! Io son essa che lutto,","Che solo la morte risolverà, io urlo su"
"madre, a la tua pria ch'a l'altrui ruina”.",E fino a qui ha attraversato l'inferno di sofferenza.
Come si frange il sonno ove di butto,"E il Signore mi accolse così come grazia,"
"nova luce percuote il viso chiuso,","Che io possa aspirare a lui,"
che fratto guizza pria che muoia tutto;,"Corsa completamente contro questo tempo,"
così l'imaginar mio cadde giuso,"Quindi dimmi, chi eri una volta nella vita,"
"tosto che lume il volto mi percosse,",E se ho tenuto la strada destra qui...
maggior assai che quel ch'è in nostro uso.,"Poiché la tua parola ci darà la nostra direzione."""
"I' mi volgea per veder ov'io fosse,","""Marco una volta mi chiamavo, e quello che il mondo conteneva..."
"quando una voce disse “Qui si monta”,","Io potevo farlo e aspiravo al prezzo,"
che da ogne altro intento mi rimosse;,Che ora sulla Terra nessuno sta puntando.
e fece la mia voglia tanto pronta,"Il grado prima di te è la strada verso il cerchio più alto."""
"di riguardar chi era che parlava,","Egli disse: ""Ti ho pregato ancora,"" così egli aggiunge,"
"che mai non posa, se non si raffronta.","""Pensa con insistenza alla meta del viaggio."""
Ma come al sol che nostra vista grava,"E io gli dissi: ""Per la mia fedeltà, sia!"
"e per soverchio sua figura vela,","Ma sappi che trovo un dubbio,"
così la mia virtù quivi mancava.,Non lo diro' a nessuno.
"“Questo è divino spirito, che ne la",Un tempo era semplice; doppiamente ora sente
"via da ir sù ne drizza sanza prego,","L'ho dentro di me, dopo quello che hai detto,"
e col suo lume sé medesmo cela.,Appena mi metto in contatto con quel posto.
"Sì fa con noi, come l'uom si fa sego;","Vero è, il mondo, come mi hai accusato,"
"ché quale aspetta prego e l'uopo vede,","# E' su ogni virtù, ogni onore, #"
malignamente già si mette al nego.,E con tutta la malvagità incinta e afflitta.
Or accordiamo a tanto invito il piede;,"Ma io li riconosco e li insegno a cambiare,"
"procacciam di salir pria che s'abbui,",E' cosi' che ho pregato.
"ché poi non si poria, se 'l dì non riede”.","Egli li cerca là, che è la sfera del cielo."""
"Così disse il mio duca, e io con lui",Un aquilone precipitoso! È scappato da qui
volgemmo i nostri passi ad una scala;,"Secondo il suo petto, e poi ha iniziato: ""Sai,"
"e tosto ch'io al primo grado fui,","Il mondo è cieco e tu, amico, vieni da lei."
senti'mi presso quasi un muover d'ala,Voi che vivete dite sempre:
e ventarmi nel viso e dir: ''Beati,"Il Cielo stesso è colpevole di tutto,"
"pacifici, che son sanz'ira mala!'.",Come se vi avesse strappato con la forza.
Già eran sovra noi tanto levati,"Quindi, Wars, dimmi, dove sarebbe solo un biglietto?"
"li ultimi raggi che la notte segue,",Di libero arbitrio?
che le stelle apparivan da più lati.,"Che il piacere segue la virtù, il castigo del vizio?"
"'O virtù mia, perché sì ti dilegue?',","I germogli piantano un potere celeste,"
"fra me stesso dicea, ché mi sentiva","Non dico tutto; solo questo anche messo,"
la possa de le gambe posta in triegue.,"Vi è stata anche la conoscenza del bene e del male,"
Noi eravam dove più non saliva,"E libero Will... e quando lui, anche ferito..."
"la scala sù, ed eravamo affissi,","E stanco, con fermezza litiga con il cielo,"
pur come nave ch'a la piaggia arriva.,"E' cosi' che vince, e' ben nutrito, ma e' sempre l'ultimo."
"E io attesi un poco, s'io udissi","La forza primitiva che si diffonde nello spazio,"
alcuna cosa nel novo girone;,"dominate i liberi e create lo spirito,"
"poi mi volsi al maestro mio, e dissi:",Che il Cielo non guida piu' come tutore.
"“Dolce mio padre, dì, quale offensione","Quando il presente vi trascinerà con sé,"
si purga qui nel giro dove semo?,"In voi c'è solo la ragione, è in tutti voi,"
"Se i piè si stanno, non stea tuo sermone”.",Come quello che dico ti dimostra chiaramente.
"Ed elli a me: “L'amor del bene, scemo","Essa viene dalla sua mano, dall'approvazione"
"del suo dover, quiritta si ristora;","Voi sorridete, in quanto lei è come un bambino,"
qui si ribatte il mal tardato remo.,"Ride e piange innocentemente,"
"Ma perché più aperto intendi ancora,","L'anima giovane che non sa e non pensa,"
"volgi la mente a me, e prenderai","Quando, partendo dal Creatore allegro,"
alcun buon frutto di nostra dimora”.,Le piace tornare dove sono le gioie.
"“Né creator né creatura mai”,","Ha il sapore di un piccolo bene, sente il desiderio"
"cominciò el, “figliuol, fu sanza amore,","E correte dietro a lui, se non tiene una guida,"
o naturale o d'animo; e tu 'l sai.,Nessun ostacolo li impedisce di attaccare alla tendenza.
"Lo naturale è sempre sanza errore,","La legge, come controllo, e' necessaria al mondo."
ma l'altro puote errar per malo obietto,"Anche un governante della città, il vero,"
o per troppo o per poco di vigore.,Almeno nell'occhio tiene la torre.
"Mentre ch'elli è nel primo ben diretto,","Leggi, ma chi può mantenerle?"
"e ne' secondi sé stesso misura,","Non un uomo, perché vedete un pastore che mastica di nuovo,"
esser non può cagion di mal diletto;,"Ma non ha artiglio spaccato, guida le folle;"
"ma quando al mal si torce, o con più cura","Perciò il gregge che si fida del Fuhrer,"
"o con men che non dee corre nel bene,","Colui che divora quello che lei stessa bugiarda,"
contra 'l fattore adovra sua fattura.,Solo questo consuma e non guarda l'alto.
Quinci comprender puoi ch'esser convene,"Comunque, qualunque cosa si sussurri per un altro motivo..."
amor sementa in voi d'ogne virtute,"Non è la natura ad essere impudente e malvagia,"
e d'ogne operazion che merta pene.,Solo una cattiva leadership ha spaventato il mondo.
"Or, perché mai non può da la salute","Roma, che per fortuna convertì il mondo,"
"amor del suo subietto volger viso,","Due soli, e la via del mondo ha uno,"
da l'odio proprio son le cose tute;,L'altra trasfigura la via verso Dio.
"e perché intender non si può diviso,","Una delle altre banconote è stata cancellata,"
"e per sé stante, alcuno esser dal primo,",La spada e il bastone da una mano
da quello odiare ogne effetto è deciso.,Incorporato in club male adatti.
"Resta, se dividendo bene stimo,",Perche' non temete piu' quando li unite...
che 'l mal che s'ama è del prossimo; ed esso,"Tu puoi comprendere il bastone e la spada del pastore,"
amor nasce in tre modi in vostro limo.,Poiché dai frutti si riconosce l'albero.
"È chi, per esser suo vicin soppresso,","Si vedeva nel paese, l'Adige e il Po"
"spera eccellenza, e sol per questo brama","Ah, l'imperatore si è opposto,"
ch'el sia di sua grandezza in basso messo;,Sempre nobile sit e maturo forza e virtu'.
"è chi podere, grazia, onore e fama",Ora trovare quelli che si avvicinano ai buoni
"teme di perder perch'altri sormonti,","E parlar loro, arrossire,"
onde s'attrista sì che 'l contrario ama;,"In quel paese, la ferrovia è perfettamente sicura."
"ed è chi per ingiuria par ch'aonti,",I tempi antichi erano lì a spaventare i nuovi
"sì che si fa de la vendetta ghiotto,","Ancora attraverso tre viaggi del genere reale,"
e tal convien che 'l male altrui impronti.,Che attendono con ansia la morte imminente.
Questo triforme amor qua giù di sotto,"Konrad Pallazzo è, e Gherard"
"si piange: or vo' che tu de l'altro intende,","E Guid Castel, che sarebbe stato meglio"
che corre al ben con ordine corrotto.,In modo franco: l'onesto Lombard.
Ciascun confusamente un bene apprende,"La chiesa di Roma cade perché è la doppia dignità,"
"nel qual si queti l'animo, e disira;","Il doppio dominio ora mescolato in se stesso,"
per che di giugner lui ciascun contende.,"Nelle feci, con il peso di se stessi e del loro peso."""
Se lento amore a lui veder vi tira,"""Mio Marco,"" ho detto, ""riceve luce chiara"
"o a lui acquistar, questa cornice,",Con il tuo discorso ora vede il mio spirito...
"dopo giusto penter, ve ne martira.",Il che e' stato eliminato dall'eredita' di Levis.
Altro ben è che non fa l'uom felice;,Ma dimmi quale Gherard pensi stia in piedi
"non è felicità, non è la buona","Come macerie ancora sommerso di buon tempo,"
"essenza, d'ogne ben frutto e radice.",Così che egli oltraggi la corruzione di quel tempo?
"L'amor ch'ad esso troppo s'abbandona,","""Sei truffato, mi stai provando nel mio dolore?"""
