Original,Translate_IT
Al fine de le sue parole il ladro,"Egli parlò e alzò la mano con scherno,"
"le mani alzò con amendue le fiche,",Lasciate che entrambe le dita sfondassero le dita
"gridando: “Togli, Dio, ch'a te le squadro!”.","E poi esclamò: ""Prenditi, questo è per te, Dio!"""
"Da indi in qua mi fuor le serpi amiche,","Da allora vedo i serpenti con Behagen,"
"perch'una li s'avvolse allora al collo,",Perche' si e' girato intorno al collo...
come dicesse 'Non vo' che più diche';,Mi ha detto di non dire nient'altro.
"e un'altra a le braccia, e rilegollo,",Il secondo si è inchiodato intorno al braccio e legato
"ribadendo sé stessa sì dinanzi,","Lei davanti, avvolgendo se stessa, così insieme,"
che non potea con esse dare un crollo.,Che non ha trovato spazio per sbatterlo.
"Ahi Pistoia, Pistoia, ché non stanzi",Perche' non ti dai alle fiamme?
"d'incenerarti sì che più non duri,","Pistoja, tu... e ti stai spaventando?"
poi che 'n mal fare il seme tuo avanzi?,"Sono tutti degli empi che vengono da te, vero?"
Per tutt'i cerchi de lo 'nferno scuri,Non ho mai trovato tanta superbia.
"non vidi spirto in Dio tanto superbo,",Anche Kapaneus che beffa di Dio
non quel che cadde a Tebe giù da' muri.,Non ti arrabbiare con quel ladro.
El si fuggì che non parlò più verbo;,"Egli fuggì da là, figlio di dire una parola,"
e io vidi un centauro pien di rabbia,"E un centauro arrivò correndo, fischiando,"
"venir chiamando: “Ov'è, ov'è l'acerbo?”.","E gridò con rabbia: ""Dove trovo quest'insolenza?"""
"Maremma non cred'io che tante n'abbia,",Non credo che tanto siano i serpenti
quante bisce elli avea su per la groppa,"Alla spiaggia di Tuscien, quando era sulla croce."
infin ove comincia nostra labbia.,Fino a quando la forma dell'uomo inizia.
"Sovra le spalle, dietro da la coppa,",Un drago si fermò con le ali dilaniate
con l'ali aperte li giacea un draco;,Aggrapparsi alle spalle e spingersi con potere
e quello affuoca qualunque s'intoppa.,Il fuoco su tutti noi che passavano.
"Lo mio maestro disse: “Questi è Caco,","Allora il mio padrone disse: ""Kakus è, ho otto!"
"che, sotto 'l sasso di monte Aventino,",E 'il più spesso sanguinare stagni
di sangue fece spesse volte laco.,I coni fatti sotto l'Aventino.
"Non va co' suoi fratei per un cammino,","Egli non cammina con i suoi simili,"
per lo furto che frodolente fece,Perche' e' un ladro... perche' sta facendo l'inganno intelligente...
del grande armento ch'elli ebbe a vicino;,Sfuggire con quel grosso gregge.
onde cessar le sue opere biece,"Per questo gli fu data la ricompensa che gli spettava,"
"sotto la mazza d'Ercule, che forse","Perche' Herkul Keul l'ha colpito con cento colpi,"
"gliene diè cento, e non sentì le diece”.","Di cui forse non ne ha sentiti dieci."""
"Mentre che sì parlava, ed el trascorse,",Kakus si è già schierato contro di noi
"e tre spiriti venner sotto noi,","Vennero tre in quel luogo profondo,"
"de' quai né io né 'l duca mio s'accorse,","Ma prima potete muoverci urlando,"
se non quando gridar: “Chi siete voi?”;,"Guardarli giù: ""Chi siete voi là?"""
"per che nostra novella si ristette,",Siamo rimasti in piedi nel racconto
e intendemmo pur ad essi poi.,E ubbidirono a questa ombra di parola.
"Io non li conoscea; ma ei seguette,",Non ho mai visto nessuno di loro.
"come suol seguitar per alcun caso,",Allora uno di questi tre chiamò l'altro
"che l'un nomar un altro convenette,","E lo ha chiamato, per caso è accaduto spesso."
dicendo: “Cianfa dove fia rimaso?”;,"""Dove sei, Cianfa?"" gridò, ""Vieni qui!"""
"per ch'io, acciò che 'l duca stesse attento,","Per questo metto il dito sulle labbra,"
mi puosi 'l dito su dal mento al naso.,Per far sì che il mio capo sia silenzioso e silenzioso.
"Se tu se' or, lettore, a creder lento","Vuoi dire, ora, lettore, che io faccio il backdoor"
"ciò ch'io dirò, non sarà maraviglia,","Di favole vanità, non mi meravigliano;"
"ché io che 'l vidi, a pena il mi consento.","L'ho visto, ma il mio dubbio non è affatto inferiore."
"Com'io tenea levate in lor le ciglia,","Da prima, si è gettato come ho fatto la faccia"
e un serpente con sei piè si lancia,"Rivolto a loro, rapidamente uno dei serpenti"
"dinanzi a l'uno, e tutto a lui s'appiglia.",Con tre paia di piedi... e chiudetelo a chiave.
Co' piè di mezzo li avvinse la pancia,"La pancia era circondata dalla coppia di mezzo,"
e con li anterïor le braccia prese;,"Ma la coppia precedente ha abbracciato il braccio,"
poi li addentò e l'una e l'altra guancia;,Poi ha colpito i suoi denti in entrambe le guance.
"li diretani a le cosce distese,",Come i lombi erano attaccati all'andar del tempo...
e miseli la coda tra 'mbedue,L'ha ficcata tra le due gambe.
e dietro per le ren sù la ritese.,E lo preme sul retro come un anello stretto.
Ellera abbarbicata mai non fue,"Nessuna eresia può unire l'albero in questo modo,"
"ad alber sì, come l'orribil fiera",Come questa bestia è meravigliosa
per l'altrui membra avviticchiò le sue.,A quell'angolazione si amalgamava con i suoi.
"Poi s'appiccar, come di calda cera","Poi, improvvisamente, questa coppia si è attaccata insieme,"
"fossero stati, e mischiar lor colore,","Come cera calda, i colori così commoventi,"
né l'un né l'altro già parea quel ch'era:,"Che nessuno dei due era più lo stesso,"
"come procede innanzi da l'ardore,","Come le fiamme, una carta che brucia,"
"per lo papiro suso, un color bruno","Prima di bruciare, indossare il marrone,"
che non è nero ancora e 'l bianco more.,"Prima ancora che diventi nero, il bianco lo strangola."
"Li altri due 'l riguardavano, e ciascuno","Gli altri due, guardandolo, gridavano:"
"gridava: “Omè, Agnel, come ti muti!","""Guai a te, Agnel, non hai due anni, non uno!"
Vedi che già non se' né due né uno”.,"Ma guarda, ti è stata data un'altra immagine!"""
"Già eran li due capi un divenuti,","Già il serpente era unito la testa e la sua,"
quando n'apparver due figure miste,"Da due figure si vedeva uno che nasceva,"
"in una faccia, ov'eran due perduti.","Mischiato, confuso, ma nessuno dei due lo e'."
Fersi le braccia due di quattro liste;,Le braccia sono state viste a pezzi;
le cosce con le gambe e 'l ventre e 'l casso,"Divennero quattro, e ventre, petto e lombate,"
divenner membra che non fuor mai viste.,Divennero membra come non si vede mai.
Ogne primaio aspetto ivi era casso:,Sembrava che fossero completamente spariti.
due e nessun l'imagine perversa,"Non due, non uno sembrava, e completamente sfigurato"
parea; e tal sen gio con lento passo.,Ho visto l'immagine girare lentamente verso il basso.
Come 'l ramarro sotto la gran fersa,Come le lucertole spesso quando il mondo
"dei dì canicular, cangiando sepe,","La stella del cane frusta in fretta da spine a spine,"
"folgore par se la via attraversa,","Da recinzione a recinzione che scorre attraverso la strada,"
"sì pareva, venendo verso l'epe",Così ora un serpente correva nell'ira selvaggia
"de li altri due, un serpentello acceso,","A quei due, secondo le loro pancette,"
livido e nero come gran di pepe;,"Blu e nero, come un granello di pepe."
e quella parte onde prima è preso,E attraverso la parte che all'inizio dell'essere
"nostro alimento, a l'un di lor trafisse;","Ci porta il cibo, ha forato l'uno,"
poi cadde giuso innanzi lui disteso.,Poi cadde distesa davanti a lui.
"Lo trafitto 'l mirò, ma nulla disse;","L'ha vista rigida, con le gambe bloccate,"
"anzi, co' piè fermati, sbadigliava","Silenzioso, sbadigliando, e mi ha dovuto"
pur come sonno o febbre l'assalisse.,Sembrano addormentati o febbrili.
Elli 'l serpente e quei lui riguardava;,"Dopo di lui guardò il serpente e lui la guardò,"
l'un per la piaga e l'altro per la bocca,"Lei fumando fuori dalla bocca, lui dalla ferita,"
"fummavan forte, e 'l fummo si scontrava.",Poi il fumo si è avvicinato da lì e qui.
Taccia Lucano omai là dov'e' tocca,Stai zitto ora Lucan con il suo cliente
"del misero Sabello e di Nasidio,","Del male di Sabell e di Nasid,"
e attenda a udir quel ch'or si scocca.,"E, ascoltando, mi appiccichi solo alla bocca."
"Taccia di Cadmo e d'Aretusa Ovidio,",Ovido tace da Areto e Kadmus;
ché se quello in serpente e quella in fonte,Perche' se lo rinchiude nel drago...
"converte poetando, io non lo 'nvidio;","E tu alla fonte, non invidio la sua canzone."
ché due nature mai a fronte a fronte,"Non ci ha mai parlato di due Wesen,"
non trasmutò sì ch'amendue le forme,"Cambia forma e stoffa e l'essere,"
a cambiar lor matera fosser pronte.,Guardando se stessa.
"Insieme si rispuosero a tai norme,",Subito la trasformazione continuò in quei due.
"che 'l serpente la coda in forca fesse,","Alla forchetta la coda ha spaccato il serpente,"
e 'l feruto ristrinse insieme l'orme.,E il gemito premeva una gamba sulla gamba.
Le gambe con le cosce seco stesse,"Si attaccavano l'un l'altro, e non per molto tempo"
"s'appiccar sì, che 'n poco la giuntura","Avete concesso, così come il furgone è sparito,"
non facea segno alcun che si paresse.,Spostato dal contesto completo.
Togliea la coda fessa la figura,La forma lombare che qui sfuggiva è nata
"che si perdeva là, e la sua pelle",Alla forchetta; la pelle sembrava ammorbidirsi;
"si facea molle, e quella di là dura.","E' stata dura li', in cerca di specie di serpenti."
"Io vidi intrar le braccia per l'ascelle,","Ho visto le braccia ammorbidire le spalle,"
"e i due piè de la fiera, ch'eran corti,","Il serpente allora piedi anteriori corti,"
tanto allungar quanto accorciavan quelle.,"Come questi sono andati, andare avanti."
"Poscia li piè di rietro, insieme attorti,",Come per ogni membro che l'uomo
"diventaron lo membro che l'uom cela,","Ricoprire coloro che si uniscono alle spalle,"
e 'l misero del suo n'avea due porti.,Così il suo cominciò a dividersi in due.
Mentre che 'l fummo l'uno e l'altro vela,"E sotto il fumo, che copre entrambi, si formarono"
"di color novo, e genera 'l pel suso","Colori completamente nuovi, capelli germogliati"
"per l'una parte e da l'altra il dipela,",E si sono mostrati qui quando sono spariti.
"l'un si levò e l'altro cadde giuso,","E' caduto, lei si e' alzata..."
"non torcendo però le lucerne empie,","Ma la testa rimase con quegli occhi rigidi,"
sotto le quai ciascun cambiava muso.,Perdendo la sua forma.
"Quel ch'era dritto, il trasse ver' le tempie,","Colui che stava in piedi sembrava a pezzi,"
e di troppa matera ch'in là venne,"E si vedeva anche la carne che stava dietro,"
uscir li orecchi de le gote scempie;,Spostare le orecchie dall'altra parte delle guance.
ciò che non corse in dietro e si ritenne,"Da ciò che rimase, nacque"
"di quel soverchio, fé naso a la faccia",Una coppia di labbra come si deve alzare.
e le labbra ingrossò quanto convenne.,E un naso appiccicato e lungo.
"Quel che giacëa, il muso innanzi caccia,","A colui che giaceva, la bocca saliva,"
e li orecchi ritira per la testa,"Inoltre, secondo l'usanza delle corna di lumaca"
come face le corna la lumaccia;,Riportare le orecchie in testa.
"e la lingua, ch'avëa unita e presta","Il Zung, prima di tutto, in fretta, è stato anche"
"prima a parlar, si fende, e la forcuta","Ora è stato diviso, e tutta la divisa è stata"
ne l'altro si richiude; e 'l fummo resta.,Nella bocca dell'altro e il fumo rimase.
"L'anima ch'era fiera divenuta,","Lo spirito, ora serpente, singhiozzava forte e correva"
