Filename,Original,Translate
trad_divina_commedia_inferno_3_18.csv,Cos  parlando il percosse un demonio,"con la sua frusta e disse   Fuori, pappone!"
trad_divina_commedia_inferno_3_18.csv,"de la sua scur ada, e disse   Via,",Non ci sono donne qui da ingannare. 
trad_divina_commedia_inferno_3_18.csv,ruffian! qui non son femmine da conio .,Poi mi sono ricongiunto alla mia escort.
trad_divina_commedia_inferno_3_18.csv,I  mi raggiunsi con la scorta mia ,e ci siamo imbattuti in un posto
trad_divina_commedia_inferno_3_18.csv,poscia con pochi passi divenimmo,dove una cresta si sporgeva dalla banca.
trad_divina_commedia_inferno_3_18.csv,l   v  uno scoglio de la ripa uscia.,"Questo siamo ascesi facilmente e,"
trad_divina_commedia_inferno_3_18.csv,Assai leggeramente quel salimmo ,"girando a destra sulla sua sporgenza frastagliata,"
trad_divina_commedia_inferno_3_18.csv,"e v lti a destra su per la sua scheggia,",ci siamo lasciati alle spalle il loro infinito giro.
trad_divina_commedia_inferno_3_18.csv,da quelle cerchie etterne ci partimmo.,Quando siamo arrivati al punto sopra il cavo
trad_divina_commedia_inferno_3_18.csv,Quando noi fummo l  dov el vaneggia,"che fa un passaggio per i flagellati,"
trad_divina_commedia_inferno_3_18.csv,"di sotto per dar passo a li sferzati,","Disse il mio capo   Fermati, lascia che ti guardino,"
trad_divina_commedia_inferno_3_18.csv,"lo duca disse   Attienti, e fa che feggia", le altre anime malate i cui volti
trad_divina_commedia_inferno_3_18.csv,"lo viso in te di quest altri mal nati,","non hai ancora visto, dato che abbiamo tutti"
trad_divina_commedia_inferno_3_18.csv,ai quali ancor non vedesti la faccia,si muoveva nella stessa direzione. 
trad_divina_commedia_inferno_3_18.csv,per  che son con noi insieme andati .,Dall antico ponte abbiamo guardato la banda
trad_divina_commedia_inferno_3_18.csv,Del vecchio ponte guardavam la traccia,"avanzando verso di noi dall altra parte,"
trad_divina_commedia_inferno_3_18.csv,"che ven a verso noi da l altra banda,",guidato con fruste proprio come il primo.
trad_divina_commedia_inferno_3_18.csv,e che la ferza similmente scaccia.,"E il buon padrone, senza che me lo chiedessi, disse "
trad_divina_commedia_inferno_3_18.csv,"E  l buon maestro, sanza mia dimanda,",Vedi quella figura imponente che si avvicina.
trad_divina_commedia_inferno_3_18.csv,"mi disse   Guarda quel grande che vene,",Sembra non versare lacrime nonostante il suo dolore.
trad_divina_commedia_inferno_3_18.csv,e per dolor non par lagrime spanda ,Che aspetto regale ha ancora!
trad_divina_commedia_inferno_3_18.csv,quanto aspetto reale ancor ritene!,"Lui   Jason, che per coraggio e per artigianato"
trad_divina_commedia_inferno_3_18.csv,"Quelli   Ias n, che per cuore e per senno",privarono gli uomini di Colchide dell ariete.
trad_divina_commedia_inferno_3_18.csv,li Colchi del monton privati f ne.,"Poi si avventur  nell isola di Lemnos,"
trad_divina_commedia_inferno_3_18.csv,Ello pass  per l isola di Lenno,dopo quelle donne spietate e coraggiose
trad_divina_commedia_inferno_3_18.csv,poi che l ardite femmine spietate,mettere tutti i maschi tra di loro a morte.
trad_divina_commedia_inferno_3_18.csv,tutti li maschi loro a morte dienno.,L  con segni d amore e parole lucide
trad_divina_commedia_inferno_3_18.csv,Ivi con segni e con parole ornate,"ha ingannato il giovane Hypsipyle,"
trad_divina_commedia_inferno_3_18.csv,"Isifile ingann , la giovinetta",che aveva ingannato le altre donne.
trad_divina_commedia_inferno_3_18.csv,che prima avea tutte l altre ingannate.,"L  la lasci , incinta e forlorn."
trad_divina_commedia_inferno_3_18.csv,"Lasciolla quivi, gravida, soletta ","Tale colpa lo condanna a questo tormento,"
trad_divina_commedia_inferno_3_18.csv,tal colpa a tal martiro lui condanna ,e anche Medea   cos  vendicata.
trad_divina_commedia_inferno_3_18.csv,e anche di Medea si fa vendetta.,Con lui vanno tutti coloro che praticano tale inganno.
trad_divina_commedia_inferno_3_18.csv,Con lui sen va chi da tal parte inganna ,Che sia tutto quello che sappiamo di questo primo fosso
trad_divina_commedia_inferno_3_18.csv,e questo basti de la prima valle,e di quelli che stringe nelle sue mascelle. 
trad_divina_commedia_inferno_3_18.csv,sapere e di color che  n s  assanna .,Ora eravamo arrivati dove lo stretto causeway
trad_divina_commedia_inferno_3_18.csv,Gi  eravam l   ve lo stretto calle,interseca la seconda cresta per formare
trad_divina_commedia_inferno_3_18.csv,"con l argine secondo s incrocicchia,",un contrafforte per un altro arco.
trad_divina_commedia_inferno_3_18.csv,e fa di quello ad un altr arco spalle.,Da qui abbiamo sentito il piagnucolo della gente
trad_divina_commedia_inferno_3_18.csv,Quindi sentimmo gente che si nicchia,"un fosso di distanza, mormorando con i loro muso"
trad_divina_commedia_inferno_3_18.csv,"ne l altra bolgia e che col muso scuffa,",e battersi su se stessi con le loro mani.
trad_divina_commedia_inferno_3_18.csv,e s  medesma con le palme picchia.,"Le rive, fatte viscide da un vapore appiccicoso"
trad_divina_commedia_inferno_3_18.csv,"Le ripe eran grommate d una muffa,","dal basso, sono stati rivestiti con uno stampo"
trad_divina_commedia_inferno_3_18.csv,"per l alito di gi  che vi s appasta,",Occhi e naso offensivi.
trad_divina_commedia_inferno_3_18.csv,che con li occhi e col naso facea zuffa.,Il fondo   cos  profondo che non potremmo vedere niente.
trad_divina_commedia_inferno_3_18.csv,"Lo fondo   cupo s , che non ci basta","a meno che non salissimo sulla corona dell arco,"
trad_divina_commedia_inferno_3_18.csv,loco a veder sanza montare al dosso,proprio dove la cresta   pi  alta.
trad_divina_commedia_inferno_3_18.csv,"de l arco, ove lo scoglio pi  sovrasta.","Siamo saliti, e da l  ho potuto vedere,"
trad_divina_commedia_inferno_3_18.csv,Quivi venimmo  e quindi gi  nel fosso,"in un fosso sotto, la gente immersa negli escrementi"
trad_divina_commedia_inferno_3_18.csv,vidi gente attuffata in uno sterco,che potevano provenire da privati umani.
trad_divina_commedia_inferno_3_18.csv,che da li uman privadi parea mosso.,Cercando il fondo con gli occhi che ho visto
trad_divina_commedia_inferno_3_18.csv,"E mentre ch io l  gi  con l occhio cerco,","un uomo, la sua testa cos  spalmata di merda"
trad_divina_commedia_inferno_3_18.csv,"vidi un col capo s  di merda lordo,",non si poteva dire se era prete o laico.
trad_divina_commedia_inferno_3_18.csv,che non par a s era laico o cherco.,Ha ringhiato   Quello che ti stuzzica l appetito di fissarmi
trad_divina_commedia_inferno_3_18.csv,Quei mi sgrid    Perch  se  tu s  gordo,pi  di tutti gli altri nella loro sporcizia?. 
trad_divina_commedia_inferno_3_18.csv,di riguardar pi  me che li altri brutti? .,"E io risposi   Il fatto, se ricordo bene,"
trad_divina_commedia_inferno_3_18.csv,"E io a lui   Perch , se ben ricordo,",Che una volta ti ho visto quando avevi i capelli asciutti...
trad_divina_commedia_inferno_3_18.csv,"gi  t ho veduto coi capelli asciutti,",e tu sei Alessio Interminei di Lucca.
trad_divina_commedia_inferno_3_18.csv,e se  Alessio Interminei da Lucca ,Ecco perche  ti guardo piu  di tutti gli altri.
trad_divina_commedia_inferno_3_18.csv,per  t adocchio pi  che li altri tutti .,"Poi lui, battendo sul suo pat  "
trad_divina_commedia_inferno_3_18.csv,"Ed elli allor, battendosi la zucca ", Sono immerso quaggi  per le lusinghe
trad_divina_commedia_inferno_3_18.csv, Qua gi  m hanno sommerso le lusinghe,con la quale la mia lingua non fu mai stolta. 
trad_divina_commedia_inferno_3_18.csv,ond io non ebbi mai la lingua stucca .,E poi il mio capo mi disse   Cercate di spingere
trad_divina_commedia_inferno_3_18.csv,"Appresso ci  lo duca  Fa che pinghe ,","la tua faccia un po  pi  in avanti,"
trad_divina_commedia_inferno_3_18.csv,"mi disse,  il viso un poco pi  avante,",per ottenere una migliore immagine delle caratteristiche
trad_divina_commedia_inferno_3_18.csv,s  che la faccia ben con l occhio attinghe," di quel fallo, disgustosa sgualdrina laggiu ,"
trad_divina_commedia_inferno_3_18.csv,di quella sozza e scapigliata fante,graffiarsi con le sue unghie sporche.
trad_divina_commedia_inferno_3_18.csv,"che l  si graffia con l unghie merdose,",Ora si accovaccia e ora si alza in piedi.
trad_divina_commedia_inferno_3_18.csv,e or s accoscia e ora   in piedi stante.," E  Thais, la puttana che, quando il suo amante ha chiesto "
trad_divina_commedia_inferno_3_18.csv,"Ta de  , la puttana che rispuose", Ho trovato un favore con te? 
trad_divina_commedia_inferno_3_18.csv,al drudo suo quando disse  Ho io grazie,"rispose   Oh, al di l  di ogni misura! "
trad_divina_commedia_inferno_3_18.csv,grandi apo te?    Anzi maravigliose! .,E che i nostri occhi siano soddisfatti di questo. 
trad_divina_commedia_inferno_3_19.csv,"O Simon mago, o miseri seguaci","O Simon Magus, miserabili della sua specie,"
trad_divina_commedia_inferno_3_19.csv,"che le cose di Dio, che di bontate","avido d oro e d argento,"
trad_divina_commedia_inferno_3_19.csv,"deon essere spose, e voi rapaci",che prostituiscono le cose di Dio
trad_divina_commedia_inferno_3_19.csv,"per oro e per argento avolterate,",che dovrebbero essere spose di bont !
trad_divina_commedia_inferno_3_19.csv,"or convien che per voi suoni la tromba,","Ora deve suonare la tromba per voi,"
trad_divina_commedia_inferno_3_19.csv,per  che ne la terza bolgia state.,Perche  il tuo posto e  li  in quel terzo fosso.
trad_divina_commedia_inferno_3_19.csv,"Gi  eravamo, a la seguente tomba,","Ora eravamo arrivati dove giaceva la tomba successiva,"
trad_divina_commedia_inferno_3_19.csv,montati de lo scoglio in quella parte,arrampicata fino al punto della cresta
trad_divina_commedia_inferno_3_19.csv,ch a punto sovra mezzo  l fosso piomba.,che si affaccia sul centro della trincea.
trad_divina_commedia_inferno_3_19.csv,"O somma sap enza, quanta   l arte","O Sapienza Suprema, quale grande arte mostri"
trad_divina_commedia_inferno_3_19.csv,"che mostri in cielo, in terra e nel mal mondo,","nei cieli, sulla terra e nel mondo malvagio,"
trad_divina_commedia_inferno_3_19.csv,e quanto giusto tua virt  comparte!,e quale vera giustizia dispensa il tuo potere!
trad_divina_commedia_inferno_3_19.csv,Io vidi per le coste e per lo fondo,Lungo i lati e il fondo potevo vedere
trad_divina_commedia_inferno_3_19.csv,"piena la pietra livida di f ri,","la pietra livida era trafitta di buchi,"
trad_divina_commedia_inferno_3_19.csv,d un largo tutti e ciascun era tondo.,tutto rotondo e di un unica dimensione.
trad_divina_commedia_inferno_3_19.csv,Non mi parean men ampi n  maggiori,Mi sembravano cos  ampi e profondi.
trad_divina_commedia_inferno_3_19.csv,"che que  che son nel mio bel San Giovanni,",come quelli nel mio bellissimo San Giovanni
trad_divina_commedia_inferno_3_19.csv,fatti per loco d i battezzatori ,"fatto per i sacerdoti di battezzare in,"
trad_divina_commedia_inferno_3_19.csv,"l un de li quali, ancor non   molt anni,","uno dei quali, non molti anni fa,"
trad_divina_commedia_inferno_3_19.csv,rupp io per un che dentro v annegava ,Mi sono rotto per salvarne uno quasi annegato...
trad_divina_commedia_inferno_3_19.csv,e questo sia suggel ch ogn omo sganni.,"e che questo sia il mio sigillo, per non decifrare tutti gli uomini."
trad_divina_commedia_inferno_3_19.csv,Fuor de la bocca a ciascun soperchiava,Dalla bocca di ciascuno incastrato
trad_divina_commedia_inferno_3_19.csv,d un peccator li piedi e de le gambe,piedi e gambe di un peccatore fino alle cosce
trad_divina_commedia_inferno_3_19.csv,"infino al grosso, e l altro dentro stava.",mentre tutto il resto rimaneva nel buco.
trad_divina_commedia_inferno_3_19.csv,Le piante erano a tutti accese intrambe ,Avevano entrambe le suole in fiamme.
trad_divina_commedia_inferno_3_19.csv,"per che s  forte guizzavan le giunte,",Ha reso le ginocchia cosi  dure.
trad_divina_commedia_inferno_3_19.csv,che spezzate averien ritorte e strambe.,avrebbero tagliato le viti o le corde contorte.
trad_divina_commedia_inferno_3_19.csv,Qual suole il fiammeggiar de le cose unte,Mentre le fiamme si muovono solo sulla superficie
trad_divina_commedia_inferno_3_19.csv,"muoversi pur su per la strema buccia,","di materia grassa catturata a fuoco,"
trad_divina_commedia_inferno_3_19.csv,tal era l  dai calcagni a le punte.,Quindi queste fiamme hanno colpito il tallone al dito.
trad_divina_commedia_inferno_3_19.csv," Chi   colui, maestro, che si cruccia","Chi  , padrone, chi nel suo tormento"
trad_divina_commedia_inferno_3_19.csv,"guizzando pi  che li altri suoi consorti ,",si contorce pi  di tutti i suoi simili
trad_divina_commedia_inferno_3_19.csv,"diss io,  e cui pi  roggia fiamma succia? .",ed   leccato dalle fiamme pi  rosse? 
trad_divina_commedia_inferno_3_19.csv,Ed elli a me   Se tu vuo  ch i  ti porti,"E lui   Se vuoi, ti abbatter "
trad_divina_commedia_inferno_3_19.csv,"l  gi  per quella ripa che pi  giace,","lungo la banca inferiore e imparerete,"
trad_divina_commedia_inferno_3_19.csv,da lui saprai di s  e de  suoi torti .,"da lui, dalla sua vita e dai suoi misfatti. "
trad_divina_commedia_inferno_3_19.csv,"E io   Tanto m   bel, quanto a te piace ",E io   Qualunque cosa ti piaccia   il mio desiderio.
trad_divina_commedia_inferno_3_19.csv,"tu se  segnore, e sai ch i  non mi parto",Tu sei il mio signore e sai che faccio la tua volont .
trad_divina_commedia_inferno_3_19.csv,"dal tuo volere, e sai quel che si tace .","Sai, anche quello che lascio non detto."
trad_divina_commedia_inferno_3_19.csv,Allor venimmo in su l argine quarto ,"Poi siamo arrivati al quarto argine,"
trad_divina_commedia_inferno_3_19.csv,volgemmo e discendemmo a mano stanca,girato e disceso sulla nostra sinistra
trad_divina_commedia_inferno_3_19.csv,l  gi  nel fondo foracchiato e arto.,in un basso stretto trafitto con fori.
trad_divina_commedia_inferno_3_19.csv,Lo buon maestro ancor de la sua anca,Il buon padrone mi ha stretto al suo fianco
trad_divina_commedia_inferno_3_19.csv,"non mi dipuose, s  mi giunse al rotto",e non mi ha fatto scendere fino a quando non siamo venuti
trad_divina_commedia_inferno_3_19.csv,di quel che si piangeva con la zanca.,alla fossa di uno che si lamenta con i suoi fusti.
trad_divina_commedia_inferno_3_19.csv," O qual che se  che  l di s  tien di sotto,","Chiunque tu sia, con le tue parti superiori qui sotto,"
trad_divina_commedia_inferno_3_19.csv,"anima trista come pal commessa ,","piantato come un palo, miserabile anima,"
trad_divina_commedia_inferno_3_19.csv,"comincia  io a dir,  se puoi, fa motto .","Dissi   Esci con qualcosa, se puoi. "
trad_divina_commedia_inferno_3_19.csv,Io stava come  l frate che confessa,Ero l  come un frate che confessa
trad_divina_commedia_inferno_3_19.csv,"lo perfido assessin, che, poi ch   fitto,","un infido assassino. Una volta fatto,"
trad_divina_commedia_inferno_3_19.csv,richiama lui per che la morte cessa.,Richiama il frate per rimanere morto.
trad_divina_commedia_inferno_3_19.csv,"Ed el grid    Se  tu gi  cost  ritto,","E grid    Sei gi  tu,"
trad_divina_commedia_inferno_3_19.csv,"se  tu gi  cost  ritto, Bonifazio?","Sei gi  qui, Boniface?"
trad_divina_commedia_inferno_3_19.csv,Di parecchi anni mi ment  lo scritto.,Per diversi anni la scrittura mi ha mentito.
trad_divina_commedia_inferno_3_19.csv,Se  tu s  tosto di quell aver sazio,Sei cos  presto saziato con quei profitti
trad_divina_commedia_inferno_3_19.csv,per lo qual non temesti t rre a  nganno,per il quale non hai paura di prendere per inganno
trad_divina_commedia_inferno_3_19.csv,"la bella donna, e poi di farne strazio? .",la bella Signora e per fare il suo oltraggio? 
trad_divina_commedia_inferno_3_19.csv,"Tal mi fec io, quai son color che stanno,","Divenni come quelli che stavano l  presi in giro,"
trad_divina_commedia_inferno_3_19.csv,"per non intender ci  ch   lor risposto,","non comprendendo ci  che si dice loro,"
trad_divina_commedia_inferno_3_19.csv,"quasi scornati, e risponder non sanno.",e quindi non sapere cosa dire a sua volta.
trad_divina_commedia_inferno_3_19.csv,Allor Virgilio disse   Dilli tosto ,"Allora Virgilio disse   Diglielo subito,"
trad_divina_commedia_inferno_3_19.csv," Non son colui, non son colui che credi   "," Non sono io, non sono io quello che pensi. "
trad_divina_commedia_inferno_3_19.csv,e io rispuosi come a me fu imposto.,Ho dato la risposta che mi era stato detto di dare.
trad_divina_commedia_inferno_3_19.csv,Per che lo spirto tutti storse i piedi ,"A quel punto, i piedi dello spirito cominciarono a deprimersi."
trad_divina_commedia_inferno_3_19.csv,"poi, sospirando e con voce di pianto,","Poi, sospirando , con una voce plaintive , ha detto "
trad_divina_commedia_inferno_3_19.csv,mi disse   Dunque che a me richiedi?,Cos e  che vuoi da me?
trad_divina_commedia_inferno_3_19.csv,"Se di saper ch i  sia ti cal cotanto,", Se siete cos  desiderosi di imparare il mio nome
trad_divina_commedia_inferno_3_19.csv,"che tu abbi per  la ripa corsa,","che sei disceso dalla banca per questo,"
trad_divina_commedia_inferno_3_19.csv,sappi ch i  fui vestito del gran manto ,Sappiate che ero nascosta nel grande mantello.
trad_divina_commedia_inferno_3_19.csv,"e veramente fui figliuol de l orsa,",Ma in verita  ero un figlio dell orsacchiotto.
trad_divina_commedia_inferno_3_19.csv,"cupido s  per avanzar li orsatti,",e cos  avido ero di avanzare i miei cuccioli
trad_divina_commedia_inferno_3_19.csv,che s  l avere e qui me misi in borsa.,Ho riempito la borsa mentre ora riempivo questo buco.
trad_divina_commedia_inferno_3_19.csv,Di sotto al capo mio son li altri tratti, Sulla mia testa sono schiacciati gli altri
trad_divina_commedia_inferno_3_19.csv,"che precedetter me simoneggiando,","che praticava la simonia prima di me,"
trad_divina_commedia_inferno_3_19.csv,per le fessure de la pietra piatti.,ora appiattito in fessure nella roccia.
trad_divina_commedia_inferno_3_19.csv,L  gi  cascher  io altres  quando, A sua volta anch io saro  spinto piu  in basso.
trad_divina_commedia_inferno_3_19.csv,"verr  colui ch i  credea che tu fossi,",non appena arriva chi ti ho scambiato per
trad_divina_commedia_inferno_3_19.csv,allor ch i  feci  l s bito dimando.,quando ho chiesto la mia domanda frettolosa.
trad_divina_commedia_inferno_3_19.csv,Ma pi     l tempo gi  che i pi  mi cossi,"Ma il tempo che ho gi  arrostito i miei piedi,"
trad_divina_commedia_inferno_3_19.csv,"e ch i  son stato cos  sottosopra,","stare qui sottosopra,   gi  pi  lungo"
trad_divina_commedia_inferno_3_19.csv,ch el non star  piantato coi pi  rossi ,che sar  piantato con i piedi in fiamme.
trad_divina_commedia_inferno_3_19.csv,"ch  dopo lui verr  di pi  laida opra,", Perch  dopo di lui verr  un pastore innocente
trad_divina_commedia_inferno_3_19.csv,"di ver  ponente, un pastor sanza legge,","da occidente, uno pi  malvagio nelle sue opere,"
trad_divina_commedia_inferno_3_19.csv,tal che convien che lui e me ricuopra.,Per essere la copertura su me e lui.
trad_divina_commedia_inferno_3_19.csv,"Nuovo Ias n sar , di cui si legge"," Un nuovo Jason sar , quello di cui"
trad_divina_commedia_inferno_3_19.csv,ne  Maccabei  e come a quel fu molle,"abbiamo letto in Maccabei, e anche come il re indulgeva"
trad_divina_commedia_inferno_3_19.csv,"suo re, cos  fia lui chi Francia regge .","Giasone, cos  il re di Francia si occuper  di lui. "
trad_divina_commedia_inferno_3_19.csv,"Io non so s i  mi fui qui troppo folle,",Non so se allora ero troppo audace
trad_divina_commedia_inferno_3_19.csv,ch i  pur rispuosi lui a questo metro ,quando gli ho risposto in questa tensione 
trad_divina_commedia_inferno_3_19.csv," Deh, or mi d   quanto tesoro volle"," Per favore dimmi, quanto tesoro"
trad_divina_commedia_inferno_3_19.csv,Nostro Segnore in prima da san Pietro,Nostro Signore ha insistito su da San Pietro
trad_divina_commedia_inferno_3_19.csv,ch ei ponesse le chiavi in sua bal a?,prima di dare le chiavi nella sua custodia?
trad_divina_commedia_inferno_3_19.csv,Certo non chiese se non  Viemmi retro .,"Sicuramente non ha chiesto altro che  Seguimi, "
trad_divina_commedia_inferno_3_19.csv,N  Pier n  li altri tolsero a Matia,"Ne  Pietro, ne  gli altri, prendevano oro o argento."
trad_divina_commedia_inferno_3_19.csv,"oro od argento, quando fu sortito",da Matthias quando   stato scelto da lotto
trad_divina_commedia_inferno_3_19.csv,al loco che perd  l anima ria.,per riempire il luogo perduto dall anima colpevole.
trad_divina_commedia_inferno_3_19.csv,"Per  ti sta, ch  tu se  ben punito ","Rimani l  allora, perch  sei giustamente punito,"
trad_divina_commedia_inferno_3_19.csv,e guarda ben la mal tolta moneta,"proteggendo bene quei guadagni, maledetti,"
trad_divina_commedia_inferno_3_19.csv,ch esser ti fece contra Carlo ardito.,Questo ti ha fatto prendere coraggiosamente la tua posizione contro Re Carlo.
trad_divina_commedia_inferno_3_19.csv,E se non fosse ch ancor lo mi vieta, E se non fosse che sono ancora trattenuto
trad_divina_commedia_inferno_3_19.csv,la reverenza de le somme chiavi,"per la riverenza devo le chiavi supreme,"
trad_divina_commedia_inferno_3_19.csv,"che tu tenesti ne la vita lieta,","che una volta hai tenuto nella vita felice di sopra,"
trad_divina_commedia_inferno_3_19.csv,io userei parole ancor pi  gravi , Ricorrerei a parole ancora pi  dure
trad_divina_commedia_inferno_3_19.csv,"ch  la vostra avarizia il mondo attrista,","perch  la tua avarizia affligge il mondo,"
trad_divina_commedia_inferno_3_19.csv,calcando i buoni e sollevando i pravi.,calpestando il bene e risuscitando i malvagi.
trad_divina_commedia_inferno_3_19.csv,"Di voi pastor s accorse il Vangelista,",I pastori come te l evangelista avevano in mente
trad_divina_commedia_inferno_3_19.csv,quando colei che siede sopra l acque,quando vide colui che siede sulle acque
trad_divina_commedia_inferno_3_19.csv,puttaneggiar coi regi a lui fu vista ,"fornicazione con i re,"
trad_divina_commedia_inferno_3_19.csv,"quella che con le sette teste nacque,",Quella che   nata con sette teste
trad_divina_commedia_inferno_3_19.csv,"e da le diece corna ebbe argomento,",e da dieci corna deriv  la sua forza
trad_divina_commedia_inferno_3_19.csv,fin che virtute al suo marito piacque.,Finche  la virtu  e  piaciuta al suo sposo.
trad_divina_commedia_inferno_3_19.csv,Fatto v avete dio d oro e d argento ,Vi siete fatti un dio d oro e d argento.
trad_divina_commedia_inferno_3_19.csv,"e che altro   da voi a l idolatre,",In che modo siete diversi da coloro che adorano gli idoli?
trad_divina_commedia_inferno_3_19.csv,"se non ch elli uno, e voi ne orate cento?",se non adorano uno e voi cento?
trad_divina_commedia_inferno_3_19.csv,"Ahi, Costantin, di quanto mal fu matre,","Ah, Constantine, a quel male che hai dato alla luce,"
trad_divina_commedia_inferno_3_19.csv,"non la tua conversion, ma quella dote","non per la vostra conversione, ma per la dote"
trad_divina_commedia_inferno_3_19.csv,che da te prese il primo ricco patre! .,che il primo ricco Padre ha avuto da voi!. 
trad_divina_commedia_inferno_3_19.csv,"E mentr io li cantava cotai note,","E mentre gli cantavo questi appunti,"
trad_divina_commedia_inferno_3_19.csv,"o ira o cosc enza che  l mordesse,","sia marcio dalla rabbia o dalla coscienza,"
trad_divina_commedia_inferno_3_19.csv,forte spingava con ambo le piote.,Ha sbattuto fuori duramente con entrambi i piedi.
trad_divina_commedia_inferno_3_19.csv,"I  credo ben ch al mio duca piacesse,","Credo veramente che questo piacque al mio capo,"
trad_divina_commedia_inferno_3_19.csv,con s  contenta labbia sempre attese,ha ascoltato con uno sguardo di tale appagamento
trad_divina_commedia_inferno_3_19.csv,lo suon de le parole vere espresse.,al suono delle parole veritiere che ho pronunciato.
trad_divina_commedia_inferno_3_19.csv,Per  con ambo le braccia mi prese ,"Quindi, mi ha preso tra le sue braccia"
trad_divina_commedia_inferno_3_19.csv,"e poi che tutto su mi s ebbe al petto,","e, quando mi ebbe tutto sul suo petto,"
trad_divina_commedia_inferno_3_19.csv,rimont  per la via onde discese.,"sormontato dal sentiero che aveva disceso,"
trad_divina_commedia_inferno_3_19.csv,"N  si stanc  d avermi a s  distretto,",n  si stanc  di tenermi cos  vicino
trad_divina_commedia_inferno_3_19.csv,s  men port  sovra  l colmo de l arco,ma mi annoiarono fino alla sommit  dell arco
trad_divina_commedia_inferno_3_19.csv,che dal quarto al quinto argine   tragetto.,che attraversa dalla quarta diga alla quinta.
trad_divina_commedia_inferno_3_19.csv,"Quivi soavemente spuose il carco,","Qui piant  dolcemente il suo fardello,"
trad_divina_commedia_inferno_3_19.csv,soave per lo scoglio sconcio ed erto,dolcemente a causa della cresta ripida e ruvida
trad_divina_commedia_inferno_3_19.csv,che sarebbe a le capre duro varco.,Sarebbe stato difficile per una capra.
trad_divina_commedia_inferno_3_19.csv,Indi un altro vallon mi fu scoperto.,"E l , davanti a me, si apr  un altra valle."
trad_divina_commedia_inferno_3_20.csv,Di nova pena mi conven far versi,"Di strano nuovo dolore ora devo fare il mio verso,"
trad_divina_commedia_inferno_3_20.csv,e dar matera al ventesimo canto,dando materia al canto numerato venti
trad_divina_commedia_inferno_3_20.csv,"de la prima canzon, ch   d i sommersi.","di questo primo canzone, che racconta di quelli sommersi."
trad_divina_commedia_inferno_3_20.csv,Io era gi  disposto tutto quanto,Ormai ero tutto ansioso di vedere
trad_divina_commedia_inferno_3_20.csv,"a riguardar ne lo scoperto fondo,","ci  che vede l abisso, bagnato dalle lacrime"
trad_divina_commedia_inferno_3_20.csv,che si bagnava d angoscioso pianto ,"di angoscia, avrebbe rivelato."
trad_divina_commedia_inferno_3_20.csv,e vidi gente per lo vallon tondo,Ho visto la gente arrivare lungo quel canyon ricurvo
trad_divina_commedia_inferno_3_20.csv,"venir, tacendo e lagrimando, al passo","in silenzio, piangendo, il loro ritmo il ritmo di lento"
trad_divina_commedia_inferno_3_20.csv,che fanno le letane in questo mondo.,processioni che cantano litanie nel mondo.
trad_divina_commedia_inferno_3_20.csv,"Come  l viso mi scese in lor pi  basso,","Mentre il mio sguardo scendeva lungo le loro forme,"
