Filename,Original,Translate
trad_divina_commedia_purgatorio_3_9.csv,"diss elli a noi,  non s apre questa calla.","perch    protetto da una brezza,"
trad_divina_commedia_purgatorio_3_9.csv,Pi  cara   l una  ma l altra vuol troppa,il mio padrone spalanca le sue mani
trad_divina_commedia_purgatorio_3_9.csv,"d arte e d ingegno avanti che diserri,",dolcemente sull erba.
trad_divina_commedia_purgatorio_3_9.csv,perch ella   quella che  l nodo digroppa.,"E io, che ho capito cosa voleva dire,"
trad_divina_commedia_purgatorio_3_9.csv,Da Pier le tegno  e dissemi ch i  erri,ha alzato le mie guance macchiate di lacrime
trad_divina_commedia_purgatorio_3_9.csv,"anzi ad aprir ch a tenerla serrata,",e ha restaurato il colore
trad_divina_commedia_purgatorio_3_9.csv,pur che la gente a  piedi mi s atterri .,L inferno mi aveva oscurato.
trad_divina_commedia_purgatorio_3_9.csv,"Poi pinse l uscio a la porta sacrata,",Ora siamo arrivati alla riva vuota.
trad_divina_commedia_purgatorio_3_9.csv,dicendo   Intrate  ma facciovi accorti,Su quelle acque nessun uomo ha mai navigato
trad_divina_commedia_purgatorio_3_9.csv,che di fuor torna chi  n dietro si guata .,che poi speriment  il suo ritorno.
trad_divina_commedia_purgatorio_3_9.csv,E quando fuor ne  cardini distorti,L  mi cinse come piaceva ad un altro.
trad_divina_commedia_purgatorio_3_9.csv,"li spigoli di quella regge sacra,",Che meraviglia era che l umile pianta
trad_divina_commedia_purgatorio_3_9.csv,"che di metallo son sonanti e forti,",Scelse di andare a prenderlo subito.
trad_divina_commedia_purgatorio_3_9.csv,non rugghi  s  n  si mostr  s  acra,proprio nel luogo dove l aveva strappata.
trad_divina_commedia_purgatorio_3_10.csv,Poi fummo dentro al soglio de la porta,Per fare il suo corso attraverso l acqua pi  liscia
trad_divina_commedia_purgatorio_3_10.csv,"che  l mal amor de l anime disusa,","la piccola corteccia del mio spirito ora arrampica la sua vela,"
trad_divina_commedia_purgatorio_3_10.csv,"perch  fa parer dritta la via torta,",lasciando alle spalle quel mare crudele.
trad_divina_commedia_purgatorio_3_10.csv,sonando la senti  esser richiusa ,"Ora canter  il secondo regno,"
trad_divina_commedia_purgatorio_3_10.csv,"e s io avesse li occhi v lti ad essa,","l  dove l anima dell uomo   purificata,"
trad_divina_commedia_purgatorio_3_10.csv,qual fora stata al fallo degna scusa?,resa degna di ascendere al Cielo.
trad_divina_commedia_purgatorio_3_10.csv,"Noi salavam per una pietra fessa,","Qui dai morti la poesia si alzi,"
trad_divina_commedia_purgatorio_3_10.csv,"che si moveva e d una e d altra parte,","O Muse sacre, da quando sono vostra."
trad_divina_commedia_purgatorio_3_10.csv,s  come l onda che fugge e s appressa.,Lasciate che Calliope si alzi.
trad_divina_commedia_purgatorio_3_10.csv," Qui si conviene usare un poco d arte ,",per accompagnare la mia canzone con quegli stessi accordi
trad_divina_commedia_purgatorio_3_10.csv,"cominci   l duca mio,  in accostarsi",la cui forza colp  cos  le miserabili magpie
trad_divina_commedia_purgatorio_3_10.csv,"or quinci, or quindi al lato che si parte .","che, ascoltando, hanno perso ogni speranza di perdono."
trad_divina_commedia_purgatorio_3_10.csv,"E questo fece i nostri passi scarsi,","Colore dolce dello zaffiro orientale,"
trad_divina_commedia_purgatorio_3_10.csv,tanto che pria lo scemo de la luna,aleggiando nell aspetto calmo e tranquillo
trad_divina_commedia_purgatorio_3_10.csv,"rigiunse al letto suo per ricorcarsi,","d aria intervenente, pura all orizzonte,"
trad_divina_commedia_purgatorio_3_10.csv,che noi fossimo fuor di quella cruna ,mi sono compiaciuto ancora una volta dei miei occhi
trad_divina_commedia_purgatorio_3_10.csv,ma quando fummo liberi e aperti,non appena ho lasciato l aria morbosa
trad_divina_commedia_purgatorio_3_10.csv,"s  dove il monte in dietro si rauna,",che aveva afflitto sia il mio petto che gli occhi.
trad_divina_commedia_purgatorio_3_10.csv, o stancato e amendue incerti,"Il pianeta giusto che incoraggia l amore,"
trad_divina_commedia_purgatorio_3_10.csv,"di nostra via, restammo in su un piano","sorridente, illuminato a est,"
trad_divina_commedia_purgatorio_3_10.csv,solingo pi  che strade per diserti.,velando i pesci nel suo treno.
trad_divina_commedia_purgatorio_3_10.csv,"Da la sua sponda, ove confina il vano,","Mi voltai a destra e, fissando la mia attenzione"
trad_divina_commedia_purgatorio_3_10.csv,"al pi  de l alta ripa che pur sale,","sull altro polo, ho visto quattro stelle"
trad_divina_commedia_purgatorio_3_10.csv,misurrebbe in tre volte un corpo umano ,"non visti, ma dai primi sulla terra."
trad_divina_commedia_purgatorio_3_10.csv,"e quanto l occhio mio potea trar d ale,",Il cielo stesso sembrava gioire
trad_divina_commedia_purgatorio_3_10.csv,"or dal sinistro e or dal destro fianco,",nel loro splendente luccichio. O vedova
trad_divina_commedia_purgatorio_3_10.csv,questa cornice mi parea cotale.,"regione del nord, negata quella vista!"
trad_divina_commedia_purgatorio_3_10.csv,"L  s  non eran mossi i pi  nostri anco,","Una volta che ho attirato il mio sguardo da loro,"
trad_divina_commedia_purgatorio_3_10.csv,quand io conobbi quella ripa intorno,girare a malapena verso l altro polo
trad_divina_commedia_purgatorio_3_10.csv,"che dritto di salita aveva manco,","dove era posta la costellazione del fiume,"
trad_divina_commedia_purgatorio_3_10.csv,esser di marmo candido e addorno,"Ho visto accanto a me un vecchio, da solo,"
trad_divina_commedia_purgatorio_3_10.csv,"d intagli s , che non pur Policleto,",che dal suo aspetto era cos  meritevole di rispetto
trad_divina_commedia_purgatorio_3_10.csv,ma la natura l  avrebbe scorno.,che nessun figlio deve di pi  a suo padre.
trad_divina_commedia_purgatorio_3_10.csv,L angel che venne in terra col decreto,"La sua barba era lunga e striata di bianco,"
trad_divina_commedia_purgatorio_3_10.csv,"de la molt anni lagrimata pace,","come i suoi capelli, che cadde"
trad_divina_commedia_purgatorio_3_10.csv,"ch aperse il ciel del suo lungo divieto,",in doppi fili fino al petto.
trad_divina_commedia_purgatorio_3_10.csv,dinanzi a noi pareva s  verace,I raggi di quelle quattro stelle sante
trad_divina_commedia_purgatorio_3_10.csv,"quivi intagliato in un atto soave,",adornava il suo viso con tanta luce
trad_divina_commedia_purgatorio_3_10.csv,che non sembiava imagine che tace.,Sembrava splendere con la luminosit  del sole.
trad_divina_commedia_purgatorio_3_10.csv,Giurato si saria ch el dicesse  Ave  ,"Quali anime sei tu per essere fuggito dall eterna prigione,"
trad_divina_commedia_purgatorio_3_10.csv,perch  iv era imaginata quella,arrampicarsi contro il ruscello oscuro e nascosto?
trad_divina_commedia_purgatorio_3_10.csv,ch ad aprir l alto amor volse la chiave ,"chiese, scuotendo quelle venerate serrature."
trad_divina_commedia_purgatorio_3_10.csv,e avea in atto impressa esta favella, Chi era la tua guida o chi la tua lanterna
trad_divina_commedia_purgatorio_3_10.csv," Ecce ancilla De  , propriamente",per condurvi fuori da quella notte profonda
trad_divina_commedia_purgatorio_3_10.csv,come figura in cera si suggella.,quale ripida la valle dell Inferno nelle tenebre?
trad_divina_commedia_purgatorio_3_10.csv," Non tener pur ad un loco la mente ,","Le leggi dell abisso sono cos  infrante,"
trad_divina_commedia_purgatorio_3_10.csv,"disse  l dolce maestro, che m avea","o   stato fatto un nuovo decreto in cielo,"
trad_divina_commedia_purgatorio_3_10.csv,da quella parte onde  l cuore ha la gente.,"che, dannazione, stai davanti alle mie scogliere? "
trad_divina_commedia_purgatorio_3_10.csv,"Per ch i  mi mossi col viso, e vedea",Il mio capo mi ha poi contattato.
trad_divina_commedia_purgatorio_3_10.csv,"di retro da Maria, da quella costa",e con le sue parole e segni e con le sue mani
trad_divina_commedia_purgatorio_3_10.csv,"onde m era colui che mi movea,","mi ha fatto mostrare riverenza con il ginocchio e la fronte,"
trad_divina_commedia_purgatorio_3_10.csv,un altra storia ne la roccia imposta ,Allora gli rispose   Non sono venuto da solo.
trad_divina_commedia_purgatorio_3_10.csv,"per ch io varcai Virgilio, e fe mi presso,",Una donna discesa dal Cielo e su sua richiesta
trad_divina_commedia_purgatorio_3_10.csv,acci  che fosse a li occhi miei disposta.,Ho prestato a quest uomo compagnia e aiuto.
trad_divina_commedia_purgatorio_3_10.csv,Era intagliato l  nel marmo stesso,Ma siccome   la tua volont  che dico chiaramente
trad_divina_commedia_purgatorio_3_10.csv,"lo carro e   buoi, traendo l arca santa,","la vera condizione della nostra presenza qui,"
trad_divina_commedia_purgatorio_3_10.csv,per che si teme officio non commesso.,Non puo  essere che io neghi il tuo desiderio.
trad_divina_commedia_purgatorio_3_10.csv,"Dinanzi parea gente  e tutta quanta,","Quest uomo non ha ancora visto il suo ultimo tramonto,"
trad_divina_commedia_purgatorio_3_10.csv,"partita in sette cori, a  due mie  sensi",ma attraverso la sua follia era cos  vicino ad esso
trad_divina_commedia_purgatorio_3_10.csv,"faceva dir l un  No , l altro  S , canta .",Il suo tempo era quasi finito.
trad_divina_commedia_purgatorio_3_10.csv,Similemente al fummo de li  ncensi,"  Gli fui mandato, come ho detto,"
trad_divina_commedia_purgatorio_3_10.csv,"che v era imaginato, li occhi e  l naso",per la sua liberazione.
trad_divina_commedia_purgatorio_3_10.csv,e al s  e al no discordi fensi.,Ma questo poteva essere salvato.
trad_divina_commedia_purgatorio_3_10.csv,"L  precedeva al benedetto vaso,",Gli ho mostrato tutta la razza colpevole.
trad_divina_commedia_purgatorio_3_10.csv,"trescando alzato, l umile salmista,",e ora intende fargli vedere quegli spiriti
trad_divina_commedia_purgatorio_3_10.csv,e pi  e men che re era in quel caso.,che si purificano sotto la tua responsabilit .
trad_divina_commedia_purgatorio_3_10.csv,"Di contra, effig ata ad una vista",Come l ho condotto ci metterei molto a dirlo.
trad_divina_commedia_purgatorio_3_10.csv,"d un gran palazzo, Mic l ammirava",Scendendo dall alto un potere mi aiuta
trad_divina_commedia_purgatorio_3_10.csv,s  come donna dispettosa e trista.,"per portarlo qui, perch  possa vederti e sentirti."
trad_divina_commedia_purgatorio_3_10.csv,"I  mossi i pi  del loco dov io stava,","Che possiate dare il benvenuto al suo arrivo,"
trad_divina_commedia_purgatorio_3_10.csv,"per avvisar da presso un altra istoria,","dal momento che   in cerca di libert , che   cos  caro,"
trad_divina_commedia_purgatorio_3_10.csv,che di dietro a Mic l mi biancheggiava.,come ben sa chi dona la sua vita per essa.
trad_divina_commedia_purgatorio_3_10.csv,Quiv era stor ata l alta gloria,"Lo sai bene, dalla morte a Utica."
trad_divina_commedia_purgatorio_3_10.csv,"del roman principato, il cui valore","non sembrava amaro, l  dove te ne sei andato"
trad_divina_commedia_purgatorio_3_10.csv,mosse Gregorio a la sua gran vittoria ,l abito che splender  in quel grande giorno.
trad_divina_commedia_purgatorio_3_10.csv,i  dico di Traiano imperadore ," Non da noi sono gli eterni editti rotti,"
trad_divina_commedia_purgatorio_3_10.csv,"e una vedovella li era al freno,","perch  quest uomo vive e Minos non mi lega,"
trad_divina_commedia_purgatorio_3_10.csv,di lagrime atteggiata e di dolore.,ma io sono del cerchio dove la tua Marcia
trad_divina_commedia_purgatorio_3_10.csv,Intorno a lui parea calcato e pieno," Implora con i suoi occhi casti, o santo seno,"
trad_divina_commedia_purgatorio_3_10.csv,"di cavalieri, e l aguglie ne l oro",che pensi ancora a lei come a te.
trad_divina_commedia_purgatorio_3_10.csv,sovr essi in vista al vento si movieno.,"Per amore di lei, allora, ti supplico,"
trad_divina_commedia_purgatorio_3_10.csv,La miserella intra tutti costoro,Permettici di passare attraverso i tuoi sette regni.
trad_divina_commedia_purgatorio_3_10.csv,"pareva dir   Segnor, fammi vendetta",Le riferiro  la sua gentilezza...
trad_divina_commedia_purgatorio_3_10.csv,"di mio figliuol ch   morto, ond io m accoro  ",se degni di essere menzionato qui di seguito. 
trad_divina_commedia_purgatorio_3_10.csv,ed elli a lei rispondere   Or aspetta,Marcia era cosi  contenta dei miei occhi mentre ero ancora viva.
trad_divina_commedia_purgatorio_3_10.csv,"tanto ch i  torni   e quella   Segnor mio ,",Disse   Qualunque favore
trad_divina_commedia_purgatorio_3_10.csv,"come persona in cui dolor s affretta,","Mi ha cercato, l ho concesso."
trad_divina_commedia_purgatorio_3_10.csv," se tu non torni?   ed ei   Chi fia dov io,", Ora che abita al di l  del flusso malvagio
trad_divina_commedia_purgatorio_3_10.csv,la ti far    ed ella   L altrui bene,"non pu  pi  muovermi,"
trad_divina_commedia_purgatorio_3_10.csv,"a te che fia, se  l tuo metti in oblio?  ",secondo la legge fatta alla mia liberazione.
trad_divina_commedia_purgatorio_3_10.csv,ond elli   Or ti conforta  ch ei convene,"Ma se, come dici tu, una donna del Cielo"
trad_divina_commedia_purgatorio_3_10.csv,ch i  solva il mio dovere anzi ch i  mova ,"si muove e ti dirige, non c   bisogno di adulazione."
trad_divina_commedia_purgatorio_3_10.csv,giustizia vuole e piet  mi ritene .,Basta che lo chiedi a suo nome.
trad_divina_commedia_purgatorio_3_10.csv,Colui che mai non vide cosa nova,"Vai allora, assicurati di cingerlo."
trad_divina_commedia_purgatorio_3_10.csv,"produsse esto visibile parlare,","con la canna dritta e il suo viso bagnato,"
trad_divina_commedia_purgatorio_3_10.csv,novello a noi perch  qui non si trova.,"per cancellare tutte le tracce di contaminazione da esso,"
trad_divina_commedia_purgatorio_3_10.csv,Mentr io mi dilettava di guardare," perch  non sarebbe opportuno apparire,"
trad_divina_commedia_purgatorio_3_10.csv,"l imagini di tante umilitadi,","i suoi occhi ancora oscurati da ogni nebbia,"
trad_divina_commedia_purgatorio_3_10.csv,"e per lo fabbro loro a veder care,","davanti al ministro, il primo dal Paradiso."
trad_divina_commedia_purgatorio_3_10.csv," Ecco di qua, ma fanno i passi radi ,"," Questa piccola isola, nel suo punto pi  basso,"
trad_divina_commedia_purgatorio_3_10.csv,"mormorava il poeta,  molte genti ","l  dove le onde l hanno battuto,"
trad_divina_commedia_purgatorio_3_10.csv,questi ne  nv eranno a li alti gradi .,cresce canne nel fango morbido e plaiant.
trad_divina_commedia_purgatorio_3_10.csv,"Li occhi miei, ch a mirare eran contenti","Non c   altra pianta che possa fogliare,"
trad_divina_commedia_purgatorio_3_10.csv,"per veder novitadi ond e  son vaghi,","o indurire a sopportare,"
trad_divina_commedia_purgatorio_3_10.csv,volgendosi ver  lui non furon lenti.,senza soccombere alle onde d urto.
trad_divina_commedia_purgatorio_3_10.csv,"Non vo  per , lettor, che tu ti smaghi","Dopo che avrai finito, non tornare da questa parte."
trad_divina_commedia_purgatorio_3_10.csv,di buon proponimento per udire,"Il sole, ora che sorge, riveler "
trad_divina_commedia_purgatorio_3_10.csv,come Dio vuol che  l debito si paghi.,una salita pi  facile per raggiungere il picco. 
trad_divina_commedia_purgatorio_3_10.csv,Non attender la forma del mart re ,"Con quello scomparve, e mi alzai in piedi,"
trad_divina_commedia_purgatorio_3_10.csv,pensa la succession  pensa ch al peggio,"Senza parole. Avvicinandosi al mio capo,"
trad_divina_commedia_purgatorio_3_10.csv,oltre la gran sentenza non pu  ire.,Gli ho rivolto gli occhi addosso.
trad_divina_commedia_purgatorio_3_10.csv,"Io cominciai   Maestro, quel ch io veggio","Inizi    Figlio mio, segui i miei passi."
trad_divina_commedia_purgatorio_3_10.csv,"muovere a noi, non mi sembian persone,","Voltiamoci, per queste pendici pianeggianti"
trad_divina_commedia_purgatorio_3_10.csv,"e non so che, s  nel veder vaneggio .","da qui, fino al limite pi  basso. "
trad_divina_commedia_purgatorio_3_10.csv,Ed elli a me   La grave condizione,"Dawn stava sorpassando l oscurit  dell ora,"
trad_divina_commedia_purgatorio_3_10.csv,"di lor tormento a terra li rannicchia,","che fuggirono prima di esso, e vidi e conobbi"
trad_divina_commedia_purgatorio_3_10.csv,s  che   miei occhi pria n ebber tencione.,la lontana tremante del mare.
trad_divina_commedia_purgatorio_3_10.csv,"Ma guarda fiso l , e disviticchia","Siamo andati lungo la pianura solitaria,"
trad_divina_commedia_purgatorio_3_10.csv,col viso quel che vien sotto a quei sassi ,come qualcuno che ha perso la strada
trad_divina_commedia_purgatorio_3_10.csv,gi  scorger puoi come ciascun si picchia .,e pensa che si allontana finch  non trova la strada.
trad_divina_commedia_purgatorio_3_10.csv,"O superbi cristian, miseri lassi,",Quando siamo arrivati in un luogo dove la rugiada
trad_divina_commedia_purgatorio_3_10.csv,"che, de la vista de la mente infermi,",pu  tenere il proprio contro il sole
trad_divina_commedia_purgatorio_3_10.csv,"fidanza avete ne  retrosi passi,","perch    protetto da una brezza,"
trad_divina_commedia_purgatorio_3_10.csv,non v accorgete voi che noi siam vermi,il mio padrone spalanca le sue mani
trad_divina_commedia_purgatorio_3_10.csv,"nati a formar l angelica farfalla,",dolcemente sull erba.
trad_divina_commedia_purgatorio_3_10.csv,che vola a la giustizia sanza schermi?,"E io, che ho capito cosa voleva dire,"
trad_divina_commedia_purgatorio_3_10.csv,"Di che l animo vostro in alto galla,",ha alzato le mie guance macchiate di lacrime
trad_divina_commedia_purgatorio_3_10.csv,"poi siete quasi antomata in difetto,",e ha restaurato il colore
trad_divina_commedia_purgatorio_3_10.csv,s  come vermo in cui formazion falla?,L inferno mi aveva oscurato.
trad_divina_commedia_purgatorio_3_10.csv,"Come per sostentar solaio o tetto,",Ora siamo arrivati alla riva vuota.
trad_divina_commedia_purgatorio_3_10.csv,per mensola talvolta una figura,Su quelle acque nessun uomo ha mai navigato
trad_divina_commedia_purgatorio_3_10.csv,"si vede giugner le ginocchia al petto,",che poi speriment  il suo ritorno.
trad_divina_commedia_purgatorio_3_10.csv,la qual fa del non ver vera rancura,L  mi cinse come piaceva ad un altro.
trad_divina_commedia_purgatorio_3_10.csv,nascere  n chi la vede  cos  fatti,Che meraviglia era che l umile pianta
trad_divina_commedia_purgatorio_3_10.csv,"vid io color, quando puosi ben cura.",Scelse di andare a prenderlo subito.
trad_divina_commedia_purgatorio_3_10.csv,Vero   che pi  e meno eran contratti,proprio nel luogo dove l aveva strappata.
trad_divina_commedia_purgatorio_3_11.csv," O Padre nostro, che ne  cieli stai,",Per fare il suo corso attraverso l acqua pi  liscia
trad_divina_commedia_purgatorio_3_11.csv,"non circunscritto, ma per pi  amore","la piccola corteccia del mio spirito ora arrampica la sua vela,"
trad_divina_commedia_purgatorio_3_11.csv,"ch ai primi effetti di l  s  tu hai,",lasciando alle spalle quel mare crudele.
trad_divina_commedia_purgatorio_3_11.csv,laudato sia  l tuo nome e  l tuo valore,"Ora canter  il secondo regno,"
trad_divina_commedia_purgatorio_3_11.csv,"da ogne creatura, com   degno","l  dove l anima dell uomo   purificata,"
trad_divina_commedia_purgatorio_3_11.csv,di render grazie al tuo dolce vapore.,resa degna di ascendere al Cielo.
trad_divina_commedia_purgatorio_3_11.csv,"Vegna ver  noi la pace del tuo regno,","Qui dai morti la poesia si alzi,"
trad_divina_commedia_purgatorio_3_11.csv,"ch  noi ad essa non potem da noi,","O Muse sacre, da quando sono vostra."
trad_divina_commedia_purgatorio_3_11.csv,"s ella non vien, con tutto nostro ingegno.",Lasciate che Calliope si alzi.
trad_divina_commedia_purgatorio_3_11.csv,Come del suo voler li angeli tuoi,per accompagnare la mia canzone con quegli stessi accordi
trad_divina_commedia_purgatorio_3_11.csv,"fan sacrificio a te, cantando osanna,",la cui forza colp  cos  le miserabili magpie
trad_divina_commedia_purgatorio_3_11.csv,cos  facciano li uomini de  suoi.,"che, ascoltando, hanno perso ogni speranza di perdono."
trad_divina_commedia_purgatorio_3_11.csv,"D  oggi a noi la cotidiana manna,","Colore dolce dello zaffiro orientale,"
trad_divina_commedia_purgatorio_3_11.csv,sanza la qual per questo aspro diserto,aleggiando nell aspetto calmo e tranquillo
trad_divina_commedia_purgatorio_3_11.csv,a retro va chi pi  di gir s affanna.,"d aria intervenente, pura all orizzonte,"
trad_divina_commedia_purgatorio_3_11.csv,E come noi lo mal ch avem sofferto,mi sono compiaciuto ancora una volta dei miei occhi
trad_divina_commedia_purgatorio_3_11.csv,"perdoniamo a ciascuno, e tu perdona",non appena ho lasciato l aria morbosa
trad_divina_commedia_purgatorio_3_11.csv,"benigno, e non guardar lo nostro merto.",che aveva afflitto sia il mio petto che gli occhi.
trad_divina_commedia_purgatorio_3_11.csv,"Nostra virt  che di legger s adona,","Il pianeta giusto che incoraggia l amore,"
trad_divina_commedia_purgatorio_3_11.csv,"non spermentar con l antico avversaro,","sorridente, illuminato a est,"
trad_divina_commedia_purgatorio_3_11.csv,ma libera da lui che s  la sprona.,velando i pesci nel suo treno.
trad_divina_commedia_purgatorio_3_11.csv,"Quest ultima preghiera, segnor caro,","Mi voltai a destra e, fissando la mia attenzione"
trad_divina_commedia_purgatorio_3_11.csv,"gi  non si fa per noi, ch  non bisogna,","sull altro polo, ho visto quattro stelle"
trad_divina_commedia_purgatorio_3_11.csv,ma per color che dietro a noi restaro .,"non visti, ma dai primi sulla terra."
trad_divina_commedia_purgatorio_3_11.csv,Cos  a s  e noi buona ramogna,Il cielo stesso sembrava gioire
trad_divina_commedia_purgatorio_3_11.csv,"quell ombre orando, andavan sotto  l pondo,",nel loro splendente luccichio. O vedova
trad_divina_commedia_purgatorio_3_11.csv,"simile a quel che talvolta si sogna,","regione del nord, negata quella vista!"
trad_divina_commedia_purgatorio_3_11.csv,disparmente angosciate tutte a tondo,"Una volta che ho attirato il mio sguardo da loro,"
trad_divina_commedia_purgatorio_3_11.csv,"e lasse su per la prima cornice,",girare a malapena verso l altro polo
trad_divina_commedia_purgatorio_3_11.csv,purgando la caligine del mondo.,"dove era posta la costellazione del fiume,"
trad_divina_commedia_purgatorio_3_11.csv,"Se di l  sempre ben per noi si dice,","Ho visto accanto a me un vecchio, da solo,"
trad_divina_commedia_purgatorio_3_11.csv,di qua che dire e far per lor si puote,che dal suo aspetto era cos  meritevole di rispetto
trad_divina_commedia_purgatorio_3_11.csv,da quei c hanno al voler buona radice?,che nessun figlio deve di pi  a suo padre.
trad_divina_commedia_purgatorio_3_11.csv,Ben si de  loro atar lavar le note,"La sua barba era lunga e striata di bianco,"
trad_divina_commedia_purgatorio_3_11.csv,"che portar quinci, s  che, mondi e lievi,","come i suoi capelli, che cadde"
trad_divina_commedia_purgatorio_3_11.csv,possano uscire a le stellate ruote.,in doppi fili fino al petto.
trad_divina_commedia_purgatorio_3_11.csv," Deh, se giustizia e piet  vi disgrievi",I raggi di quelle quattro stelle sante
trad_divina_commedia_purgatorio_3_11.csv,"tosto, s  che possiate muover l ala,",adornava il suo viso con tanta luce
trad_divina_commedia_purgatorio_3_11.csv,"che secondo il disio vostro vi lievi,",Sembrava splendere con la luminosit  del sole.
trad_divina_commedia_purgatorio_3_11.csv,mostrate da qual mano inver  la scala,"Quali anime sei tu per essere fuggito dall eterna prigione,"
trad_divina_commedia_purgatorio_3_11.csv,"si va pi  corto  e se c   pi  d un varco,",arrampicarsi contro il ruscello oscuro e nascosto?
trad_divina_commedia_purgatorio_3_11.csv,quel ne  nsegnate che men erto cala ,"chiese, scuotendo quelle venerate serrature."
trad_divina_commedia_purgatorio_3_11.csv,"ch  questi che vien meco, per lo  ncarco", Chi era la tua guida o chi la tua lanterna
trad_divina_commedia_purgatorio_3_11.csv,"de la carne d Adamo onde si veste,",per condurvi fuori da quella notte profonda
trad_divina_commedia_purgatorio_3_11.csv,"al montar s , contra sua voglia,   parco .",quale ripida la valle dell Inferno nelle tenebre?
trad_divina_commedia_purgatorio_3_11.csv,"Le lor parole, che rendero a queste","Le leggi dell abisso sono cos  infrante,"
trad_divina_commedia_purgatorio_3_11.csv,"che dette avea colui cu  io seguiva,","o   stato fatto un nuovo decreto in cielo,"
trad_divina_commedia_purgatorio_3_11.csv,non fur da cui venisser manifeste ,"che, dannazione, stai davanti alle mie scogliere? "
trad_divina_commedia_purgatorio_3_11.csv,ma fu detto   A man destra per la riva,Il mio capo mi ha poi contattato.
trad_divina_commedia_purgatorio_3_11.csv,"con noi venite, e troverete il passo",e con le sue parole e segni e con le sue mani
trad_divina_commedia_purgatorio_3_11.csv,possibile a salir persona viva.,"mi ha fatto mostrare riverenza con il ginocchio e la fronte,"
trad_divina_commedia_purgatorio_3_11.csv,E s io non fossi impedito dal sasso,Allora gli rispose   Non sono venuto da solo.
trad_divina_commedia_purgatorio_3_11.csv,"che la cervice mia superba doma,",Una donna discesa dal Cielo e su sua richiesta
trad_divina_commedia_purgatorio_3_11.csv,"onde portar convienmi il viso basso,",Ho prestato a quest uomo compagnia e aiuto.
trad_divina_commedia_purgatorio_3_11.csv,"cotesti, ch ancor vive e non si noma,",Ma siccome   la tua volont  che dico chiaramente
trad_divina_commedia_purgatorio_3_11.csv,"guardere  io, per veder s i   l conosco,","la vera condizione della nostra presenza qui,"
trad_divina_commedia_purgatorio_3_11.csv,e per farlo pietoso a questa soma.,Non puo  essere che io neghi il tuo desiderio.
trad_divina_commedia_purgatorio_3_11.csv,Io fui latino e nato d un gran Tosco ,"Quest uomo non ha ancora visto il suo ultimo tramonto,"
trad_divina_commedia_purgatorio_3_11.csv,Guiglielmo Aldobrandesco fu mio padre ,ma attraverso la sua follia era cos  vicino ad esso
trad_divina_commedia_purgatorio_3_11.csv,non so se  l nome suo gi  mai fu vosco.,Il suo tempo era quasi finito.
trad_divina_commedia_purgatorio_3_11.csv,L antico sangue e l opere leggiadre,"  Gli fui mandato, come ho detto,"
trad_divina_commedia_purgatorio_3_11.csv,"d i miei maggior mi fer s  arrogante,",per la sua liberazione.
trad_divina_commedia_purgatorio_3_11.csv,"che, non pensando a la comune madre,",Ma questo poteva essere salvato.
