Filename,Original,Translate
trad_divina_commedia_inferno_3_26.csv,dov Ete cle col fratel fu miso? .,su cui Eteocle fu steso con suo fratello?. 
trad_divina_commedia_inferno_3_26.csv,Rispuose a me   L  dentro si martira,Egli rispose   In questa fiamma trovare tormento
trad_divina_commedia_inferno_3_26.csv,"Ulisse e D omede, e cos  insieme",Ulysses e Diomed. Sono accoppiati
trad_divina_commedia_inferno_3_26.csv,a la vendetta vanno come a l ira ,nella vendetta di Dio come una volta si sono guadagnati la sua ira.
trad_divina_commedia_inferno_3_26.csv,e dentro da la lor fiamma si geme, Nella loro fiamma piangono lo stratagemma
trad_divina_commedia_inferno_3_26.csv,l agguato del caval che f  la porta,del cavallo che ha fatto una porta
trad_divina_commedia_inferno_3_26.csv,onde usc  de  Romani il gentil seme.,per mezzo del quale usc  il nobile seme di Roma.
trad_divina_commedia_inferno_3_26.csv,"Piangevisi entro l arte per che, morta,","L  si lamentano delle astuzie per le quali, nella morte,"
trad_divina_commedia_inferno_3_26.csv,"De dam a ancor si duol d Achille,","Deidam a piange ancora Achille,"
trad_divina_commedia_inferno_3_26.csv,e del Palladio pena vi si porta .,e l  fanno ammenda per il Palladio. 
trad_divina_commedia_inferno_3_26.csv, S ei posson dentro da quelle faville," Se possono parlare tra quelle fiamme, "
trad_divina_commedia_inferno_3_26.csv,"parlar , diss io,  maestro, assai ten priego","Dissi   Ti prego, padrone, e ti prego di nuovo..."
trad_divina_commedia_inferno_3_26.csv,"e ripriego, che  l priego vaglia mille,",e possa la mia preghiera essere forte mille  
trad_divina_commedia_inferno_3_26.csv,che non mi facci de l attender niego, Non proibite la mia permanenza per un po  
trad_divina_commedia_inferno_3_26.csv,fin che la fiamma cornuta qua vegna ,finch  non arriva la fiamma biforcuta.
trad_divina_commedia_inferno_3_26.csv,vedi che del disio ver  lei mi piego! .,Vedete quanto con impazienza mi schiero nella sua direzione. 
trad_divina_commedia_inferno_3_26.csv,Ed elli a me   La tua preghiera   degna,E lui a me   La tua preghiera merita
trad_divina_commedia_inferno_3_26.csv,"di molta loda, e io per  l accetto ","molte lodi. Pertanto, lo concedo,"
trad_divina_commedia_inferno_3_26.csv,ma fa che la tua lingua si sostegna.,ma a condizione che tu tenga la lingua.
trad_divina_commedia_inferno_3_26.csv,"Lascia parlare a me, ch i  ho concetto"," Lasciami parlare, perch  ho capito"
trad_divina_commedia_inferno_3_26.csv,"ci  che tu vuoi  ch ei sarebbero schivi,","E, dato che erano greci,"
trad_divina_commedia_inferno_3_26.csv,"perch e  fuor greci, forse del tuo detto .",disdegnano le tue parole. 
trad_divina_commedia_inferno_3_26.csv,Poi che la fiamma fu venuta quivi,"Una volta che la fiamma si era avvicinata, quando ha pensato"
trad_divina_commedia_inferno_3_26.csv,"dove parve al mio duca tempo e loco,","il tempo e il momento giusto,"
trad_divina_commedia_inferno_3_26.csv,in questa forma lui parlare audivi ,Ho sentito il mio capo parlare in questo modo 
trad_divina_commedia_inferno_3_26.csv," O voi che siete due dentro ad un foco,","O tu che sei gemellato in un solo fuoco,"
trad_divina_commedia_inferno_3_26.csv,"s io meritai di voi mentre ch io vissi,","se mi sono guadagnato il tuo favore mentre vivevo,"
trad_divina_commedia_inferno_3_26.csv,s io meritai di voi assai o poco,"se mi sono guadagnato il tuo favore, in qualunque misura..."
trad_divina_commedia_inferno_3_26.csv,"quando nel mondo li alti versi scrissi,","Quando, nel mondo, ho scritto i miei alti versi,"
trad_divina_commedia_inferno_3_26.csv,non vi movete  ma l un di voi dica,allora non allontanatevi. Lasciate che uno di voi si relaziona
trad_divina_commedia_inferno_3_26.csv,"dove, per lui, perduto a morir gissi .","proprio dove, avendo perso la strada, and  a morire. "
trad_divina_commedia_inferno_3_26.csv,Lo maggior corno de la fiamma antica,E il corno pi  grande di quell antica fiamma
trad_divina_commedia_inferno_3_26.csv,"cominci  a crollarsi mormorando,","cominci  a mormorare e a tremare,"
trad_divina_commedia_inferno_3_26.csv,pur come quella cui vento affatica ,come una fiamma preoccupata dal vento.
trad_divina_commedia_inferno_3_26.csv,"indi la cima qua e l  menando,","Poi, brandendo la sua punta in questo modo e che,"
trad_divina_commedia_inferno_3_26.csv,"come fosse la lingua che parlasse,","come se fosse la lingua del fuoco a parlare,"
trad_divina_commedia_inferno_3_26.csv,gitt  voce di fuori e disse   Quando,fece uscire una voce e disse   Quando io
trad_divina_commedia_inferno_3_26.csv,"mi diparti  da Circe, che sottrasse"," ha preso congedo da Circe, che per un anno e pi "
trad_divina_commedia_inferno_3_26.csv,"me pi  d un anno l  presso a Gaeta,","mi ha ingannato l , non lontano da Ga ta,"
trad_divina_commedia_inferno_3_26.csv,"prima che s  En a la nomasse,","prima che Enea gli desse quel nome,"
trad_divina_commedia_inferno_3_26.csv,"n  dolcezza di figlio, n  la pieta"," non tenerezza per un figlio, n  dovere filiale "
trad_divina_commedia_inferno_3_26.csv,"del vecchio padre, n   l debito amore","verso il mio ag d padre, n  l amore che dovevo"
trad_divina_commedia_inferno_3_26.csv,"lo qual dovea Penelop  far lieta,","Penelope che l avrebbe resa felice,"
trad_divina_commedia_inferno_3_26.csv,vincer potero dentro a me l ardore, potrebbe superare il fervore che era mio
trad_divina_commedia_inferno_3_26.csv,ch i  ebbi a divenir del mondo esperto,per acquisire esperienza del mondo
trad_divina_commedia_inferno_3_26.csv,e de li vizi umani e del valore ,e conoscere i vizi dell uomo e il suo valore.
trad_divina_commedia_inferno_3_26.csv,ma misi me per l alto mare aperto, E cos  mi misi in cammino verso l aperta profondit 
trad_divina_commedia_inferno_3_26.csv,sol con un legno e con quella compagna,"con una sola nave, con quella manciata"
trad_divina_commedia_inferno_3_26.csv,picciola da la qual non fui diserto.,di compagni di navi che non mi avevano abbandonato.
trad_divina_commedia_inferno_3_26.csv,"L un lito e l altro vidi infin la Spagna,"," Una riva e l altra ho visto fino alla Spagna,"
trad_divina_commedia_inferno_3_26.csv,"fin nel Morrocco, e l isola d i Sardi,","Marocco    l isola della Sardegna,"
trad_divina_commedia_inferno_3_26.csv,e l altre che quel mare intorno bagna.,e altre isole incastonate in quel mare.
trad_divina_commedia_inferno_3_26.csv,Io e   compagni eravam vecchi e tardi, Io e i miei compagni di navigazione eravamo cresciuti vecchi e lenti
trad_divina_commedia_inferno_3_26.csv,quando venimmo a quella foce stretta,per il momento in cui abbiamo raggiunto lo stretto stretto
trad_divina_commedia_inferno_3_26.csv,dov Ercule segn  li suoi riguardi,"dove Ercole segnava i limiti,"
trad_divina_commedia_inferno_3_26.csv,acci  che l uom pi  oltre non si metta ,Avverti tutti gli uomini di non andare oltre.
trad_divina_commedia_inferno_3_26.csv,"da la man destra mi lasciai Sibilia,","Sul lato destro ho lasciato Siviglia alle spalle,"
trad_divina_commedia_inferno_3_26.csv,da l altra gi  m avea lasciata Setta.,dall altro avevo lasciato Ce ta.
trad_divina_commedia_inferno_3_26.csv," O frati,  dissi,  che per cento milia","  O fratelli,  ho detto,  che, nel corso"
trad_divina_commedia_inferno_3_26.csv,"perigli siete giunti a l occidente,","di centomila pericoli, finalmente"
trad_divina_commedia_inferno_3_26.csv,a questa tanto picciola vigilia,"hanno raggiunto l ovest, a tal breve veglia"
trad_divina_commedia_inferno_3_26.csv,d i nostri sensi ch   del rimanente,"  dei nostri sensi come ci rimane,"
trad_divina_commedia_inferno_3_26.csv,"non vogliate negar l esper enza,",non negate a voi stessi la possibilit  di conoscere...
trad_divina_commedia_inferno_3_26.csv,"di retro al sol, del mondo sanza gente.",seguendo il sole    il mondo dove nessuno vive.
trad_divina_commedia_inferno_3_26.csv,Considerate la vostra semenza ,  Considerate come le vostre anime sono state seminate 
trad_divina_commedia_inferno_3_26.csv,"fatti non foste a viver come bruti,","non siete stati fatti per vivere come bruti o bestie,"
trad_divina_commedia_inferno_3_26.csv,ma per seguir virtute e canoscenza .,ma per perseguire la virt  e la conoscenza. 
trad_divina_commedia_inferno_3_26.csv,"Li miei compagni fec io s  aguti,", Con questo breve discorso ho avuto i miei compagni
trad_divina_commedia_inferno_3_26.csv,"con questa orazion picciola, al cammino,",cos  ansioso per il viaggio
trad_divina_commedia_inferno_3_26.csv,che a pena poscia li avrei ritenuti ,Avrei potuto fare a meno di trattenerli.
trad_divina_commedia_inferno_3_26.csv,"e volta nostra poppa nel mattino,"," E dopo aver posto la nostra poppa all alba,"
trad_divina_commedia_inferno_3_26.csv,"de  remi facemmo ali al folle volo,","nel nostro folle volo girammo i nostri remi verso le ali,"
trad_divina_commedia_inferno_3_26.csv,sempre acquistando dal lato mancino.,Sempre a sinistra.
trad_divina_commedia_inferno_3_26.csv,Tutte le stelle gi  de l altro polo, Ora la notte stava guardando le stelle che illuminano
trad_divina_commedia_inferno_3_26.csv,"vedea la notte, e  l nostro tanto basso,","l altro polo, le stelle della nostra cos  bassa"
trad_divina_commedia_inferno_3_26.csv,che non surg a fuor del marin suolo.,non si sono alzati sopra il fondo dell oceano.
trad_divina_commedia_inferno_3_26.csv,Cinque volte racceso e tante casso, Cinque volte la luce sotto la luna
trad_divina_commedia_inferno_3_26.csv,"lo lume era di sotto da la luna,",era stato riacceso e come spesso   stato spento
trad_divina_commedia_inferno_3_26.csv,"poi che  ntrati eravam ne l alto passo,","da quando abbiamo iniziato il nostro viaggio nel profondo,"
trad_divina_commedia_inferno_3_26.csv,"quando n apparve una montagna, bruna"," quando potevamo vedere una montagna, distante,"
trad_divina_commedia_inferno_3_26.csv,"per la distanza, e parvemi alta tanto",oscuro e fioco. Ai miei occhi sembrava
trad_divina_commedia_inferno_3_26.csv,quanto veduta non av a alcuna.,pi  in alto di quanto avessi mai visto.
trad_divina_commedia_inferno_3_26.csv,"Noi ci allegrammo, e tosto torn  in pianto ","  Ci siamo rallegrati, ma presto la gioia si   trasformata in dolore "
trad_divina_commedia_inferno_3_27.csv,Gi  era dritta in s  la fiamma e queta,"La fiamma ora stava eretta e immobile,"
trad_divina_commedia_inferno_3_27.csv,"per non dir pi , e gi  da noi sen gia","significava non parlare pi , e stava partendo"
trad_divina_commedia_inferno_3_27.csv,"con la licenza del dolce poeta,","con il gentile permesso del poeta,"
trad_divina_commedia_inferno_3_27.csv,"quand un altra, che dietro a lei ven a,","quando un altra fiamma si avvicina alle spalle,"
trad_divina_commedia_inferno_3_27.csv,ne fece volger li occhi a la sua cima,"ha fatto s  che i nostri occhi si fissassero sulla sua punta,"
trad_divina_commedia_inferno_3_27.csv,per un confuso suon che fuor n uscia.,disegnato dalla bizzarra che veniva da essa.
trad_divina_commedia_inferno_3_27.csv,Come  l bue cicilian che mugghi  prima,Come il toro siciliano che soffi  per primo
trad_divina_commedia_inferno_3_27.csv,"col pianto di colui, e ci  fu dritto,",con le grida di colui il cui strumento
trad_divina_commedia_inferno_3_27.csv,"che l avea temperato con sua lima,",l avevo modellato... ed era solo...
trad_divina_commedia_inferno_3_27.csv,"mugghiava con la voce de l afflitto,",usato per soffiare con la voce della vittima
trad_divina_commedia_inferno_3_27.csv,"s  che, con tutto che fosse di rame,","in modo che, anche se il toro   stato fatto di ottone,"
trad_divina_commedia_inferno_3_27.csv,pur el pareva dal dolor trafitto ,"sembrava trasposta dal dolore,"
trad_divina_commedia_inferno_3_27.csv,"cos , per non aver via n  forame","quindi, non avendo prima corso o uscita"
trad_divina_commedia_inferno_3_27.csv,"dal principio nel foco, in suo linguaggio","attraverso la fiamma, le parole luttuose"
trad_divina_commedia_inferno_3_27.csv,si convert an le parole grame.,sono stati trasformati in una lingua tutta loro.
trad_divina_commedia_inferno_3_27.csv,Ma poscia ch ebber colto lor v aggio,Ma una volta che le parole avevano fatto la loro strada
trad_divina_commedia_inferno_3_27.csv,"su per la punta, dandole quel guizzo","fino alla punta, facendolo tremare"
trad_divina_commedia_inferno_3_27.csv,"che dato avea la lingua in lor passaggio,","come aveva fatto la voce quando li aveva formati,"
trad_divina_commedia_inferno_3_27.csv,udimmo dire   O tu a cu  io drizzo,Lo abbiamo sentito dire   O voi a cui io miro la mia voce
trad_divina_commedia_inferno_3_27.csv,"la voce e che parlavi mo lombardo,","e che, proprio ora, disse in lingua lombarda "
trad_divina_commedia_inferno_3_27.csv,"dicendo  Istra ten va, pi  non t adizzo ,"," Ora vai per la tua strada, non ti chiedo nient altro. "
trad_divina_commedia_inferno_3_27.csv,"perch io sia giunto forse alquanto tardo,"," anche se sono arrivato, forse, un po  in ritardo,"
trad_divina_commedia_inferno_3_27.csv,non t incresca restare a parlar meco ,Lascia che non ti dia fastidio restare a parlare con me.
trad_divina_commedia_inferno_3_27.csv,"vedi che non incresce a me, e ardo!","Anche se sono nella fiamma, come puoi vedere, non mi infastidisce."
trad_divina_commedia_inferno_3_27.csv,Se tu pur mo in questo mondo cieco, Se sei solo un po  caduto
trad_divina_commedia_inferno_3_27.csv,caduto se  di quella dolce terra,in questo mondo cieco da quella dolce terra
trad_divina_commedia_inferno_3_27.csv,"latina ond io mia colpa tutta reco,","dall Italia, da cui abbatter  tutti i miei peccati,"
trad_divina_commedia_inferno_3_27.csv,dimmi se Romagnuoli han pace o guerra ,Dimmi se la Romagna vive in pace o in guerra.
trad_divina_commedia_inferno_3_27.csv,ch io fui d i monti l  intra Orbino,Vengo da dove si trovano le montagne.
trad_divina_commedia_inferno_3_27.csv,e  l giogo di che Tever si diserra .,Urbino e il crinale da cui scaturisce il Tevere. 
trad_divina_commedia_inferno_3_27.csv,"Io era in giuso ancora attento e chino,",Mi stavo ancora piegando per sentire...
trad_divina_commedia_inferno_3_27.csv,"quando il mio duca mi tent  di costa,",quando il mio capo mi sgrid  e disse 
trad_divina_commedia_inferno_3_27.csv,dicendo   Parla tu  questi   latino .,Sta a te parlare... questo e  italiano.
trad_divina_commedia_inferno_3_27.csv,"E io, ch avea gi  pronta la risposta,","E io, che avevo la mia risposta pronta,"
trad_divina_commedia_inferno_3_27.csv,sanza indugio a parlare incominciai ,senza indugio ha cominciato a parlare 
trad_divina_commedia_inferno_3_27.csv," O anima che se  l  gi  nascosta,"," O anima che   nascosta alla mia vista laggi ,"
trad_divina_commedia_inferno_3_27.csv,"Romagna tua non  , e non fu mai,"," La tua Romagna non  , e non   mai stato,"
trad_divina_commedia_inferno_3_27.csv,sanza guerra ne  cuor de  suoi tiranni ,libero dalla guerra nel cuore dei suoi governanti.
trad_divina_commedia_inferno_3_27.csv,ma  n palese nessuna or vi lasciai.,"Tuttavia, non ho lasciato indietro nessuna guerra aperta."
trad_divina_commedia_inferno_3_27.csv,Ravenna sta come stata   molt anni ,Ravenna rimane com   da anni.
trad_divina_commedia_inferno_3_27.csv,"l aguglia da Polenta la si cova,",L aquila di Polenta vi cova sopra
trad_divina_commedia_inferno_3_27.csv,s  che Cervia ricuopre co  suoi vanni.,in modo che copre Cervia con le sue ali.
trad_divina_commedia_inferno_3_27.csv,La terra che f  gi  la lunga prova," La citt  che una volta ha resistito al lungo assedio,"
trad_divina_commedia_inferno_3_27.csv,"e di Franceschi sanguinoso mucchio,","fare del francese un mucchio di sangue,"
trad_divina_commedia_inferno_3_27.csv,sotto le branche verdi si ritrova.,  ora di nuovo sotto gli artigli verdi del leone.
trad_divina_commedia_inferno_3_27.csv,"E  l mastin vecchio e  l nuovo da Verrucchio,"," Il mastino pi  anziano di Verrucchio e il pi  giovane,"
trad_divina_commedia_inferno_3_27.csv,"che fecer di Montagna il mal governo,","che tra loro avevano a che fare duro con Montagna,"
trad_divina_commedia_inferno_3_27.csv,l  dove soglion fan d i denti succhio.,affilare i denti a coclee nel luogo consueto.
trad_divina_commedia_inferno_3_27.csv,Le citt  di Lamone e di Santerno,"Il giovane leone su un campo di bianco,"
trad_divina_commedia_inferno_3_27.csv,"conduce il l oncel dal nido bianco,","che governa le citt  di Lamone e Santerno,"
trad_divina_commedia_inferno_3_27.csv,che muta parte da la state al verno.,cambia i lati tra l estate e le nevi.
trad_divina_commedia_inferno_3_27.csv,"E quella cu  il Savio bagna il fianco,",E la citt  che costeggia il Savio si bagna 
trad_divina_commedia_inferno_3_27.csv,"cos  com ella sie  tra  l piano e  l monte,","mentre vive tra tirannia e libert ,"
trad_divina_commedia_inferno_3_27.csv,tra tirannia si vive e stato franco.,cos  si trova tra la montagna e la pianura.
trad_divina_commedia_inferno_3_27.csv,"Ora chi se , ti priego che ne conte ","Ma ora, ti prego, dicci chi sei."
trad_divina_commedia_inferno_3_27.csv,"non esser duro pi  ch altri sia stato,","Non essere piu  scontroso di quanto un altro sia stato con te,"
trad_divina_commedia_inferno_3_27.csv,se  l nome tuo nel mondo tegna fronte .,cos  possa il tuo nome continuare nel mondo. 
trad_divina_commedia_inferno_3_27.csv,Poscia che  l foco alquanto ebbe rugghiato,"Quando il fuoco ebbe fatto il suo ruggito per un po ,"
trad_divina_commedia_inferno_3_27.csv,"al modo suo, l aguta punta mosse","dopo la sua moda, il punto ha cominciato a tremare"
trad_divina_commedia_inferno_3_27.csv,"di qua, di l , e poi di  cotal fiato ","in questo modo e quello, e poi ha dato respiro a questo "
trad_divina_commedia_inferno_3_27.csv, S i  credesse che mia risposta fosse, Se solo pensassi che la mia risposta fosse stata fatta
trad_divina_commedia_inferno_3_27.csv,"a persona che mai tornasse al mondo,","a uno forse ritornando al mondo,"
trad_divina_commedia_inferno_3_27.csv,questa fiamma staria sanza pi  scosse ,Questa lingua di fuoco cesserebbe di tremare.
trad_divina_commedia_inferno_3_27.csv,ma per  che gi  mai di questo fondo,Ma dato che da queste profondit  nessuno l ha ancora fatto...
trad_divina_commedia_inferno_3_27.csv,"non torn  vivo alcun, s i  odo il vero,","tornato vivo, se quello che sento   vero,"
trad_divina_commedia_inferno_3_27.csv,sanza tema d infamia ti rispondo.,Rispondo senza paura di vergognarmi.
trad_divina_commedia_inferno_3_27.csv,"Io fui uom d arme, e poi fui cordigliero,"," Un guerriero ero io, e poi un frate cordato,"
trad_divina_commedia_inferno_3_27.csv,"credendomi, s  cinto, fare ammenda ",Pensavo... incisa cosi ... per fare ammenda.
trad_divina_commedia_inferno_3_27.csv,"e certo il creder mio ven a intero,",E sicuramente le mie speranze sarebbero avverate
trad_divina_commedia_inferno_3_27.csv,"se non fosse il gran prete, a cui mal prenda!,",Ma per il Grande Sacerdote... il diavolo lo prenda!
trad_divina_commedia_inferno_3_27.csv,che mi rimise ne le prime colpe ,che mi ha riportato alle mie vecchie abitudini.
trad_divina_commedia_inferno_3_27.csv,e come e,E vorrei dirvi come e perch .
trad_divina_commedia_inferno_3_27.csv,", voglio che m intenda.",Mentre io conservavo la forma in carne e ossa
trad_divina_commedia_inferno_3_27.csv,Mentre ch io forma fui d ossa e di polpe,"mia madre mi ha dato, le mie opere non erano"
trad_divina_commedia_inferno_3_27.csv,"che la madre mi di , l opere mie","un leone, ma le azioni di una volpe."
trad_divina_commedia_inferno_3_27.csv,"non furon leonine, ma di volpe."," Strategie di funzionamento e sistemi segreti,"
trad_divina_commedia_inferno_3_27.csv,Li accorgimenti e le coperte vie,"Li conoscevo tutti, ed ero cosi  bravo in loro."
trad_divina_commedia_inferno_3_27.csv,"io seppi tutte, e s  menai lor arte,",La mia fama squill  fino ai confini pi  lontani della terra.
trad_divina_commedia_inferno_3_27.csv,ch al fine de la terra il suono uscie., Quando vidi che avevo raggiunto quella fase della vita
trad_divina_commedia_inferno_3_27.csv,Quando mi vidi giunto in quella parte,quando tutti gli uomini dovrebbero pensare
trad_divina_commedia_inferno_3_27.csv,di mia etade ove ciascun dovrebbe,"di calare la vela e arrotolare le corde,"
trad_divina_commedia_inferno_3_27.csv,"calar le vele e raccoglier le sarte,",Divenni dispiaciuto di quello che prima mi era piaciuto.
trad_divina_commedia_inferno_3_27.csv,"ci  che pria mi piac a, allor m increbbe,","Pentito e rimpicciolito, sono diventato un frate."
trad_divina_commedia_inferno_3_27.csv,e pentuto e confesso mi rendei ,E guai a me! sarebbe servito.
trad_divina_commedia_inferno_3_27.csv,ahi miser lasso! e giovato sarebbe.,"Ma lui, principe dei farisei dell ultimo giorno,"
trad_divina_commedia_inferno_3_27.csv,"Lo principe d i novi Farisei,",impegnato in battaglia vicino al Laterano
trad_divina_commedia_inferno_3_27.csv,"avendo guerra presso a Laterano,","e non con Saraceno o con Ebreo,"
trad_divina_commedia_inferno_3_27.csv,"e non con Saracin n  con Giudei,",Perche  tutti i suoi nemici erano cristiani...
trad_divina_commedia_inferno_3_27.csv,"ch  ciascun suo nimico era cristiano,",nessuno di loro era andato a conquistare Acre
trad_divina_commedia_inferno_3_27.csv,e nessun era stato a vincer Acri,o il traffico nelle terre del Sultano...
trad_divina_commedia_inferno_3_27.csv,"n  mercatante in terra di Soldano,"," Non ha prestato alcuna attenzione, da parte sua, all ufficio pi  alto. "
trad_divina_commedia_inferno_3_27.csv,n  sommo officio n  ordini sacri,"o i suoi santi ordini, n  per i miei,"
trad_divina_commedia_inferno_3_27.csv,"guard  in s , n  in me quel capestro",al cordone che teneva i suoi portatori magri.
trad_divina_commedia_inferno_3_27.csv,che solea fare i suoi cinti pi  macri., Come Costantino una volta aveva chiamato Sylvester
trad_divina_commedia_inferno_3_27.csv,Ma come Costantin chiese Silvestro,"da Soracte per curare le sue piaghe lebbrose,"
trad_divina_commedia_inferno_3_27.csv,"d entro Siratti a guerir de la lebbre,",Cosi  quest uomo mi ha chiesto di essere il suo dottore.
trad_divina_commedia_inferno_3_27.csv,cos  mi chiese questi per maestro,E guarirlo dalla febbre del suo orgoglio.
trad_divina_commedia_inferno_3_27.csv,a guerir de la sua superba febbre ,"Mi ha chiesto un consiglio, ma ho taciuto."
trad_divina_commedia_inferno_3_27.csv,"domandommi consiglio, e io tacetti",Perche  le sue parole erano come quelle di un ubriacone.
trad_divina_commedia_inferno_3_27.csv,perch  le sue parole parver ebbre.,E poi disse di nuovo   Non diffidi del tuo cuore 
trad_divina_commedia_inferno_3_27.csv,E  poi ridisse   Tuo cuor non sospetti ,Ti assolvo qui e ora se vuoi insegnarmi
trad_divina_commedia_inferno_3_27.csv,"finor t assolvo, e tu m insegna fare",come posso portare Praeneste a terra.
trad_divina_commedia_inferno_3_27.csv,s  come Penestrino in terra getti.," Ho il potere, come sapete, di bloccare"
trad_divina_commedia_inferno_3_27.csv,"Lo ciel poss io serrare e diserrare,","e sbloccare il Cielo, perch  le chiavi sono due"
trad_divina_commedia_inferno_3_27.csv,come tu sai  per  son due le chiavi,per il quale il papa prima di me non ha avuto cura. 
trad_divina_commedia_inferno_3_27.csv,che  l mio antecessor non ebbe care .,La sua tattica minacciosa mi ha portato al punto
trad_divina_commedia_inferno_3_27.csv,Allor mi pinser li argomenti gravi,in cui il corso peggiore sembrava quello del silenzio.
trad_divina_commedia_inferno_3_27.csv,"l   ve  l tacer mi fu avviso  l peggio,","E cos  dissi   Padre, dal momento che mi purifichi"
trad_divina_commedia_inferno_3_27.csv,"e dissi   Padre, da che tu mi lavi", del peccato che devo commettere anche ora 
trad_divina_commedia_inferno_3_27.csv,"di quel peccato ov io mo cader deggio,",Molto promettente con scarsa osservanza
trad_divina_commedia_inferno_3_27.csv,lunga promessa con l attender corto,suggeller  il tuo trionfo sul trono alto. 
trad_divina_commedia_inferno_3_27.csv,ti far  tr unfar ne l alto seggio .,"Nel momento in cui ero morto, Francis venne a cercarmi."
trad_divina_commedia_inferno_3_27.csv,"Francesco venne poi, com io fu  morto,",Ma uno dei Cherubini oscuri grid  
trad_divina_commedia_inferno_3_27.csv,per me  ma un d i neri cherubini," No, sbagliami, non togliermelo."
trad_divina_commedia_inferno_3_27.csv,li disse   Non portar  non mi far torto., Deve scendere per servire tra i miei servitori. 
trad_divina_commedia_inferno_3_27.csv,Venir se ne dee gi  tra   miei meschini,Perche  ha dato quel consiglio fraudolento.
trad_divina_commedia_inferno_3_27.csv,"perch  diede  l consiglio frodolente,",Da allora fino ad ora ho obsoleto i suoi passi.
trad_divina_commedia_inferno_3_27.csv,dal quale in qua stato li sono a  crini ," Non si pu  essere assolti senza pentimento,"
trad_divina_commedia_inferno_3_27.csv,"ch assolver non si pu  chi non si pente,",n  pentirsi e desiderare di peccare contemporaneamente...
trad_divina_commedia_inferno_3_27.csv,n  pentere e volere insieme puossi,una semplice contraddizione non permessa. 
trad_divina_commedia_inferno_3_27.csv,per la contradizion che nol consente .," Oh, miserabile che sono, come ho tremato"
trad_divina_commedia_inferno_3_27.csv,Oh me dolente! come mi riscossi,quando mi prese e disse   Forse
trad_divina_commedia_inferno_3_27.csv,quando mi prese dicendomi   Forse,Non pensavi che sarei stato esperto di logica. 
trad_divina_commedia_inferno_3_27.csv,tu non pensavi ch io l ico fossi! .,"Mi port  a Minosse, che gli fece la coda"
trad_divina_commedia_inferno_3_27.csv,A Min s mi port   e quelli attorse,  volte intorno alla schiena squamosa
trad_divina_commedia_inferno_3_27.csv,otto volte la coda al dosso duro ,"e, dopo averla stuzzicata nella sua tremenda rabbia,"
trad_divina_commedia_inferno_3_27.csv,"e poi che per gran rabbia la si morse,",Disse   Ecco che arriva un peccatore per il fuoco dei ladri. 
trad_divina_commedia_inferno_3_27.csv,disse   Questi   d i rei del foco furo  ,"E cos , proprio come mi vedete, sono dannato,"
trad_divina_commedia_inferno_3_27.csv,"per ch io l  dove vedi son perduto,","Nascosto come sono. E mentre vado, mi addoloro. "
