Filename,Original,Translate
trad_divina_commedia_purgatorio_3_25.csv,l altre potenze tutte quante mute ,Permettici di passare attraverso i tuoi sette regni.
trad_divina_commedia_purgatorio_3_25.csv,"memoria, intelligenza e volontade",Le riferiro  la sua gentilezza...
trad_divina_commedia_purgatorio_3_25.csv,in atto molto pi  che prima agute.,se degni di essere menzionato qui di seguito. 
trad_divina_commedia_purgatorio_3_25.csv,"Sanza restarsi, per s  stessa cade",Marcia era cosi  contenta dei miei occhi mentre ero ancora viva.
trad_divina_commedia_purgatorio_3_25.csv,mirabilmente a l una de le rive ,Disse   Qualunque favore
trad_divina_commedia_purgatorio_3_25.csv,quivi conosce prima le sue strade.,"Mi ha cercato, l ho concesso."
trad_divina_commedia_purgatorio_3_25.csv,"Tosto che loco l  la circunscrive,", Ora che abita al di l  del flusso malvagio
trad_divina_commedia_purgatorio_3_25.csv,la virt  formativa raggia intorno,"non pu  pi  muovermi,"
trad_divina_commedia_purgatorio_3_25.csv,cos  e quanto ne le membra vive.,secondo la legge fatta alla mia liberazione.
trad_divina_commedia_purgatorio_3_25.csv,"E come l aere, quand   ben p orno,","Ma se, come dici tu, una donna del Cielo"
trad_divina_commedia_purgatorio_3_25.csv,"per l altrui raggio che  n s  si reflette,","si muove e ti dirige, non c   bisogno di adulazione."
trad_divina_commedia_purgatorio_3_25.csv,di diversi color diventa addorno ,Basta che lo chiedi a suo nome.
trad_divina_commedia_purgatorio_3_25.csv,cos  l aere vicin quivi si mette,"Vai allora, assicurati di cingerlo."
trad_divina_commedia_purgatorio_3_25.csv,e in quella forma ch   in lui suggella,"con la canna dritta e il suo viso bagnato,"
trad_divina_commedia_purgatorio_3_25.csv,virt almente l alma che ristette ,"per cancellare tutte le tracce di contaminazione da esso,"
trad_divina_commedia_purgatorio_3_25.csv,e simigliante poi a la fiammella," perch  non sarebbe opportuno apparire,"
trad_divina_commedia_purgatorio_3_25.csv,"che segue il foco l   vunque si muta,","i suoi occhi ancora oscurati da ogni nebbia,"
trad_divina_commedia_purgatorio_3_25.csv,segue lo spirto sua forma novella.,"davanti al ministro, il primo dal Paradiso."
trad_divina_commedia_purgatorio_3_25.csv,"Per  che quindi ha poscia sua paruta,"," Questa piccola isola, nel suo punto pi  basso,"
trad_divina_commedia_purgatorio_3_25.csv,  chiamata ombra  e quindi organa poi,"l  dove le onde l hanno battuto,"
trad_divina_commedia_purgatorio_3_25.csv,ciascun sentire infino a la veduta.,cresce canne nel fango morbido e plaiant.
trad_divina_commedia_purgatorio_3_25.csv,Quindi parliamo e quindi ridiam noi ,"Non c   altra pianta che possa fogliare,"
trad_divina_commedia_purgatorio_3_25.csv,quindi facciam le lagrime e   sospiri,"o indurire a sopportare,"
trad_divina_commedia_purgatorio_3_25.csv,che per lo monte aver sentiti puoi.,senza soccombere alle onde d urto.
trad_divina_commedia_purgatorio_3_25.csv,Secondo che ci affliggono i disiri,"Dopo che avrai finito, non tornare da questa parte."
trad_divina_commedia_purgatorio_3_25.csv,"e li altri affetti, l ombra si figura ","Il sole, ora che sorge, riveler "
trad_divina_commedia_purgatorio_3_25.csv,e quest   la cagion di che tu miri .,una salita pi  facile per raggiungere il picco. 
trad_divina_commedia_purgatorio_3_25.csv,E gi  venuto a l ultima tortura,"Con quello scomparve, e mi alzai in piedi,"
trad_divina_commedia_purgatorio_3_25.csv,"s era per noi, e v lto a la man destra,","Senza parole. Avvicinandosi al mio capo,"
trad_divina_commedia_purgatorio_3_25.csv,ed eravamo attenti ad altra cura.,Gli ho rivolto gli occhi addosso.
trad_divina_commedia_purgatorio_3_25.csv,"Quivi la ripa fiamma in fuor balestra,","Inizi    Figlio mio, segui i miei passi."
trad_divina_commedia_purgatorio_3_25.csv,e la cornice spira fiato in suso,"Voltiamoci, per queste pendici pianeggianti"
trad_divina_commedia_purgatorio_3_25.csv,che la reflette e via da lei sequestra ,"da qui, fino al limite pi  basso. "
trad_divina_commedia_purgatorio_3_25.csv,ond ir ne convenia dal lato schiuso,"Dawn stava sorpassando l oscurit  dell ora,"
trad_divina_commedia_purgatorio_3_25.csv,ad uno ad uno  e io tem a  l foco,"che fuggirono prima di esso, e vidi e conobbi"
trad_divina_commedia_purgatorio_3_25.csv,"quinci, e quindi temeva cader giuso.",la lontana tremante del mare.
trad_divina_commedia_purgatorio_3_25.csv,Lo duca mio dicea   Per questo loco,"Siamo andati lungo la pianura solitaria,"
trad_divina_commedia_purgatorio_3_25.csv,"si vuol tenere a li occhi stretto il freno,",come qualcuno che ha perso la strada
trad_divina_commedia_purgatorio_3_25.csv,per  ch errar potrebbesi per poco .,e pensa che si allontana finch  non trova la strada.
trad_divina_commedia_purgatorio_3_25.csv, Summae Deus clement ae  nel seno,Quando siamo arrivati in un luogo dove la rugiada
trad_divina_commedia_purgatorio_3_25.csv,"al grande ardore allora udi  cantando,",pu  tenere il proprio contro il sole
trad_divina_commedia_purgatorio_3_25.csv,che di volger mi f  caler non meno ,"perch    protetto da una brezza,"
trad_divina_commedia_purgatorio_3_25.csv,e vidi spirti per la fiamma andando ,il mio padrone spalanca le sue mani
trad_divina_commedia_purgatorio_3_25.csv,"per ch io guardava a loro e a  miei passi,",dolcemente sull erba.
trad_divina_commedia_purgatorio_3_25.csv,compartendo la vista a quando a quando.,"E io, che ho capito cosa voleva dire,"
trad_divina_commedia_purgatorio_3_25.csv,"Appresso il fine ch a quell inno fassi,",ha alzato le mie guance macchiate di lacrime
trad_divina_commedia_purgatorio_3_25.csv,gridavano alto   Virum non cognosco  ,e ha restaurato il colore
trad_divina_commedia_purgatorio_3_25.csv,indi ricominciavan l inno bassi.,L inferno mi aveva oscurato.
trad_divina_commedia_purgatorio_3_25.csv,"Finitolo, anco gridavano   Al bosco",Ora siamo arrivati alla riva vuota.
trad_divina_commedia_purgatorio_3_25.csv,"si tenne Diana, ed Elice caccionne",Su quelle acque nessun uomo ha mai navigato
trad_divina_commedia_purgatorio_3_25.csv,che di Venere avea sentito il t sco .,che poi speriment  il suo ritorno.
trad_divina_commedia_purgatorio_3_25.csv,Indi al cantar tornavano  indi donne,L  mi cinse come piaceva ad un altro.
trad_divina_commedia_purgatorio_3_25.csv,gridavano e mariti che fuor casti,Che meraviglia era che l umile pianta
trad_divina_commedia_purgatorio_3_25.csv,come virtute e matrimonio imponne.,Scelse di andare a prenderlo subito.
trad_divina_commedia_purgatorio_3_25.csv,E questo modo credo che lor basti,proprio nel luogo dove l aveva strappata.
trad_divina_commedia_purgatorio_3_26.csv,"Mentre che s  per l orlo, uno innanzi altro,",Per fare il suo corso attraverso l acqua pi  liscia
trad_divina_commedia_purgatorio_3_26.csv,"ce n andavamo, e spesso il buon maestro","la piccola corteccia del mio spirito ora arrampica la sua vela,"
trad_divina_commedia_purgatorio_3_26.csv,diceami   Guarda  giovi ch io ti scaltro  ,lasciando alle spalle quel mare crudele.
trad_divina_commedia_purgatorio_3_26.csv,"feriami il sole in su l omero destro,","Ora canter  il secondo regno,"
trad_divina_commedia_purgatorio_3_26.csv,"che gi , raggiando, tutto l occidente","l  dove l anima dell uomo   purificata,"
trad_divina_commedia_purgatorio_3_26.csv,mutava in bianco aspetto di cilestro ,resa degna di ascendere al Cielo.
trad_divina_commedia_purgatorio_3_26.csv,e io facea con l ombra pi  rovente,"Qui dai morti la poesia si alzi,"
trad_divina_commedia_purgatorio_3_26.csv,parer la fiamma  e pur a tanto indizio,"O Muse sacre, da quando sono vostra."
trad_divina_commedia_purgatorio_3_26.csv,"vidi molt ombre, andando, poner mente.",Lasciate che Calliope si alzi.
trad_divina_commedia_purgatorio_3_26.csv,Questa fu la cagion che diede inizio,per accompagnare la mia canzone con quegli stessi accordi
trad_divina_commedia_purgatorio_3_26.csv,loro a parlar di me  e cominciarsi,la cui forza colp  cos  le miserabili magpie
trad_divina_commedia_purgatorio_3_26.csv,a dir   Colui non par corpo fittizio  ,"che, ascoltando, hanno perso ogni speranza di perdono."
trad_divina_commedia_purgatorio_3_26.csv,"poi verso me, quanto pot an farsi,","Colore dolce dello zaffiro orientale,"
trad_divina_commedia_purgatorio_3_26.csv,"certi si fero, sempre con riguardo",aleggiando nell aspetto calmo e tranquillo
trad_divina_commedia_purgatorio_3_26.csv,di non uscir dove non fosser arsi.,"d aria intervenente, pura all orizzonte,"
trad_divina_commedia_purgatorio_3_26.csv," O tu che vai, non per esser pi  tardo,",mi sono compiaciuto ancora una volta dei miei occhi
trad_divina_commedia_purgatorio_3_26.csv,"ma forse reverente, a li altri dopo,",non appena ho lasciato l aria morbosa
trad_divina_commedia_purgatorio_3_26.csv,rispondi a me che  n sete e  n foco ardo.,che aveva afflitto sia il mio petto che gli occhi.
trad_divina_commedia_purgatorio_3_26.csv,N  solo a me la tua risposta   uopo ,"Il pianeta giusto che incoraggia l amore,"
trad_divina_commedia_purgatorio_3_26.csv,ch  tutti questi n hanno maggior sete,"sorridente, illuminato a est,"
trad_divina_commedia_purgatorio_3_26.csv,che d acqua fredda Indo o Et opo.,velando i pesci nel suo treno.
trad_divina_commedia_purgatorio_3_26.csv,Dinne com   che fai di te parete,"Mi voltai a destra e, fissando la mia attenzione"
trad_divina_commedia_purgatorio_3_26.csv,"al sol, pur come tu non fossi ancora","sull altro polo, ho visto quattro stelle"
trad_divina_commedia_purgatorio_3_26.csv,di morte intrato dentro da la rete .,"non visti, ma dai primi sulla terra."
trad_divina_commedia_purgatorio_3_26.csv,S  mi parlava un d essi  e io mi fora,Il cielo stesso sembrava gioire
trad_divina_commedia_purgatorio_3_26.csv,"gi  manifesto, s io non fossi atteso",nel loro splendente luccichio. O vedova
trad_divina_commedia_purgatorio_3_26.csv,ad altra novit  ch apparve allora ,"regione del nord, negata quella vista!"
trad_divina_commedia_purgatorio_3_26.csv,ch  per lo mezzo del cammino acceso,"Una volta che ho attirato il mio sguardo da loro,"
trad_divina_commedia_purgatorio_3_26.csv,"venne gente col viso incontro a questa,",girare a malapena verso l altro polo
trad_divina_commedia_purgatorio_3_26.csv,la qual mi fece a rimirar sospeso.,"dove era posta la costellazione del fiume,"
trad_divina_commedia_purgatorio_3_26.csv,L  veggio d ogne parte farsi presta,"Ho visto accanto a me un vecchio, da solo,"
trad_divina_commedia_purgatorio_3_26.csv,ciascun ombra e basciarsi una con una,che dal suo aspetto era cos  meritevole di rispetto
trad_divina_commedia_purgatorio_3_26.csv,"sanza restar, contente a brieve festa ",che nessun figlio deve di pi  a suo padre.
trad_divina_commedia_purgatorio_3_26.csv,cos  per entro loro schiera bruna,"La sua barba era lunga e striata di bianco,"
trad_divina_commedia_purgatorio_3_26.csv,"s ammusa l una con l altra formica,","come i suoi capelli, che cadde"
trad_divina_commedia_purgatorio_3_26.csv,forse a sp ar lor via e lor fortuna.,in doppi fili fino al petto.
trad_divina_commedia_purgatorio_3_26.csv,"Tosto che parton l accoglienza amica,",I raggi di quelle quattro stelle sante
trad_divina_commedia_purgatorio_3_26.csv,"prima che  l primo passo l  trascorra,",adornava il suo viso con tanta luce
trad_divina_commedia_purgatorio_3_26.csv,sopragridar ciascuna s affatica ,Sembrava splendere con la luminosit  del sole.
trad_divina_commedia_purgatorio_3_26.csv,la nova gente   Soddoma e Gomorra  ,"Quali anime sei tu per essere fuggito dall eterna prigione,"
trad_divina_commedia_purgatorio_3_26.csv,"e l altra   Ne la vacca entra Pasife,",arrampicarsi contro il ruscello oscuro e nascosto?
trad_divina_commedia_purgatorio_3_26.csv,perch   l torello a sua lussuria corra .,"chiese, scuotendo quelle venerate serrature."
trad_divina_commedia_purgatorio_3_26.csv,"Poi, come grue ch a le montagne Rife", Chi era la tua guida o chi la tua lanterna
trad_divina_commedia_purgatorio_3_26.csv,"volasser parte, e parte inver  l arene,",per condurvi fuori da quella notte profonda
trad_divina_commedia_purgatorio_3_26.csv,"queste del gel, quelle del sole schife,",quale ripida la valle dell Inferno nelle tenebre?
trad_divina_commedia_purgatorio_3_26.csv,"l una gente sen va, l altra sen vene ","Le leggi dell abisso sono cos  infrante,"
trad_divina_commedia_purgatorio_3_26.csv,"e tornan, lagrimando, a  primi canti","o   stato fatto un nuovo decreto in cielo,"
trad_divina_commedia_purgatorio_3_26.csv,e al gridar che pi  lor si convene ,"che, dannazione, stai davanti alle mie scogliere? "
trad_divina_commedia_purgatorio_3_26.csv,"e raccostansi a me, come davanti,",Il mio capo mi ha poi contattato.
trad_divina_commedia_purgatorio_3_26.csv,"essi medesmi che m avean pregato,",e con le sue parole e segni e con le sue mani
trad_divina_commedia_purgatorio_3_26.csv,attenti ad ascoltar ne  lor sembianti.,"mi ha fatto mostrare riverenza con il ginocchio e la fronte,"
trad_divina_commedia_purgatorio_3_26.csv,"Io, che due volte avea visto lor grato,",Allora gli rispose   Non sono venuto da solo.
trad_divina_commedia_purgatorio_3_26.csv,incominciai   O anime sicure,Una donna discesa dal Cielo e su sua richiesta
trad_divina_commedia_purgatorio_3_26.csv,"d aver, quando che sia, di pace stato,",Ho prestato a quest uomo compagnia e aiuto.
trad_divina_commedia_purgatorio_3_26.csv,non son rimase acerbe n  mature,Ma siccome   la tua volont  che dico chiaramente
trad_divina_commedia_purgatorio_3_26.csv,"le membra mie di l , ma son qui meco","la vera condizione della nostra presenza qui,"
trad_divina_commedia_purgatorio_3_26.csv,col sangue suo e con le sue giunture.,Non puo  essere che io neghi il tuo desiderio.
trad_divina_commedia_purgatorio_3_26.csv,Quinci s  vo per non esser pi  cieco ,"Quest uomo non ha ancora visto il suo ultimo tramonto,"
trad_divina_commedia_purgatorio_3_26.csv,"donna   di sopra che m acquista grazia,",ma attraverso la sua follia era cos  vicino ad esso
trad_divina_commedia_purgatorio_3_26.csv,per che  l mortal per vostro mondo reco.,Il suo tempo era quasi finito.
trad_divina_commedia_purgatorio_3_26.csv,Ma se la vostra maggior voglia sazia,"  Gli fui mandato, come ho detto,"
trad_divina_commedia_purgatorio_3_26.csv,"tosto divegna, s  che  l ciel v alberghi",per la sua liberazione.
trad_divina_commedia_purgatorio_3_26.csv,"ch   pien d amore e pi  ampio si spazia,",Ma questo poteva essere salvato.
trad_divina_commedia_purgatorio_3_26.csv,"ditemi, acci  ch ancor carte ne verghi,",Gli ho mostrato tutta la razza colpevole.
trad_divina_commedia_purgatorio_3_26.csv,"chi siete voi, e chi   quella turba",e ora intende fargli vedere quegli spiriti
trad_divina_commedia_purgatorio_3_26.csv,che se ne va di retro a  vostri terghi .,che si purificano sotto la tua responsabilit .
trad_divina_commedia_purgatorio_3_26.csv,Non altrimenti stupido si turba,Come l ho condotto ci metterei molto a dirlo.
trad_divina_commedia_purgatorio_3_26.csv,"lo montanaro, e rimirando ammuta,",Scendendo dall alto un potere mi aiuta
trad_divina_commedia_purgatorio_3_26.csv,"quando rozzo e salvatico s inurba,","per portarlo qui, perch  possa vederti e sentirti."
trad_divina_commedia_purgatorio_3_26.csv,che ciascun ombra fece in sua paruta ,"Che possiate dare il benvenuto al suo arrivo,"
trad_divina_commedia_purgatorio_3_26.csv,"ma poi che furon di stupore scarche,","dal momento che   in cerca di libert , che   cos  caro,"
trad_divina_commedia_purgatorio_3_26.csv,"lo qual ne li alti cuor tosto s attuta,",come ben sa chi dona la sua vita per essa.
trad_divina_commedia_purgatorio_3_26.csv," Beato te, che de le nostre marche ,","Lo sai bene, dalla morte a Utica."
trad_divina_commedia_purgatorio_3_26.csv,"ricominci  colei che pria m inchiese,","non sembrava amaro, l  dove te ne sei andato"
trad_divina_commedia_purgatorio_3_26.csv," per morir meglio, esper enza imbarche!",l abito che splender  in quel grande giorno.
trad_divina_commedia_purgatorio_3_26.csv,"La gente che non vien con noi, offese"," Non da noi sono gli eterni editti rotti,"
trad_divina_commedia_purgatorio_3_26.csv,"di ci  per che gi  Cesar, tr unfando,","perch  quest uomo vive e Minos non mi lega,"
trad_divina_commedia_purgatorio_3_26.csv, Regina  contra s  chiamar s intese ,ma io sono del cerchio dove la tua Marcia
trad_divina_commedia_purgatorio_3_26.csv,"per  si parton  Soddoma  gridando,"," Implora con i suoi occhi casti, o santo seno,"
trad_divina_commedia_purgatorio_3_26.csv,"rimproverando a s  com hai udito,",che pensi ancora a lei come a te.
trad_divina_commedia_purgatorio_3_26.csv,e aiutan l arsura vergognando.,"Per amore di lei, allora, ti supplico,"
trad_divina_commedia_purgatorio_3_26.csv,Nostro peccato fu ermafrodito ,Permettici di passare attraverso i tuoi sette regni.
trad_divina_commedia_purgatorio_3_26.csv,"ma perch  non servammo umana legge,",Le riferiro  la sua gentilezza...
trad_divina_commedia_purgatorio_3_26.csv,"seguendo come bestie l appetito,",se degni di essere menzionato qui di seguito. 
trad_divina_commedia_purgatorio_3_26.csv,"in obbrobrio di noi, per noi si legge,",Marcia era cosi  contenta dei miei occhi mentre ero ancora viva.
trad_divina_commedia_purgatorio_3_26.csv,"quando partinci, il nome di colei",Disse   Qualunque favore
trad_divina_commedia_purgatorio_3_26.csv,che s imbesti  ne le  mbestiate schegge.,"Mi ha cercato, l ho concesso."
trad_divina_commedia_purgatorio_3_26.csv,Or sai nostri atti e di che fummo rei , Ora che abita al di l  del flusso malvagio
trad_divina_commedia_purgatorio_3_26.csv,"se forse a nome vuo  saper chi semo,","non pu  pi  muovermi,"
trad_divina_commedia_purgatorio_3_26.csv,"tempo non   di dire, e non saprei.",secondo la legge fatta alla mia liberazione.
trad_divina_commedia_purgatorio_3_26.csv,Farotti ben di me volere scemo ,"Ma se, come dici tu, una donna del Cielo"
trad_divina_commedia_purgatorio_3_26.csv,"son Guido Guinizzelli, e gi  mi purgo","si muove e ti dirige, non c   bisogno di adulazione."
trad_divina_commedia_purgatorio_3_26.csv,per ben dolermi prima ch a lo stremo .,Basta che lo chiedi a suo nome.
trad_divina_commedia_purgatorio_3_26.csv,Quali ne la tristizia di Ligurgo,"Vai allora, assicurati di cingerlo."
trad_divina_commedia_purgatorio_3_26.csv,"si fer due figli a riveder la madre,","con la canna dritta e il suo viso bagnato,"
trad_divina_commedia_purgatorio_3_26.csv,"tal mi fec io, ma non a tanto insurgo,","per cancellare tutte le tracce di contaminazione da esso,"
trad_divina_commedia_purgatorio_3_26.csv,quand io odo nomar s  stesso il padre," perch  non sarebbe opportuno apparire,"
trad_divina_commedia_purgatorio_3_26.csv,mio e de li altri miei miglior che mai,"i suoi occhi ancora oscurati da ogni nebbia,"
trad_divina_commedia_purgatorio_3_26.csv,rime d amor usar dolci e leggiadre ,"davanti al ministro, il primo dal Paradiso."
trad_divina_commedia_purgatorio_3_26.csv,e sanza udire e dir pensoso andai," Questa piccola isola, nel suo punto pi  basso,"
trad_divina_commedia_purgatorio_3_26.csv,"lunga f ata rimirando lui,","l  dove le onde l hanno battuto,"
trad_divina_commedia_purgatorio_3_26.csv,"n , per lo foco, in l  pi  m appressai.",cresce canne nel fango morbido e plaiant.
trad_divina_commedia_purgatorio_3_26.csv,"Poi che di riguardar pasciuto fui,","Non c   altra pianta che possa fogliare,"
trad_divina_commedia_purgatorio_3_26.csv,tutto m offersi pronto al suo servigio,"o indurire a sopportare,"
trad_divina_commedia_purgatorio_3_26.csv,con l affermar che fa credere altrui.,senza soccombere alle onde d urto.
trad_divina_commedia_purgatorio_3_26.csv,"Ed elli a me   Tu lasci tal vestigio,","Dopo che avrai finito, non tornare da questa parte."
trad_divina_commedia_purgatorio_3_26.csv,"per quel ch i  odo, in me, e tanto chiaro,","Il sole, ora che sorge, riveler "
trad_divina_commedia_purgatorio_3_26.csv,che Let  nol pu  t rre n  far bigio.,una salita pi  facile per raggiungere il picco. 
trad_divina_commedia_purgatorio_3_26.csv,"Ma se le tue parole or ver giuraro,","Con quello scomparve, e mi alzai in piedi,"
trad_divina_commedia_purgatorio_3_26.csv,dimmi che   cagion per che dimostri,"Senza parole. Avvicinandosi al mio capo,"
trad_divina_commedia_purgatorio_3_26.csv,nel dire e nel guardar d avermi caro .,Gli ho rivolto gli occhi addosso.
trad_divina_commedia_purgatorio_3_26.csv,"E io a lui   Li dolci detti vostri,","Inizi    Figlio mio, segui i miei passi."
trad_divina_commedia_purgatorio_3_26.csv,"che, quanto durer  l uso moderno,","Voltiamoci, per queste pendici pianeggianti"
trad_divina_commedia_purgatorio_3_26.csv,faranno cari ancora i loro incostri .,"da qui, fino al limite pi  basso. "
trad_divina_commedia_purgatorio_3_26.csv," O frate , disse,  questi ch io ti cerno","Dawn stava sorpassando l oscurit  dell ora,"
trad_divina_commedia_purgatorio_3_26.csv,"col dito , e addit  un spirto innanzi,","che fuggirono prima di esso, e vidi e conobbi"
trad_divina_commedia_purgatorio_3_26.csv, fu miglior fabbro del parlar materno.,la lontana tremante del mare.
trad_divina_commedia_purgatorio_3_26.csv,Versi d amore e prose di romanzi,"Siamo andati lungo la pianura solitaria,"
trad_divina_commedia_purgatorio_3_26.csv,soverchi  tutti  e lascia dir li stolti,come qualcuno che ha perso la strada
trad_divina_commedia_purgatorio_3_26.csv,che quel di Lemos  credon ch avanzi.,e pensa che si allontana finch  non trova la strada.
trad_divina_commedia_purgatorio_3_26.csv,"A voce pi  ch al ver drizzan li volti,",Quando siamo arrivati in un luogo dove la rugiada
trad_divina_commedia_purgatorio_3_26.csv,e cos  ferman sua oppin one,pu  tenere il proprio contro il sole
trad_divina_commedia_purgatorio_3_26.csv,prima ch arte o ragion per lor s ascolti.,"perch    protetto da una brezza,"
trad_divina_commedia_purgatorio_3_26.csv,"Cos  fer molti antichi di Guittone,",il mio padrone spalanca le sue mani
trad_divina_commedia_purgatorio_3_26.csv,"di grido in grido pur lui dando pregio,",dolcemente sull erba.
trad_divina_commedia_purgatorio_3_26.csv,fin che l ha vinto il ver con pi  persone.,"E io, che ho capito cosa voleva dire,"
trad_divina_commedia_purgatorio_3_26.csv,"Or se tu hai s  ampio privilegio,",ha alzato le mie guance macchiate di lacrime
trad_divina_commedia_purgatorio_3_26.csv,che licito ti sia l andare al chiostro,e ha restaurato il colore
trad_divina_commedia_purgatorio_3_26.csv,"nel quale   Cristo abate del collegio,",L inferno mi aveva oscurato.
trad_divina_commedia_purgatorio_3_26.csv,"falli per me un dir d un paternostro,",Ora siamo arrivati alla riva vuota.
trad_divina_commedia_purgatorio_3_26.csv,"quanto bisogna a noi di questo mondo,",Su quelle acque nessun uomo ha mai navigato
trad_divina_commedia_purgatorio_3_26.csv,dove poter peccar non   pi  nostro .,che poi speriment  il suo ritorno.
trad_divina_commedia_purgatorio_3_26.csv,"Poi, forse per dar luogo altrui secondo",L  mi cinse come piaceva ad un altro.
trad_divina_commedia_purgatorio_3_26.csv,"che presso avea, disparve per lo foco,",Che meraviglia era che l umile pianta
trad_divina_commedia_purgatorio_3_26.csv,come per l acqua il pesce andando al fondo.,Scelse di andare a prenderlo subito.
trad_divina_commedia_purgatorio_3_26.csv,"Io mi fei al mostrato innanzi un poco,",proprio nel luogo dove l aveva strappata.
trad_divina_commedia_purgatorio_3_27.csv,S  come quando i primi raggi vibra,Per fare il suo corso attraverso l acqua pi  liscia
trad_divina_commedia_purgatorio_3_27.csv,"l  dove il suo fattor lo sangue sparse,","la piccola corteccia del mio spirito ora arrampica la sua vela,"
trad_divina_commedia_purgatorio_3_27.csv,"cadendo Ibero sotto l alta Libra,",lasciando alle spalle quel mare crudele.
trad_divina_commedia_purgatorio_3_27.csv,"e l onde in Gange da nona r arse,","Ora canter  il secondo regno,"
trad_divina_commedia_purgatorio_3_27.csv,"s  stava il sole  onde  l giorno sen giva,","l  dove l anima dell uomo   purificata,"
trad_divina_commedia_purgatorio_3_27.csv,come l angel di Dio lieto ci apparse.,resa degna di ascendere al Cielo.
trad_divina_commedia_purgatorio_3_27.csv,"Fuor de la fiamma stava in su la riva,","Qui dai morti la poesia si alzi,"
trad_divina_commedia_purgatorio_3_27.csv,e cantava  Beati mundo corde! ,"O Muse sacre, da quando sono vostra."
trad_divina_commedia_purgatorio_3_27.csv,in voce assai pi  che la nostra viva.,Lasciate che Calliope si alzi.
trad_divina_commedia_purgatorio_3_27.csv,"Poscia  Pi  non si va, se pria non morde,",per accompagnare la mia canzone con quegli stessi accordi
trad_divina_commedia_purgatorio_3_27.csv,"anime sante, il foco  intrate in esso,",la cui forza colp  cos  le miserabili magpie
trad_divina_commedia_purgatorio_3_27.csv,"e al cantar di l  non siate sorde ,","che, ascoltando, hanno perso ogni speranza di perdono."
trad_divina_commedia_purgatorio_3_27.csv,ci disse come noi li fummo presso ,"Colore dolce dello zaffiro orientale,"
trad_divina_commedia_purgatorio_3_27.csv,"per ch io divenni tal, quando lo  ntesi,",aleggiando nell aspetto calmo e tranquillo
trad_divina_commedia_purgatorio_3_27.csv,qual   colui che ne la fossa   messo.,"d aria intervenente, pura all orizzonte,"
trad_divina_commedia_purgatorio_3_27.csv,"In su le man commesse mi protesi,",mi sono compiaciuto ancora una volta dei miei occhi
trad_divina_commedia_purgatorio_3_27.csv,guardando il foco e imaginando forte,non appena ho lasciato l aria morbosa
trad_divina_commedia_purgatorio_3_27.csv,umani corpi gi  veduti accesi.,che aveva afflitto sia il mio petto che gli occhi.
trad_divina_commedia_purgatorio_3_27.csv,Volsersi verso me le buone scorte ,"Il pianeta giusto che incoraggia l amore,"
trad_divina_commedia_purgatorio_3_27.csv,"e Virgilio mi disse   Figliuol mio,","sorridente, illuminato a est,"
trad_divina_commedia_purgatorio_3_27.csv,"qui pu  esser tormento, ma non morte.",velando i pesci nel suo treno.
trad_divina_commedia_purgatorio_3_27.csv,"Ricorditi, ricorditi! E se io","Mi voltai a destra e, fissando la mia attenzione"
trad_divina_commedia_purgatorio_3_27.csv,"sovresso Ger on ti guidai salvo,","sull altro polo, ho visto quattro stelle"
