Filename,Original,Translate
trad_divina_commedia_inferno_3_10.csv,"Temp era dal principio del mattino,","Era l ora del mattino,"
trad_divina_commedia_inferno_3_10.csv,e  l sol montava  n s  con quelle stelle,quando il sole si monta con quelle stelle
trad_divina_commedia_inferno_3_10.csv,ch eran con lui quando l amor divino,che brillava con esso quando l amore di Dio
trad_divina_commedia_inferno_3_10.csv,mosse di prima quelle cose belle ,"primo messo in moto quelle cose giuste,"
trad_divina_commedia_inferno_3_10.csv,s  ch a bene sperar m era cagione,"in modo che, nonostante quella bestia con la pelliccia sgargiante,"
trad_divina_commedia_inferno_3_10.csv,di quella fiera a la gaetta pelle,"Potrei ancora sperare per il bene, incoraggiato"
trad_divina_commedia_inferno_3_10.csv,l ora del tempo e la dolce stagione ,"nell ora del giorno e nella stagione dolce,"
trad_divina_commedia_inferno_3_10.csv,ma non s  che paura non mi desse,solo per essere colpiti dalla paura
trad_divina_commedia_inferno_3_10.csv,la vista che m apparve d un leone.,quando ho visto un leone sulla mia strada.
trad_divina_commedia_inferno_3_10.csv,Questi parea che contra me venisse,Sembrava che stesse per saltare...
trad_divina_commedia_inferno_3_10.csv,"con la test alta e con rabbiosa fame,",la sua testa teneva alta e furiosa con la fame...
trad_divina_commedia_inferno_3_10.csv,s  che parea che l aere ne tremesse.,in modo che l aria sembrava tremare contro di lui.
trad_divina_commedia_inferno_3_10.csv,"Ed una lupa, che di tutte brame","E poi un lupo che, tutto nascosto e ossa,"
trad_divina_commedia_inferno_3_10.csv,"sembiava carca ne la sua magrezza,",sembrava carico di tutti gli appetiti
trad_divina_commedia_inferno_3_10.csv,"e molte genti f  gi  viver grame,",che hanno fatto vivere molti in miseria
trad_divina_commedia_inferno_3_10.csv,questa mi porse tanto di gravezza,"cos  ho pesato i miei spiriti con il terrore,"
trad_divina_commedia_inferno_3_10.csv,"con la paura ch uscia di sua vista,","che si raffredd  alla vista di lei,"
trad_divina_commedia_inferno_3_10.csv,ch io perdei la speranza de l altezza.,che ho perso la speranza di fare l ascesa.
trad_divina_commedia_inferno_3_10.csv,"E qual   quei che volontieri acquista,",E come chi gioisce per i suoi guadagni
trad_divina_commedia_inferno_3_10.csv,"e giugne  l tempo che perder lo face,","ma quando arriva il momento e lui perde,"
trad_divina_commedia_inferno_3_10.csv,che  n tutti suoi pensier piange e s attrista ,"trasforma tutto il suo pensiero in tristezza e lamento,"
trad_divina_commedia_inferno_3_10.csv,"tal mi fece la bestia sanza pace,",L inquieta bestia mi ha fatto...
trad_divina_commedia_inferno_3_10.csv,"che, venendomi  ncontro, a poco a poco","venendo contro di me, passo dopo passo,"
trad_divina_commedia_inferno_3_10.csv,mi ripigneva l  dove  l sol tace.,Mi ha spinto fino a dove il sole tace.
trad_divina_commedia_inferno_3_10.csv,"Mentre ch i  rovinava in basso loco,","Mentre stavo scappando in un posto pi  basso,"
trad_divina_commedia_inferno_3_10.csv,dinanzi a li occhi mi si fu offerto,"davanti ai miei occhi mostrava una figura,"
trad_divina_commedia_inferno_3_10.csv,chi per lungo silenzio parea fioco.,"debole, nell ampio silenzio."
trad_divina_commedia_inferno_3_10.csv,"Quando vidi costui nel gran diserto,","Quando l ho visto in quel vasto deserto,"
trad_divina_commedia_inferno_3_10.csv, ,"Abbi piet  di me, qualunque cosa tu sia,"
trad_divina_commedia_inferno_3_10.csv,"di me , gridai a lui,","Ho pianto,  se ombra o uomo vivente! "
trad_divina_commedia_inferno_3_10.csv," qual che tu sii, od ombra od omo certo! .","Egli rispose   Non un uomo, anche se una volta ero."
trad_divina_commedia_inferno_3_10.csv,"Rispuosemi   Non omo, omo gi  fui,",I miei genitori venivano dalla Lombardia...
trad_divina_commedia_inferno_3_10.csv,"e li parenti miei furon lombardi,",Mantova era la loro patria.
trad_divina_commedia_inferno_3_10.csv,mantoani per patr a ambedui.," Sono nato sotto Julio, anche se in ritardo nel suo tempo,"
trad_divina_commedia_inferno_3_10.csv,Nacqui,"e visse a Roma, sotto il buon Augusto"
trad_divina_commedia_inferno_3_10.csv,", ancor che fosse tardi,",in un epoca di falsi e bugiardi dei.
trad_divina_commedia_inferno_3_10.csv,e vissi a Roma sotto  l buono Augusto, Ero un poeta e cantavo
trad_divina_commedia_inferno_3_10.csv,nel tempo de li d i falsi e bugiardi.,il giusto figlio di Anchise viene da Troia
trad_divina_commedia_inferno_3_10.csv,"Poeta fui, e cantai di quel giusto",dopo che l orgoglioso Ilium fu messo a fuoco.
trad_divina_commedia_inferno_3_10.csv,"figliuol d Anchise che venne di Troia,","Ma tu, perche  stai tornando alla miseria?"
trad_divina_commedia_inferno_3_10.csv,poi che  l superbo Il  n fu combusto.,"Perch  non salite la vetta che d  piacere,"
trad_divina_commedia_inferno_3_10.csv,Ma tu perch  ritorni a tanta noia?,origine e causa di ogni gioia?
trad_divina_commedia_inferno_3_10.csv,perch  non sali il dilettoso monte," Sei allora Virgil, la fontana"
trad_divina_commedia_inferno_3_10.csv,ch   principio e cagion di tutta gioia? .,che versa cos  pieno un flusso di discorso?  
trad_divina_commedia_inferno_3_10.csv, Or se  tu quel Virgilio e quella fonte,Gli risposi  la mia testa si   abbassata nella vergogna.
trad_divina_commedia_inferno_3_10.csv,"che spandi di parlar s  largo fiume? ,"," O gloria e luce di tutti gli altri poeti,"
trad_divina_commedia_inferno_3_10.csv,rispuos io lui con vergognosa fronte.,Lasciate che il mio lungo studio e il mio grande amore siano utili
trad_divina_commedia_inferno_3_10.csv," O de li altri poeti onore e lume,",Questo mi ha fatto scavare cosi  in profondita  nel tuo volume.
trad_divina_commedia_inferno_3_10.csv,vagliami  l lungo studio e  l grande amore,Tu sei il mio insegnante e il mio autore.
trad_divina_commedia_inferno_3_10.csv,che m ha fatto cercar lo tuo volume.,Sei tu quello da cui solo ho preso
trad_divina_commedia_inferno_3_10.csv,"Tu se  lo mio maestro e  l mio autore,",lo stile nobile che mi ha portato onore.
trad_divina_commedia_inferno_3_10.csv,tu se  solo colui da cu  io tolsi,Guarda la bestia che mi ha costretto a tornare indietro.
trad_divina_commedia_inferno_3_10.csv,lo bello stilo che m ha fatto onore.,"Salvami da lei, famosa salvia..."
trad_divina_commedia_inferno_3_10.csv,Vedi la bestia per cu  io mi volsi ,Mi fa tremare vene e pulsazioni.
trad_divina_commedia_inferno_3_10.csv,"aiutami da lei, famoso saggio,","   un altra strada che dovete seguire, "
trad_divina_commedia_inferno_3_10.csv,ch ella mi fa tremar le vene e i polsi .,"rispose   Quando mi vide piangere,"
trad_divina_commedia_inferno_3_10.csv," A te convien tenere altro v aggio ,",Se tu volessi fuggire da questo posto selvaggio e selvaggio.
trad_divina_commedia_inferno_3_10.csv,"rispuose, poi che lagrimar mi vide,", Per la bestia che ti muove a gridare
trad_divina_commedia_inferno_3_10.csv, se vuo  campar d esto loco selvaggio ,"non lascia che nessuno passi per la sua strada,"
trad_divina_commedia_inferno_3_10.csv,"ch  questa bestia, per la qual tu gride,",ma lo assilla cos  che lei lo uccida.
trad_divina_commedia_inferno_3_10.csv,"non lascia altrui passar per la sua via,",La sua natura e  cosi  viziosa e malvagia.
trad_divina_commedia_inferno_3_10.csv,ma tanto lo  mpedisce che l uccide ,Il suo appetito avido non si sazia mai...
trad_divina_commedia_inferno_3_10.csv,"e ha natura s  malvagia e ria,","Dopo aver nutrito,   pi  affamata che mai."
trad_divina_commedia_inferno_3_10.csv,"che mai non empie la bramosa voglia,","Molte sono le creature con cui si accoppia,"
trad_divina_commedia_inferno_3_10.csv,e dopo  l pasto ha pi  fame che pria.,"e ci sar  ancora di pi , fino al segugio"
trad_divina_commedia_inferno_3_10.csv,"Molti son li animali a cui s ammoglia,",verra  chi la fara  morire nel dolore.
trad_divina_commedia_inferno_3_10.csv,"e pi  saranno ancora, infin che  l veltro", Non si nutrir  n  di terre n  di ricchezze 
trad_divina_commedia_inferno_3_10.csv,"verr , che la far  morir con doglia.","ma sulla saggezza, sull amore e sul potere."
trad_divina_commedia_inferno_3_10.csv,"Questi non ciber  terra n  peltro,",Tra feltro e feltro sar  la sua nascita.
trad_divina_commedia_inferno_3_10.csv,"ma sap enza, amore e virtute,"," Egli sar  la salvezza dell Italia bassa,"
trad_divina_commedia_inferno_3_10.csv,e sua nazion sar  tra feltro e feltro.,"per la quale fanciulla Camilla, Euryalus,"
trad_divina_commedia_inferno_3_10.csv,Di quella umile Italia fia salute,Turno e Niso morirono per le loro ferite.
trad_divina_commedia_inferno_3_10.csv,"per cui mor  la vergine Cammilla,",Caccer  la bestia per ogni citt 
trad_divina_commedia_inferno_3_10.csv,Eurialo e Turno e Niso di ferute.,finch  non l ha rimandata all Inferno
trad_divina_commedia_inferno_3_10.csv,"Questi la caccer  per ogne villa,",Da dove l invidia primordiale l ha lasciata andare.
trad_divina_commedia_inferno_3_10.csv,"fin che l avr  rimessa ne lo  nferno,"," Per questo, per il tuo bene, penso che sia saggio"
trad_divina_commedia_inferno_3_10.csv,l  onde  nvidia prima dipartilla.,"tu mi seguirai  io sar  la tua guida,"
trad_divina_commedia_inferno_3_10.csv,Ond io per lo tuo me  penso e discerno,"guidandovi, da qui, attraverso un luogo eterno"
trad_divina_commedia_inferno_3_10.csv,"che tu mi segui, e io sar  tua guida,", dove sentirete grida disperate
trad_divina_commedia_inferno_3_10.csv,e trarrotti di qui per loco etterno ,e vedere quelle anime antiche nel dolore
trad_divina_commedia_inferno_3_10.csv,"ove udirai le disperate strida,",mentre lamentano la loro seconda morte.
trad_divina_commedia_inferno_3_10.csv,"vedrai li antichi spiriti dolenti,", Allora vedrete quelli che sono contenti
trad_divina_commedia_inferno_3_10.csv,ch a la seconda morte ciascun grida ,"bruciare perch  sperano di venire,"
trad_divina_commedia_inferno_3_10.csv,e vederai color che son contenti,"quando pu  essere, tra i beati."
trad_divina_commedia_inferno_3_10.csv,"nel foco, perch  speran di venire","Se desiderate ascendere a questi,"
trad_divina_commedia_inferno_3_10.csv,quando che sia a le beate genti.,Troverai un anima piu  adatta a guidare di me 
trad_divina_commedia_inferno_3_10.csv,"A le quai poi se tu vorrai salire,",Ti lascero  nelle sue cure quando me ne andro .
trad_divina_commedia_inferno_3_10.csv,anima fia a ci  pi  di me degna , Per l imperatore che ha il suo posto in alto
trad_divina_commedia_inferno_3_10.csv,con lei ti lascer  nel mio partire ,"non vuole, perch  ero un ribelle alla sua legge,"
trad_divina_commedia_inferno_3_10.csv,"ch  quello imperador che l  s  regna,",che dovrei entrare nella Sua citt .
trad_divina_commedia_inferno_3_10.csv,"perch i  fu  ribellante a la sua legge,",In ogni parte regna e l  regna.
trad_divina_commedia_inferno_3_10.csv,non vuol che  n sua citt  per me si vegna.,C   la Sua citt  e il Suo alto seggio.
trad_divina_commedia_inferno_3_10.csv,In tutte parti impera e quivi regge ,Felice colui che Egli sceglie di essere l !. 
trad_divina_commedia_inferno_3_10.csv,quivi   la sua citt  e l alto seggio ,"E io risposi   Poeta, ti supplico"
trad_divina_commedia_inferno_3_10.csv,oh felice colui cu  ivi elegge! .,"per il Dio che non conoscevi,"
trad_divina_commedia_inferno_3_10.csv,"E io a lui   Poeta, io ti richeggio","perch  io possa sfuggire a questo male e peggio,"
trad_divina_commedia_inferno_3_10.csv,"per quello Dio che tu non conoscesti,",Portami nei regni che hai appena descritto.
trad_divina_commedia_inferno_3_10.csv,"acci  ch io fugga questo male e peggio,",per vedere la porta di San Pietro
trad_divina_commedia_inferno_3_10.csv,"che tu mi meni l  dov or dicesti,",e quelli che mi dici sono cos  dolorosi. 
trad_divina_commedia_inferno_3_10.csv,s  ch io veggia la porta di san Pietro,Poi se n e  andato e io sono venuto dietro di lui.
trad_divina_commedia_inferno_3_11.csv,In su l estremit  d un alta ripa,All orlo di una banca alta formata
trad_divina_commedia_inferno_3_11.csv,"che facevan gran pietre rotte in cerchio,",da massi rotti in un cerchio
trad_divina_commedia_inferno_3_11.csv,venimmo sopra pi  crudele stipa ,Ci siamo fermati sopra una folla ancora pi  grave.
trad_divina_commedia_inferno_3_11.csv,"e quivi, per l orribile soperchio","Qui, l insopportabile puzza di fallo"
trad_divina_commedia_inferno_3_11.csv,"del puzzo che  l profondo abisso gitta,",eruttato da quell abisso senza fondo
trad_divina_commedia_inferno_3_11.csv,"ci raccostammo, in dietro, ad un coperchio",ci ha fatto tirare indietro dietro la lastra
trad_divina_commedia_inferno_3_11.csv,"d un grand avello, ov io vidi una scritta","di una tomba imponente, sulla quale ho visto inscritto"
trad_divina_commedia_inferno_3_11.csv,"che dicea   Anastasio papa guardo,",le parole   Ho in mano papa Anastasio 
trad_divina_commedia_inferno_3_11.csv,lo qual trasse Fotin de la via dritta .,Photinus lo attir  dalla retta via. 
trad_divina_commedia_inferno_3_11.csv," Lo nostro scender conviene esser tardo,"," Dobbiamo ritardare la discesa cos  il nostro senso,"
trad_divina_commedia_inferno_3_11.csv,s  che s ausi un poco in prima il senso,"incurato a quel puzzo vile,"
trad_divina_commedia_inferno_3_11.csv,al tristo fiato  e poi no i fia riguardo .,non lo ascolta pi . 
trad_divina_commedia_inferno_3_11.csv,"Cos   l maestro  e io  Alcun compenso ,",Cos  parl  il padrone. Io risposi   Lo so
trad_divina_commedia_inferno_3_11.csv,"dissi lui,  trova che  l tempo non passi",troverai un modo utile per passare questa volta. 
trad_divina_commedia_inferno_3_11.csv,perduto . Ed elli   Vedi ch a ci  penso .,E lui   Vedrete che questo   il mio piano. 
trad_divina_commedia_inferno_3_11.csv," Figliuol mio, dentro da cotesti sassi ,"," Figlio mio,  poi cominci ,  beneath queste rocce"
trad_divina_commedia_inferno_3_11.csv,"cominci  poi a dir,  son tre cerchietti","ci sono tre cerchi, pi  piccoli, uno sotto l altro,"
trad_divina_commedia_inferno_3_11.csv,"di grado in grado, come que  che lassi.",ma altrimenti come quelli che ti lasci alle spalle.
trad_divina_commedia_inferno_3_11.csv,Tutti son pien di spirti maladetti ,Tutti questi sono pieni di anime condannate.
trad_divina_commedia_inferno_3_11.csv,"ma perch  poi ti basti pur la vista,","perch  la sola vista possa essere sufficiente,"
trad_divina_commedia_inferno_3_11.csv,intendi come e perch  son costretti.,Sapere come e perch  sono confinati in questo modo.
trad_divina_commedia_inferno_3_11.csv,"D ogne malizia, ch odio in cielo acquista,",Ogni azione malvagia disprezzata nel Cielo
trad_divina_commedia_inferno_3_11.csv,"ingiuria    l fine, ed ogne fin cotale",ha come fine l ingiustizia.
trad_divina_commedia_inferno_3_11.csv,o con forza o con frode altrui contrista.,danneggia qualcun altro con la forza o con la frode.
trad_divina_commedia_inferno_3_11.csv,"Ma perch  frode   de l uom proprio male,","Ma dato che il vizio della frode e  solo dell uomo,"
trad_divina_commedia_inferno_3_11.csv,pi  spiace a Dio  e per  stan di sotto,"  pi  dispiaciuto a Dio, e cos  il fraudolento"
trad_divina_commedia_inferno_3_11.csv,"li frodolenti, e pi  dolor li assale.","sono pi  in basso, assaliti da un dolore maggiore."
trad_divina_commedia_inferno_3_11.csv,Di v olenti il primo cerchio   tutto , Il primo cerchio tiene il violento
trad_divina_commedia_inferno_3_11.csv,"ma perch  si fa forza a tre persone,","ma   diviso e costruito in tre anelli,"
trad_divina_commedia_inferno_3_11.csv,in tre gironi   distinto e costrutto.,Poich  la violenza assume tre forme diverse.
trad_divina_commedia_inferno_3_11.csv,"A Dio, a s , al prossimo si p ne"," La violenza pu  essere rivolta a Dio, se stesso,"
trad_divina_commedia_inferno_3_11.csv,"far forza, dico in loro e in lor cose,",o al proprio vicino    quindi contro tutti e tre
trad_divina_commedia_inferno_3_11.csv,come udirai con aperta ragione.,o i loro beni... come vi spiegher  ora.
trad_divina_commedia_inferno_3_11.csv,Morte per forza e ferute dogliose, La morte violenta e le ferite gravi possono essere inflitte
trad_divina_commedia_inferno_3_11.csv,"nel prossimo si danno, e nel suo avere",su un vicino o sui suoi beni 
trad_divina_commedia_inferno_3_11.csv,"ruine, incendi e tollette dannose ","saccheggio, incendio doloso e furto violento."
trad_divina_commedia_inferno_3_11.csv,"onde omicide e ciascun che mal fiere,", E cos  assassini e tutti coloro che feriscono
trad_divina_commedia_inferno_3_11.csv,"guastatori e predon, tutti tormenta","ingiustamente, spoiler e saccheggiatori    il primo anello"
trad_divina_commedia_inferno_3_11.csv,lo giron primo per diverse schiere.,punisce tutti questi in gruppi separati.
trad_divina_commedia_inferno_3_11.csv,Puote omo avere in s  man v olenta, Un uomo pu  posare mani dannose su di s 
trad_divina_commedia_inferno_3_11.csv,e ne  suoi beni  e per  nel secondo,"o sui suoi beni, e per questo motivo"
trad_divina_commedia_inferno_3_11.csv,giron convien che sanza pro si penta,nel secondo anello deve pentirsi invano
trad_divina_commedia_inferno_3_11.csv,"qualunque priva s  del vostro mondo,", che si deruba del mondo in alto
trad_divina_commedia_inferno_3_11.csv,"biscazza e fonde la sua facultade,","o scommette e spreca la sua sostanza,"
trad_divina_commedia_inferno_3_11.csv,e piange l  dov esser de  giocondo.,che si lamenta quando deve rallegrarsi.
trad_divina_commedia_inferno_3_11.csv,"Puossi far forza ne la de tade,", La violenza pu  essere commessa contro Dio
trad_divina_commedia_inferno_3_11.csv,"col cor negando e bestemmiando quella,","quando lo rinneghiamo e lo malediciamo nei nostri cuori,"
trad_divina_commedia_inferno_3_11.csv,e spregiando natura e sua bontade ,o quando disprezziamo la natura e la sua grazia.
trad_divina_commedia_inferno_3_11.csv,e per  lo minor giron suggella,E cos  il pi  piccolo francobollo con il suo sigillo
trad_divina_commedia_inferno_3_11.csv,del segno suo e Soddoma e Caorsa,Sodoma e Cahor e quelli
trad_divina_commedia_inferno_3_11.csv,"e chi, spregiando Dio col cor, favella.",che lo disprezzano con le loro lingue e i loro cuori.
trad_divina_commedia_inferno_3_11.csv,"La frode, ond ogne cosc enza   morsa,"," Frode si stuzzica ad ogni coscienza,"
trad_divina_commedia_inferno_3_11.csv,pu  l omo usare in colui che  n lui fida,se usato su chi si fidava
trad_divina_commedia_inferno_3_11.csv,e in quel che fidanza non imborsa.,o a chi mancava di tale fede.
trad_divina_commedia_inferno_3_11.csv,Questo modo di retro par ch incida, Frode contro quest ultimo solo severs
trad_divina_commedia_inferno_3_11.csv,pur lo vinco d amor che fa natura ,il legame d amore che la natura crea.
trad_divina_commedia_inferno_3_11.csv,onde nel cerchio secondo s annida,Cos  nel nido del secondo cerchio
trad_divina_commedia_inferno_3_11.csv,"ipocresia, lusinghe e chi affattura,"," Ipotesi, lusinghe e stregoni "
trad_divina_commedia_inferno_3_11.csv,"falsit , ladroneccio e simonia,","menzogne, furti e simonie "
trad_divina_commedia_inferno_3_11.csv,"ruffian, baratti e simile lordura.","brandelli, barattori, e tutta questa sporcizia."
trad_divina_commedia_inferno_3_11.csv,Per l altro modo quell amor s oblia, Frode contro il fidarsi non riesce a prendere in considerazione
trad_divina_commedia_inferno_3_11.csv,"che fa natura, e quel ch   poi aggiunto,",non solo l amore naturale ma il legame aggiunto
trad_divina_commedia_inferno_3_11.csv,di che la fede spez al si cria ,"di fede, che forma un particolare tipo di fiducia."
trad_divina_commedia_inferno_3_11.csv,"onde nel cerchio minore, ov    l punto"," Perci , nel cerchio pi  stretto,"
trad_divina_commedia_inferno_3_11.csv,"de l universo in su che Dite siede,","il centro dell universo e la sede di Dis,"
trad_divina_commedia_inferno_3_11.csv,qualunque trade in etterno   consunto .,tutti i traditori sono consumati in eterno. 
trad_divina_commedia_inferno_3_11.csv,"E io   Maestro, assai chiara procede","E io   Maestro, il tuo conto   chiaro"
trad_divina_commedia_inferno_3_11.csv,"la tua ragione, e assai ben distingue",e designa chiaramente la natura
trad_divina_commedia_inferno_3_11.csv,questo bar tro e  l popol ch e  possiede.,di questo abisso e dei suoi abitanti.
trad_divina_commedia_inferno_3_11.csv,"Ma dimmi  quei de la palude pingue,","Ma dimmi, quegli spiriti nella palude viscosa,"
trad_divina_commedia_inferno_3_11.csv,"che mena il vento, e che batte la pioggia,","che il vento spinge, che la pioggia batte,"
trad_divina_commedia_inferno_3_11.csv,"e che s incontran con s  aspre lingue,","quelli che si scontrano con tali lingue amare,"
trad_divina_commedia_inferno_3_11.csv,perch  non dentro da la citt  roggia,Perche  non vengono puniti all interno della citta  ardente?
trad_divina_commedia_inferno_3_11.csv,"sono ei puniti, se Dio li ha in ira?",se l ira di Dio   su di loro?
trad_divina_commedia_inferno_3_11.csv,"e se non li ha, perch  sono a tal foggia? .","E se no, perch  sono cos  afflitti?  "
trad_divina_commedia_inferno_3_11.csv,"Ed elli a me  Perch  tanto delira ,",E lui   Non spesso fai il tuo ingegno smarrito
trad_divina_commedia_inferno_3_11.csv,"disse,  lo  ngegno tuo da quel che s le?","lontano afield, come fanno ora    o   la vostra mente"
trad_divina_commedia_inferno_3_11.csv,o ver la mente dove altrove mira?,Voleva inseguire altri pensieri?
trad_divina_commedia_inferno_3_11.csv,Non ti rimembra di quelle parole, Non ti ricordi le parole
trad_divina_commedia_inferno_3_11.csv,con le quai la tua Etica pertratta,la tua etica usa per esporre
trad_divina_commedia_inferno_3_11.csv,"le tre disposizion che  l ciel non vole,","le tre disposizioni del Cielo si oppone,"
trad_divina_commedia_inferno_3_11.csv,"incontenenza, malizia e la matta"," lncontinence, malizia, e follia brutishness,"
trad_divina_commedia_inferno_3_11.csv,bestialitade? e come incontenenza,e come l incontinenza offende Dio meno
trad_divina_commedia_inferno_3_11.csv,men Dio offende e men biasimo accatta?,e incorre in una colpa minore?
trad_divina_commedia_inferno_3_11.csv,"Se tu riguardi ben questa sentenza,", Se consideri bene questo giudizio
trad_divina_commedia_inferno_3_11.csv,e rechiti a la mente chi son quelli,e considera chi sono
trad_divina_commedia_inferno_3_11.csv,"che s  di fuor sostegnon penitenza,","che soffrono il castigo al di sopra, fuori del muro,"
trad_divina_commedia_inferno_3_11.csv,tu vedrai ben perch  da questi felli,Capirai perche  sono separati.
trad_divina_commedia_inferno_3_11.csv,"sien dipartiti, e perch  men crucciata",da questi spiriti malvagi e perch  la vendetta di Dio
trad_divina_commedia_inferno_3_11.csv,la divina vendetta li martelli .,li colpir  di ira minore. 
trad_divina_commedia_inferno_3_11.csv," O sol che sani ogne vista turbata,"," O sole che guarisce ogni vista turbata,"
trad_divina_commedia_inferno_3_11.csv,"tu mi contenti s  quando tu solvi,",mi hai cos  soddisfatto risolvendo i dubbi
trad_divina_commedia_inferno_3_11.csv,"che, non men che saver, dubbiar m aggrata.",Mi fa piacere non meno domandare che sapere.
trad_divina_commedia_inferno_3_11.csv,"Ancora in dietro un poco ti rivolvi ,","  Ma torna un po  indietro   dissi,"
trad_divina_commedia_inferno_3_11.csv,"diss io,  l  dove di  ch usura offende",  Dove mi hai detto che l usura offende  
trad_divina_commedia_inferno_3_11.csv,"la divina bontade, e  l groppo solvi .","Buon Dio, e slega quel nodo per me. "
trad_divina_commedia_inferno_3_11.csv," Filosofia , mi disse,  a chi la  ntende,"," Filosofia, per chi la capisce,"
trad_divina_commedia_inferno_3_11.csv,"nota, non pure in una sola parte,","osserva   disse   e non in un solo luogo,"
trad_divina_commedia_inferno_3_11.csv,come natura lo suo corso prende,come la natura fa il suo corso
trad_divina_commedia_inferno_3_11.csv,dal divino  ntelletto e da sua arte ,dall intelletto celeste e dal suo funzionamento.
trad_divina_commedia_inferno_3_11.csv,"e se tu ben la tua Fisica note,","E se studiate bene la vostra Fisica,"
trad_divina_commedia_inferno_3_11.csv,"tu troverai, non dopo molte carte,","troverete, dopo non troppe pagine,"
trad_divina_commedia_inferno_3_11.csv,"che l arte vostra quella, quanto pote,"," quella fatica umana, per quanto puo ,"
trad_divina_commedia_inferno_3_11.csv,"segue, come  l maestro fa  l discente ","segue la natura, come l allievo fa il suo padrone,"
trad_divina_commedia_inferno_3_11.csv,s  che vostr  arte a Dio quasi   nepote.,"in modo che sia il nipote di Dio, per cos  dire."
trad_divina_commedia_inferno_3_11.csv,"Da queste due, se tu ti rechi a mente","Per fatica e natura, se ricordate Genesi,"
trad_divina_commedia_inferno_3_11.csv,"lo Genes  dal principio, convene","vicino all inizio,   il lotto dell uomo"
trad_divina_commedia_inferno_3_11.csv,prender sua vita e avanzar la gente ,per guadagnare il suo pane e prosperare.
trad_divina_commedia_inferno_3_11.csv,"e perch  l usuriere altra via tene,"," L usuratore, che prende un altro sentiero,"
trad_divina_commedia_inferno_3_11.csv,per s  natura e per la sua seguace,"disprezza la natura in se stessa e nel suo seguace,"
trad_divina_commedia_inferno_3_11.csv,"dispregia, poi ch in altro pon la spene.",e altrove pone le sue speranze.
trad_divina_commedia_inferno_3_11.csv,Ma seguimi oramai che  l gir mi piace ,"Ma seguimi ora, perche  e  ora di andare."
trad_divina_commedia_inferno_3_11.csv,"ch  i Pesci guizzan su per l orizzonta,",I pesci tremano all orizzonte
trad_divina_commedia_inferno_3_11.csv,"e  l Carro tutto sovra  l Coro giace,","e tutto il Wain giace sopra Caurus. E qui,"
trad_divina_commedia_inferno_3_11.csv,e  l balzo via l  oltra si dismonta .,"una breve via d uscita,   la discesa. "
trad_divina_commedia_inferno_3_12.csv,Era lo loco ov a scender la riva,"Steep era il dirupo che abbiamo dovuto arrampicarci,"
trad_divina_commedia_inferno_3_12.csv,"venimmo, alpestro e, per quel che v er  anco,","roccioso e ripido, ma... ancora peggio..."
trad_divina_commedia_inferno_3_12.csv,"tal, ch ogne vista ne sarebbe schiva.",una vista che ogni occhio avrebbe evitato.
trad_divina_commedia_inferno_3_12.csv,Qual   quella ruina che nel fianco,Come sulla frana rocciosa che ancora segna il fianco
